Sheet: ForStrings
C1: Recruitment FMP | F1: Use in statstrings | I1: Weights (PC)
A2: Name: | B2: Sheet | C2: min | D2: max | E2: limit | F2: Too weak | G2: adequate | H2: legendary | I2: Too weak | J2: adequate | K2: legendary
A3: Time units | B3: TU | C3: 50 | D3: 60 | E3: 80 | F3: of:=([.D3]-[.C3])*[.I3]/100+[.C3] -> 52 | G3: 60 | H3: 74 | I3: 20 | J3: 75 | K3: 80
A4: Stamina | B4: stamina | C4: 40 | D4: 70 | E4: 100 | F4: of:=([.D4]-[.C4])*[.I4]/100+[.C4] -> 44.5 | G4: 60 | H4: 88 | I4: 15 | J4: 75 | K4: 80
A5: Health | B5: health | C5: 25 | D5: 40 | E5: 60 | F5: of:=([.D5]-[.C5])*[.I5]/100+[.C5] -> 27.25 | G5: 37 | H5: 53 | I5: 15 | J5: 75 | K5: 80
A6: Bravery | B6: bravery | C6: 10 | D6: 60 | E6: 100 | F6: of:=([.D6]-[.C6])*[.I6]/100+[.C6] -> 15 | G6: 50 | H6: 82 | I6: 10 | J6: 80 | K6: 80
A7: Reactions | B7: reactions | C7: 30 | D7: 60 | E7: 100 | F7: 35 | G7: 53 | H7: 86 | I7: 15 | J7: 80 | K7: 80
A8: Firing Accuracy | B8: firing | C8: 40 | D8: 70 | E8: 120 | F8: 45 | G8: 64 | H8: 104 | I8: 15 | J8: 75 | K8: 80
A9: Throwing Accuracy | B9: throwing | C9: 50 | D9: 80 | E9: 120 | F9: 52 | G9: 72 | H9: 106 | I9: 15 | J9: 75 | K9: 80
A10: Melee Accuracy | B10: melee | C10: 20 | D10: 70 | E10: 120 | F10: of:=([.D10]-[.C10])*[.I10]/100+[.C10] -> 27.5 | G10: 55 | H10: 100 | I10: 15 | J10: 75 | K10: 80
A11: Strength | B11: strength | C11: 20 | D11: 40 | E11: 70 | F11: 22 | G11: 35 | H11: 60 | I11: 15 | J11: 75 | K11: 80
A12: Psi Strength | B12: psiStrength | C12: 0 | D12: 100 | E12: 100 | F12: 34 | G12: 66 | H12: 85 | I12: 30 | J12: 60 | K12: 90
A13: Psi Skill | B13: psiSkill | C13: 16 | D13: 24 | E13: 100 | F13: 16 | G13: 60 | H13: 80 | I13: 0 | J13: 70 | K13: 90
C14: Current Stat | E14: Time units | F14: of:=[Stats.K2] -> 52 | G14: of:=[Stats.L3] -> 59 | H14: of:=IF(ISERR([Stats.M4]); [Stats.M3]; MAX([Stats.M3:Stats.M4])) -> 63
B16: Combined Below | F16: Current statstrings | J16: Recruitment OXC default
A17: Name: | B17: Too weak | C17: adequate | D17: legendary | E17: Name: | F17: Too weak | G17: adequate | H17: legendary | J17: min | K17: max | L17: limit
A18: Time units | B18: of:=IF(MAX([.B32];[.F32])=0;"";MAX([.B32];[.F32])) ->  | C18: of:=IF(MAX([.C32];[.G32])=0;"";MAX([.C32];[.G32])) -> 60 | D18: of:=IF(MAX([.D32];[.H32])=0;"";MAX([.D32];[.H32])) ->  | E18: Time units | G18: 60 | H18: 74 | J18: 50 | K18: 60 | L18: 80
A19: Stamina | B19: of:=IF(MAX([.B33];[.F33])=0;"";MAX([.B33];[.F33])) -> 40 | C19: of:=IF(MAX([.C33];[.G33])=0;"";MAX([.C33];[.G33])) -> 60 | D19: of:=IF(MAX([.D33];[.H33])=0;"";MAX([.D33];[.H33])) ->  | E19: Stamina | G19: 60 | H19: 88 | J19: 40 | K19: 70 | L19: 100
A20: Health | B20: of:=IF(MAX([.B34];[.F34])=0;"";MAX([.B34];[.F34])) -> 29 | C20: of:=IF(MAX([.C34];[.G34])=0;"";MAX([.C34];[.G34])) -> 60 | D20: of:=IF(MAX([.D34];[.H34])=0;"";MAX([.D34];[.H34])) ->  | E20: Health | G20: 37 | H20: 53 | J20: 25 | K20: 40 | L20: 60
A21: Bravery | B21: of:=IF(MAX([.B35];[.F35])=0;"";MAX([.B35];[.F35])) -> 10 | C21: of:=IF(MAX([.C35];[.G35])=0;"";MAX([.C35];[.G35])) -> 60 | D21: of:=IF(MAX([.D35];[.H35])=0;"";MAX([.D35];[.H35])) ->  | E21: Bravery | F21: 15 | G21: 50 | H21: 82 | J21: 10 | K21: 60 | L21: 100
A22: Reactions | B22: of:=IF(MAX([.B36];[.F36])=0;"";MAX([.B36];[.F36])) -> 40 | C22: of:=IF(MAX([.C36];[.G36])=0;"";MAX([.C36];[.G36])) -> 50 | D22: of:=IF(MAX([.D36];[.H36])=0;"";MAX([.D36];[.H36])) -> 60 | E22: Reactions | F22: 35 | G22: 53 | H22: 86 | J22: 30 | K22: 60 | L22: 100
A23: Firing Accuracy | B23: of:=IF(MAX([.B37];[.F37])=0;"";MAX([.B37];[.F37])) -> 45 | C23: of:=IF(MAX([.C37];[.G37])=0;"";MAX([.C37];[.G37])) -> 60 | D23: of:=IF(MAX([.D37];[.H37])=0;"";MAX([.D37];[.H37])) -> 70 | E23: Firing Accuracy | F23: 45 | G23: 64 | H23: 104 | J23: 40 | K23: 70 | L23: 120
A24: Throwing Accuracy | B24: of:=IF(MAX([.B38];[.F38])=0;"";MAX([.B38];[.F38])) ->  | C24: of:=IF(MAX([.C38];[.G38])=0;"";MAX([.C38];[.G38])) -> 60 | D24: of:=IF(MAX([.D38];[.H38])=0;"";MAX([.D38];[.H38])) ->  | E24: Throwing Accuracy | F24: 52 | G24: 72 | H24: 106 | J24: 50 | K24: 80 | L24: 120
A25: Melee Accuracy | B25: of:=IF(MAX([.B39];[.F39])=0;"";MAX([.B39];[.F39])) ->  | C25: of:=IF(MAX([.C39];[.G39])=0;"";MAX([.C39];[.G39])) ->  | D25: of:=IF(MAX([.D39];[.H39])=0;"";MAX([.D39];[.H39])) ->  | E25: Melee Accuracy | G25: 55 | H25: 100 | J25: 20 | K25: 40 | L25: 120
A26: Strength | B26: of:=IF(MAX([.B40];[.F40])=0;"";MAX([.B40];[.F40])) -> 25 | C26: of:=IF(MAX([.C40];[.G40])=0;"";MAX([.C40];[.G40])) -> 40 | D26: of:=IF(MAX([.D40];[.H40])=0;"";MAX([.D40];[.H40])) -> 50 | E26: Strength | F26: 22 | G26: 35 | H26: 60 | J26: 20 | K26: 40 | L26: 70
A27: Psi Strength | B27: of:=IF(MAX([.B41];[.F41])=0;"";MAX([.B41];[.F41])) -> 30 | C27: of:=IF(MAX([.C41];[.G41])=0;"";MAX([.C41];[.G41])) -> 60 | D27: of:=IF(MAX([.D41];[.H41])=0;"";MAX([.D41];[.H41])) -> 80 | E27: Psi Strength | F27: 34 | G27: 66 | H27: 85 | J27: 0 | K27: 100 | L27: 100
A28: Psi Skill | B28: of:=IF(MAX([.B42];[.F42])=0;"";MAX([.B42];[.F42])) ->  | C28: of:=IF(MAX([.C42];[.G42])=0;"";MAX([.C42];[.G42])) -> 60 | D28: of:=IF(MAX([.D42];[.H42])=0;"";MAX([.D42];[.H42])) -> 60 | E28: Psi Skill | F28: 16 | G28: 60 | H28: 80 | J28: 16 | K28: 24 | L28: 100
B30: Warboy | F30: Xcom Util | J30: Based on fixed PCs
A31: Name: | B31: Too weak | C31: adequate | D31: legendary | E31: Name: | F31: Too weak | G31: adequate | H31: legendary | I31: Name: | J31: Too weak | K31: adequate | L31: legendary
A32: Time units | E32: Time units | G32: 60 | I32: Time units | J32: of:=([.$D3]-[.$C3])*[.I3]/100+[.$C3] -> 52 | K32: of:=([.$D3]-[.$C3])*[.J3]/100+[.$C3] -> 57.5 | L32: of:=([.$E3]-[.$C3])*[.K3]/100+[.$C3] -> 74
A33: Stamina | B33: 40 | C33: 60 | E33: Stamina | I33: Stamina | J33: of:=([.$D4]-[.$C4])*[.I4]/100+[.$C4] -> 44.5 | K33: of:=([.$D4]-[.$C4])*[.J4]/100+[.$C4] -> 62.5 | L33: of:=([.$E4]-[.$C4])*[.K4]/100+[.$C4] -> 88
A34: Health | B34: 29 | C34: 60 | E34: Health | I34: Health | J34: of:=([.$D5]-[.$C5])*[.I5]/100+[.$C5] -> 27.25 | K34: of:=([.$D5]-[.$C5])*[.J5]/100+[.$C5] -> 36.25 | L34: of:=([.$E5]-[.$C5])*[.K5]/100+[.$C5] -> 53
A35: Bravery | B35: 10 | E35: Bravery | F35: 10 | G35: 60 | I35: Bravery | J35: of:=([.$D6]-[.$C6])*[.I6]/100+[.$C6] -> 15 | K35: of:=([.$D6]-[.$C6])*[.J6]/100+[.$C6] -> 50 | L35: of:=([.$E6]-[.$C6])*[.K6]/100+[.$C6] -> 82
A36: Reactions | B36: 40 | C36: 50 | D36: 60 | E36: Reactions | G36: 50 | H36: 60 | I36: Reactions | J36: of:=([.$D7]-[.$C7])*[.I7]/100+[.$C7] -> 34.5 | K36: of:=([.$D7]-[.$C7])*[.J7]/100+[.$C7] -> 54 | L36: of:=([.$E7]-[.$C7])*[.K7]/100+[.$C7] -> 86
A37: Firing Accuracy | B37: 45 | C37: 60 | D37: 70 | E37: Firing Accuracy | G37: 60 | H37: 70 | I37: Firing Accuracy | J37: of:=([.$D8]-[.$C8])*[.I8]/100+[.$C8] -> 44.5 | K37: of:=([.$D8]-[.$C8])*[.J8]/100+[.$C8] -> 62.5 | L37: of:=([.$E8]-[.$C8])*[.K8]/100+[.$C8] -> 104
A38: Throwing Accuracy | C38: 60 | E38: Throwing Accuracy | I38: Throwing Accuracy | J38: of:=([.$D9]-[.$C9])*[.I9]/100+[.$C9] -> 54.5 | K38: of:=([.$D9]-[.$C9])*[.J9]/100+[.$C9] -> 72.5 | L38: of:=([.$E9]-[.$C9])*[.K9]/100+[.$C9] -> 106
A39: Melee Accuracy | E39: Melee Accuracy | I39: Melee Accuracy | J39: of:=([.$D10]-[.$C10])*[.I10]/100+[.$C10] -> 27.5 | K39: of:=([.$D10]-[.$C10])*[.J10]/100+[.$C10] -> 57.5 | L39: of:=([.$E10]-[.$C10])*[.K10]/100+[.$C10] -> 100
A40: Strength | B40: 20 | C40: 40 | D40: 50 | E40: Strength | F40: 25 | I40: Strength | J40: of:=([.$D11]-[.$C11])*[.I11]/100+[.$C11] -> 23 | K40: of:=([.$D11]-[.$C11])*[.J11]/100+[.$C11] -> 35 | L40: of:=([.$E11]-[.$C11])*[.K11]/100+[.$C11] -> 60
A41: Psi Strength | B41: 30 | E41: Psi Strength | F41: 30 | G41: 60 | H41: 80 | I41: Psi Strength | J41: of:=([.$D12]-[.$C12])*[.I12]/100+[.$C12] -> 30 | K41: of:=([.$D12]-[.$C12])*[.J12]/100+[.$C12] -> 60 | L41: of:=([.$E12]-[.$C12])*[.K12]/100+[.$C12] -> 90
A42: Psi Skill | C42: 60 | E42: Psi Skill | G42: 30 | H42: 60 | I42: Psi Skill | J42: of:=([.$D13]-[.$C13])*[.I13]/100+[.$C13] -> 16 | K42: of:=([.$E13]-[.$C13])*[.J13]/100+[.$C13] -> 74.8 | L42: of:=([.$E13]-[.$C13])*[.K13]/100+[.$C13] -> 91.6

Sheet: Stats
A1: Statistic: | C1: of:=[$ForStrings.$E$14] -> Time units | G1: min | H1: max | I1: median | J1: mode | K1: of:=CONCATENATE("Pctl ";[.$C$2]) -> Pctl 20 | L1: of:=CONCATENATE("Pctl ";[.$C$3]) -> Pctl 75 | M1: of:=CONCATENATE("Pctl ";[.$C$4]) -> Pctl 80 | N1: mean | O1: std | P1: avedev | Q1: Enough datapoints? | T1: of:=IF([.T3]<COUNT([.G26:.G1026]);TRUE();FALSE()) -> true
A2: Percentile low | C2: of:=VLOOKUP([.C1];SoldierStats;COLUMN([$ForStrings.$I$2]);0) -> 20 | E2: Initial | G2: of:=MIN(OFFSET([.$A$25];1; 0  ;[.$T$3];1)) -> 50 | H2: of:=MAX(OFFSET([.$A$25];1; 0  ;[.$T$3];1)) -> 60 | I2: of:=MEDIAN(OFFSET([.$A$25];1; 0  ;[.$T$3];1)) -> 56 | J2: of:=MODE(OFFSET([.$A$25];1; 0  ;[.$T$3];1)) -> 52 | K2: of:=PERCENTILE(OFFSET([.$A$25];1; 0  ;[.$T$3];1);[.$C$2]/100) -> 52 | L2: of:=PERCENTILE(OFFSET([.$A$25];1; 0  ;[.$T$3];1);[.$C$3]/100) -> 58 | M2: of:=PERCENTILE(OFFSET([.$A$25];1; 0  ;[.$T$3];1);[.$C$4]/100) -> 59 | N2: of:=AVERAGE(OFFSET([.$A$25];1; 0  ;[.$T$3];1)) -> 55.421052631579 | O2: of:=STDEV(OFFSET([.$A$25];1; 0  ;[.$T$3];1)) -> 3.19139592881887 | P2: of:=AVEDEV(OFFSET([.$A$25];1; 0  ;[.$T$3];1)) -> 2.79382667194302 | Q2: Sheet: | T2: of:=VLOOKUP([.C1];SoldierStats;2;0) -> TU
A3: Percentile medium | C3: of:=VLOOKUP([.C1];SoldierStats;COLUMN([$ForStrings.$J$2]);0) -> 75 | E3: Current / All | G3: of:=MIN(OFFSET([.$B$25];1; 0  ;[.$T$3];1)) -> 50 | H3: of:=MAX(OFFSET([.$B$25];1; 0  ;[.$T$3];1)) -> 70 | I3: of:=MEDIAN(OFFSET([.$B$25];1; 0  ;[.$T$3];1)) -> 58 | J3: of:=MODE(OFFSET([.$B$25];1; 0  ;[.$T$3];1)) -> 59 | K3: of:=PERCENTILE(OFFSET([.$B$25];1; 0  ;[.$T$3];1);[.$C$2]/100) -> 53 | L3: of:=PERCENTILE(OFFSET([.$B$25];1; 0  ;[.$T$3];1);[.$C$3]/100) -> 59 | M3: of:=PERCENTILE(OFFSET([.$B$25];1; 0  ;[.$T$3];1);[.$C$4]/100) -> 59.6 | N3: of:=AVERAGE(OFFSET([.$B$25];1; 0  ;[.$T$3];1)) -> 57.015037593985 | O3: of:=STDEV(OFFSET([.$B$25];1; 0  ;[.$T$3];1)) -> 3.8395567973519 | P3: of:=AVEDEV(OFFSET([.$B$25];1; 0  ;[.$T$3];1)) -> 3.12770648425575 | Q3: # of soldiers max: | T3: of:=ROWS(S_Time_units)/2 -> 187
A4: Percentile high | C4: of:=VLOOKUP([.C1];SoldierStats;COLUMN([$ForStrings.$K$2]);0) -> 80 | E4: Improved only | G4: of:=MIN(OFFSET([.$C$25];1; 0  ;[.$T$3];1)) -> 53 | H4: of:=MAX(OFFSET([.$C$25];1; 0  ;[.$T$3];1)) -> 70 | I4: of:=MEDIAN(OFFSET([.$C$25];1; 0  ;[.$T$3];1)) -> 59 | J4: of:=MODE(OFFSET([.$C$25];1; 0  ;[.$T$3];1)) -> 59 | K4: of:=PERCENTILE(OFFSET([.$C$25];1; 0  ;[.$T$3];1);[.$C$2]/100) -> 56.4 | L4: of:=PERCENTILE(OFFSET([.$C$35];1; 0  ;[.$T$3];1);[.$C$3]/100) -> 62 | M4: of:=PERCENTILE(OFFSET([.$C$25];1; 0  ;[.$T$3];1);[.$C$4]/100) -> 63 | N4: of:=AVERAGE(OFFSET([.$C$25];1; 0  ;[.$T$3];1)) -> 59.5416666666667 | O4: of:=STDEV(OFFSET([.$C$25];1; 0  ;[.$T$3];1)) -> 3.63176490319194 | P4: of:=AVEDEV(OFFSET([.$C$25];1; 0  ;[.$T$3];1)) -> 2.96527777777778 | Q4: save split ~ | S4: of:=230/2 -> 115
A25: Initial | B25: Current | C25: Improved only | D25: Initial helper | E25: Current helper | F25: psiSkill helper | G25: Use value | H25: of:=CONCATENATE("Min value = ";[.H26]) -> Min value = 50 | I25: of:=CONCATENATE("Max value = ";[.I26]) -> Max value = 80
A26: of:=IF([.$T$2]="psiSkill";  IF([.E26]=[.F26];[.B26];[.E26]-[.F26]); [.D26]) -> 55 | B26: of:=IF([.$T$2]="psiSkill";  IF([.E26]=0;"";[.E26]); [.E26]) -> 55 | C26: of:=IF([.A26]=[.B26];"" ;[.B26]) ->  | D26: of:=IF([.G26];MIN(OFFSET(INDIRECT( ADDRESS(1;1; 1; ;[.$T$2])); (ROW() -26) * 2 ;0;2;1));"") -> 55 | E26: of:=IF([.G26];MAX(OFFSET(INDIRECT( ADDRESS(1;1; 1; ;[.$T$2])); (ROW() -26) * 2  ;0;2;1));"") -> 55 | F26: of:=IF([.G26];IF([.$T$2]="psiSkill";INDIRECT( ADDRESS((ROW()-25);1; 1; ;"ImprovedPsiSkill"));"");"") ->  | G26: of:=IF( INDIRECT( ADDRESS((ROW()-25)*2-1;1; 1;;"TU"))=0; FALSE();TRUE()) -> true | H26: of:=IF([.G26];VLOOKUP([.$C$1];SoldierStats;3;0)) -> 50 | I26: of:=IF([.G26];VLOOKUP([.$C$1];SoldierStats;5;0)) -> 80
A27: of:=IF([.$T$2]="psiSkill";  IF([.E27]=[.F27];[.B27];[.E27]-[.F27]); [.D27]) -> 60 | B27: of:=IF([.$T$2]="psiSkill";  IF([.E27]=0;"";[.E27]); [.E27]) -> 62 | C27: of:=IF([.A27]=[.B27];"" ;[.B27]) -> 62 | D27: of:=IF([.G27];MIN(OFFSET(INDIRECT( ADDRESS(1;1; 1; ;[.$T$2])); (ROW() -26) * 2 ;0;2;1));"") -> 60 | E27: of:=IF([.G27];MAX(OFFSET(INDIRECT( ADDRESS(1;1; 1; ;[.$T$2])); (ROW() -26) * 2  ;0;2;1));"") -> 62 | F27: of:=IF([.G27];IF([.$T$2]="psiSkill";INDIRECT( ADDRESS((ROW()-25);1; 1; ;"ImprovedPsiSkill"));"");"") ->  | G27: of:=IF( INDIRECT( ADDRESS((ROW()-25)*2-1;1; 1;;"TU"))=0; FALSE();TRUE()) -> true | H27: of:=IF([.$G27];[.H$26];"") -> 50 | I27: of:=IF([.$G27];[.I$26];"") -> 80
A28: of:=IF([.$T$2]="psiSkill";  IF([.E28]=[.F28];[.B28];[.E28]-[.F28]); [.D28]) -> 58 | B28: of:=IF([.$T$2]="psiSkill";  IF([.E28]=0;"";[.E28]); [.E28]) -> 58 | C28: of:=IF([.A28]=[.B28];"" ;[.B28]) ->  | D28: of:=IF([.G28];MIN(OFFSET(INDIRECT( ADDRESS(1;1; 1; ;[.$T$2])); (ROW() -26) * 2 ;0;2;1));"") -> 58 | E28: of:=IF([.G28];MAX(OFFSET(INDIRECT( ADDRESS(1;1; 1; ;[.$T$2])); (ROW() -26) * 2  ;0;2;1));"") -> 58 | F28: of:=IF([.G28];IF([.$T$2]="psiSkill";INDIRECT( ADDRESS((ROW()-25);1; 1; ;"ImprovedPsiSkill"));"");"") ->  | G28: of:=IF( INDIRECT( ADDRESS((ROW()-25)*2-1;1; 1;;"TU"))=0; FALSE();TRUE()) -> true | H28: of:=IF([.$G28];[.H$26];"") -> 50 | I28: of:=IF([.$G28];[.I$26];"") -> 80
A29: of:=IF([.$T$2]="psiSkill";  IF([.E29]=[.F29];[.B29];[.E29]-[.F29]); [.D29]) -> 60 | B29: of:=IF([.$T$2]="psiSkill";  IF([.E29]=0;"";[.E29]); [.E29]) -> 60 | C29: of:=IF([.A29]=[.B29];"" ;[.B29]) ->  | D29: of:=IF([.G29];MIN(OFFSET(INDIRECT( ADDRESS(1;1; 1; ;[.$T$2])); (ROW() -26) * 2 ;0;2;1));"") -> 60 | E29: of:=IF([.G29];MAX(OFFSET(INDIRECT( ADDRESS(1;1; 1; ;[.$T$2])); (ROW() -26) * 2  ;0;2;1));"") -> 60 | F29: of:=IF([.G29];IF([.$T$2]="psiSkill";INDIRECT( ADDRESS((ROW()-25);1; 1; ;"ImprovedPsiSkill"));"");"") ->  | G29: of:=IF( INDIRECT( ADDRESS((ROW()-25)*2-1;1; 1;;"TU"))=0; FALSE();TRUE()) -> true | H29: of:=IF([.$G29];[.H$26];"") -> 50 | I29: of:=IF([.$G29];[.I$26];"") -> 80
A30: of:=IF([.$T$2]="psiSkill";  IF([.E30]=[.F30];[.B30];[.E30]-[.F30]); [.D30]) -> 59 | B30: of:=IF([.$T$2]="psiSkill";  IF([.E30]=0;"";[.E30]); [.E30]) -> 59 | C30: of:=IF([.A30]=[.B30];"" ;[.B30]) ->  | D30: of:=IF([.G30];MIN(OFFSET(INDIRECT( ADDRESS(1;1; 1; ;[.$T$2])); (ROW() -26) * 2 ;0;2;1));"") -> 59 | E30: of:=IF([.G30];MAX(OFFSET(INDIRECT( ADDRESS(1;1; 1; ;[.$T$2])); (ROW() -26) * 2  ;0;2;1));"") -> 59 | F30: of:=IF([.G30];IF([.$T$2]="psiSkill";INDIRECT( ADDRESS((ROW()-25);1; 1; ;"ImprovedPsiSkill"));"");"") ->  | G30: of:=IF( INDIRECT( ADDRESS((ROW()-25)*2-1;1; 1;;"TU"))=0; FALSE();TRUE()) -> true | H30: of:=IF([.$G30];[.H$26];"") -> 50 | I30: of:=IF([.$G30];[.I$26];"") -> 80
A31: of:=IF([.$T$2]="psiSkill";  IF([.E31]=[.F31];[.B31];[.E31]-[.F31]); [.D31]) -> 58 | B31: of:=IF([.$T$2]="psiSkill";  IF([.E31]=0;"";[.E31]); [.E31]) -> 58 | C31: of:=IF([.A31]=[.B31];"" ;[.B31]) ->  | D31: of:=IF([.G31];MIN(OFFSET(INDIRECT( ADDRESS(1;1; 1; ;[.$T$2])); (ROW() -26) * 2 ;0;2;1));"") -> 58 | E31: of:=IF([.G31];MAX(OFFSET(INDIRECT( ADDRESS(1;1; 1; ;[.$T$2])); (ROW() -26) * 2  ;0;2;1));"") -> 58 | F31: of:=IF([.G31];IF([.$T$2]="psiSkill";INDIRECT( ADDRESS((ROW()-25);1; 1; ;"ImprovedPsiSkill"));"");"") ->  | G31: of:=IF( INDIRECT( ADDRESS((ROW()-25)*2-1;1; 1;;"TU"))=0; FALSE();TRUE()) -> true | H31: of:=IF([.$G31];[.H$26];"") -> 50 | I31: of:=IF([.$G31];[.I$26];"") -> 80
A32: of:=IF([.$T$2]="psiSkill";  IF([.E32]=[.F32];[.B32];[.E32]-[.F32]); [.D32]) -> 50 | B32: of:=IF([.$T$2]="psiSkill";  IF([.E32]=0;"";[.E32]); [.E32]) -> 50 | C32: of:=IF([.A32]=[.B32];"" ;[.B32]) ->  | D32: of:=IF([.G32];MIN(OFFSET(INDIRECT( ADDRESS(1;1; 1; ;[.$T$2])); (ROW() -26) * 2 ;0;2;1));"") -> 50 | E32: of:=IF([.G32];MAX(OFFSET(INDIRECT( ADDRESS(1;1; 1; ;[.$T$2])); (ROW() -26) * 2  ;0;2;1));"") -> 50 | F32: of:=IF([.G32];IF([.$T$2]="psiSkill";INDIRECT( ADDRESS((ROW()-25);1; 1; ;"ImprovedPsiSkill"));"");"") ->  | G32: of:=IF( INDIRECT( ADDRESS((ROW()-25)*2-1;1; 1;;"TU"))=0; FALSE();TRUE()) -> true | H32: of:=IF([.$G32];[.H$26];"") -> 50 | I32: of:=IF([.$G32];[.I$26];"") -> 80
A33: of:=IF([.$T$2]="psiSkill";  IF([.E33]=[.F33];[.B33];[.E33]-[.F33]); [.D33]) -> 52 | B33: of:=IF([.$T$2]="psiSkill";  IF([.E33]=0;"";[.E33]); [.E33]) -> 52 | C33: of:=IF([.A33]=[.B33];"" ;[.B33]) ->  | D33: of:=IF([.G33];MIN(OFFSET(INDIRECT( ADDRESS(1;1; 1; ;[.$T$2])); (ROW() -26) * 2 ;0;2;1));"") -> 52 | E33: of:=IF([.G33];MAX(OFFSET(INDIRECT( ADDRESS(1;1; 1; ;[.$T$2])); (ROW() -26) * 2  ;0;2;1));"") -> 52 | F33: of:=IF([.G33];IF([.$T$2]="psiSkill";INDIRECT( ADDRESS((ROW()-25);1; 1; ;"ImprovedPsiSkill"));"");"") ->  | G33: of:=IF( INDIRECT( ADDRESS((ROW()-25)*2-1;1; 1;;"TU"))=0; FALSE();TRUE()) -> true | H33: of:=IF([.$G33];[.H$26];"") -> 50 | I33: of:=IF([.$G33];[.I$26];"") -> 80
A34: of:=IF([.$T$2]="psiSkill";  IF([.E34]=[.F34];[.B34];[.E34]-[.F34]); [.D34]) -> 50 | B34: of:=IF([.$T$2]="psiSkill";  IF([.E34]=0;"";[.E34]); [.E34]) -> 50 | C34: of:=IF([.A34]=[.B34];"" ;[.B34]) ->  | D34: of:=IF([.G34];MIN(OFFSET(INDIRECT( ADDRESS(1;1; 1; ;[.$T$2])); (ROW() -26) * 2 ;0;2;1));"") -> 50 | E34: of:=IF([.G34];MAX(OFFSET(INDIRECT( ADDRESS(1;1; 1; ;[.$T$2])); (ROW() -26) * 2  ;0;2;1));"") -> 50 | F34: of:=IF([.G34];IF([.$T$2]="psiSkill";INDIRECT( ADDRESS((ROW()-25);1; 1; ;"ImprovedPsiSkill"));"");"") ->  | G34: of:=IF( INDIRECT( ADDRESS((ROW()-25)*2-1;1; 1;;"TU"))=0; FALSE();TRUE()) -> true | H34: of:=IF([.$G34];[.H$26];"") -> 50 | I34: of:=IF([.$G34];[.I$26];"") -> 80
A35: of:=IF([.$T$2]="psiSkill";  IF([.E35]=[.F35];[.B35];[.E35]-[.F35]); [.D35]) -> 57 | B35: of:=IF([.$T$2]="psiSkill";  IF([.E35]=0;"";[.E35]); [.E35]) -> 57 | C35: of:=IF([.A35]=[.B35];"" ;[.B35]) ->  | D35: of:=IF([.G35];MIN(OFFSET(INDIRECT( ADDRESS(1;1; 1; ;[.$T$2])); (ROW() -26) * 2 ;0;2;1));"") -> 57 | E35: of:=IF([.G35];MAX(OFFSET(INDIRECT( ADDRESS(1;1; 1; ;[.$T$2])); (ROW() -26) * 2  ;0;2;1));"") -> 57 | F35: of:=IF([.G35];IF([.$T$2]="psiSkill";INDIRECT( ADDRESS((ROW()-25);1; 1; ;"ImprovedPsiSkill"));"");"") ->  | G35: of:=IF( INDIRECT( ADDRESS((ROW()-25)*2-1;1; 1;;"TU"))=0; FALSE();TRUE()) -> true | H35: of:=IF([.$G35];[.H$26];"") -> 50 | I35: of:=IF([.$G35];[.I$26];"") -> 80
A36: of:=IF([.$T$2]="psiSkill";  IF([.E36]=[.F36];[.B36];[.E36]-[.F36]); [.D36]) -> 60 | B36: of:=IF([.$T$2]="psiSkill";  IF([.E36]=0;"";[.E36]); [.E36]) -> 60 | C36: of:=IF([.A36]=[.B36];"" ;[.B36]) ->  | D36: of:=IF([.G36];MIN(OFFSET(INDIRECT( ADDRESS(1;1; 1; ;[.$T$2])); (ROW() -26) * 2 ;0;2;1));"") -> 60 | E36: of:=IF([.G36];MAX(OFFSET(INDIRECT( ADDRESS(1;1; 1; ;[.$T$2])); (ROW() -26) * 2  ;0;2;1));"") -> 60 | F36: of:=IF([.G36];IF([.$T$2]="psiSkill";INDIRECT( ADDRESS((ROW()-25);1; 1; ;"ImprovedPsiSkill"));"");"") ->  | G36: of:=IF( INDIRECT( ADDRESS((ROW()-25)*2-1;1; 1;;"TU"))=0; FALSE();TRUE()) -> true | H36: of:=IF([.$G36];[.H$26];"") -> 50 | I36: of:=IF([.$G36];[.I$26];"") -> 80
A37: of:=IF([.$T$2]="psiSkill";  IF([.E37]=[.F37];[.B37];[.E37]-[.F37]); [.D37]) -> 52 | B37: of:=IF([.$T$2]="psiSkill";  IF([.E37]=0;"";[.E37]); [.E37]) -> 52 | C37: of:=IF([.A37]=[.B37];"" ;[.B37]) ->  | D37: of:=IF([.G37];MIN(OFFSET(INDIRECT( ADDRESS(1;1; 1; ;[.$T$2])); (ROW() -26) * 2 ;0;2;1));"") -> 52 | E37: of:=IF([.G37];MAX(OFFSET(INDIRECT( ADDRESS(1;1; 1; ;[.$T$2])); (ROW() -26) * 2  ;0;2;1));"") -> 52 | F37: of:=IF([.G37];IF([.$T$2]="psiSkill";INDIRECT( ADDRESS((ROW()-25);1; 1; ;"ImprovedPsiSkill"));"");"") ->  | G37: of:=IF( INDIRECT( ADDRESS((ROW()-25)*2-1;1; 1;;"TU"))=0; FALSE();TRUE()) -> true | H37: of:=IF([.$G37];[.H$26];"") -> 50 | I37: of:=IF([.$G37];[.I$26];"") -> 80
A38: of:=IF([.$T$2]="psiSkill";  IF([.E38]=[.F38];[.B38];[.E38]-[.F38]); [.D38]) -> 54 | B38: of:=IF([.$T$2]="psiSkill";  IF([.E38]=0;"";[.E38]); [.E38]) -> 54 | C38: of:=IF([.A38]=[.B38];"" ;[.B38]) ->  | D38: of:=IF([.G38];MIN(OFFSET(INDIRECT( ADDRESS(1;1; 1; ;[.$T$2])); (ROW() -26) * 2 ;0;2;1));"") -> 54 | E38: of:=IF([.G38];MAX(OFFSET(INDIRECT( ADDRESS(1;1; 1; ;[.$T$2])); (ROW() -26) * 2  ;0;2;1));"") -> 54 | F38: of:=IF([.G38];IF([.$T$2]="psiSkill";INDIRECT( ADDRESS((ROW()-25);1; 1; ;"ImprovedPsiSkill"));"");"") ->  | G38: of:=IF( INDIRECT( ADDRESS((ROW()-25)*2-1;1; 1;;"TU"))=0; FALSE();TRUE()) -> true | H38: of:=IF([.$G38];[.H$26];"") -> 50 | I38: of:=IF([.$G38];[.I$26];"") -> 80
A39: of:=IF([.$T$2]="psiSkill";  IF([.E39]=[.F39];[.B39];[.E39]-[.F39]); [.D39]) -> 59 | B39: of:=IF([.$T$2]="psiSkill";  IF([.E39]=0;"";[.E39]); [.E39]) -> 59 | C39: of:=IF([.A39]=[.B39];"" ;[.B39]) ->  | D39: of:=IF([.G39];MIN(OFFSET(INDIRECT( ADDRESS(1;1; 1; ;[.$T$2])); (ROW() -26) * 2 ;0;2;1));"") -> 59 | E39: of:=IF([.G39];MAX(OFFSET(INDIRECT( ADDRESS(1;1; 1; ;[.$T$2])); (ROW() -26) * 2  ;0;2;1));"") -> 59 | F39: of:=IF([.G39];IF([.$T$2]="psiSkill";INDIRECT( ADDRESS((ROW()-25);1; 1; ;"ImprovedPsiSkill"));"");"") ->  | G39: of:=IF( INDIRECT( ADDRESS((ROW()-25)*2-1;1; 1;;"TU"))=0; FALSE();TRUE()) -> true | H39: of:=IF([.$G39];[.H$26];"") -> 50 | I39: of:=IF([.$G39];[.I$26];"") -> 80
A40: of:=IF([.$T$2]="psiSkill";  IF([.E40]=[.F40];[.B40];[.E40]-[.F40]); [.D40]) -> 53 | B40: of:=IF([.$T$2]="psiSkill";  IF([.E40]=0;"";[.E40]); [.E40]) -> 53 | C40: of:=IF([.A40]=[.B40];"" ;[.B40]) ->  | D40: of:=IF([.G40];MIN(OFFSET(INDIRECT( ADDRESS(1;1; 1; ;[.$T$2])); (ROW() -26) * 2 ;0;2;1));"") -> 53 | E40: of:=IF([.G40];MAX(OFFSET(INDIRECT( ADDRESS(1;1; 1; ;[.$T$2])); (ROW() -26) * 2  ;0;2;1));"") -> 53 | F40: of:=IF([.G40];IF([.$T$2]="psiSkill";INDIRECT( ADDRESS((ROW()-25);1; 1; ;"ImprovedPsiSkill"));"");"") ->  | G40: of:=IF( INDIRECT( ADDRESS((ROW()-25)*2-1;1; 1;;"TU"))=0; FALSE();TRUE()) -> true | H40: of:=IF([.$G40];[.H$26];"") -> 50 | I40: of:=IF([.$G40];[.I$26];"") -> 80
A41: of:=IF([.$T$2]="psiSkill";  IF([.E41]=[.F41];[.B41];[.E41]-[.F41]); [.D41]) -> 60 | B41: of:=IF([.$T$2]="psiSkill";  IF([.E41]=0;"";[.E41]); [.E41]) -> 62 | C41: of:=IF([.A41]=[.B41];"" ;[.B41]) -> 62 | D41: of:=IF([.G41];MIN(OFFSET(INDIRECT( ADDRESS(1;1; 1; ;[.$T$2])); (ROW() -26) * 2 ;0;2;1));"") -> 60 | E41: of:=IF([.G41];MAX(OFFSET(INDIRECT( ADDRESS(1;1; 1; ;[.$T$2])); (ROW() -26) * 2  ;0;2;1));"") -> 62 | F41: of:=IF([.G41];IF([.$T$2]="psiSkill";INDIRECT( ADDRESS((ROW()-25);1; 1; ;"ImprovedPsiSkill"));"");"") ->  | G41: of:=IF( INDIRECT( ADDRESS((ROW()-25)*2-1;1; 1;;"TU"))=0; FALSE();TRUE()) -> true | H41: of:=IF([.$G41];[.H$26];"") -> 50 | I41: of:=IF([.$G41];[.I$26];"") -> 80
A42: of:=IF([.$T$2]="psiSkill";  IF([.E42]=[.F42];[.B42];[.E42]-[.F42]); [.D42]) -> 55 | B42: of:=IF([.$T$2]="psiSkill";  IF([.E42]=0;"";[.E42]); [.E42]) -> 59 | C42: of:=IF([.A42]=[.B42];"" ;[.B42]) -> 59 | D42: of:=IF([.G42];MIN(OFFSET(INDIRECT( ADDRESS(1;1; 1; ;[.$T$2])); (ROW() -26) * 2 ;0;2;1));"") -> 55 | E42: of:=IF([.G42];MAX(OFFSET(INDIRECT( ADDRESS(1;1; 1; ;[.$T$2])); (ROW() -26) * 2  ;0;2;1));"") -> 59 | F42: of:=IF([.G42];IF([.$T$2]="psiSkill";INDIRECT( ADDRESS((ROW()-25);1; 1; ;"ImprovedPsiSkill"));"");"") ->  | G42: of:=IF( INDIRECT( ADDRESS((ROW()-25)*2-1;1; 1;;"TU"))=0; FALSE();TRUE()) -> true | H42: of:=IF([.$G42];[.H$26];"") -> 50 | I42: of:=IF([.$G42];[.I$26];"") -> 80
A43: of:=IF([.$T$2]="psiSkill";  IF([.E43]=[.F43];[.B43];[.E43]-[.F43]); [.D43]) -> 52 | B43: of:=IF([.$T$2]="psiSkill";  IF([.E43]=0;"";[.E43]); [.E43]) -> 53 | C43: of:=IF([.A43]=[.B43];"" ;[.B43]) -> 53 | D43: of:=IF([.G43];MIN(OFFSET(INDIRECT( ADDRESS(1;1; 1; ;[.$T$2])); (ROW() -26) * 2 ;0;2;1));"") -> 52 | E43: of:=IF([.G43];MAX(OFFSET(INDIRECT( ADDRESS(1;1; 1; ;[.$T$2])); (ROW() -26) * 2  ;0;2;1));"") -> 53 | F43: of:=IF([.G43];IF([.$T$2]="psiSkill";INDIRECT( ADDRESS((ROW()-25);1; 1; ;"ImprovedPsiSkill"));"");"") ->  | G43: of:=IF( INDIRECT( ADDRESS((ROW()-25)*2-1;1; 1;;"TU"))=0; FALSE();TRUE()) -> true | H43: of:=IF([.$G43];[.H$26];"") -> 50 | I43: of:=IF([.$G43];[.I$26];"") -> 80
A44: of:=IF([.$T$2]="psiSkill";  IF([.E44]=[.F44];[.B44];[.E44]-[.F44]); [.D44]) -> 58 | B44: of:=IF([.$T$2]="psiSkill";  IF([.E44]=0;"";[.E44]); [.E44]) -> 59 | C44: of:=IF([.A44]=[.B44];"" ;[.B44]) -> 59 | D44: of:=IF([.G44];MIN(OFFSET(INDIRECT( ADDRESS(1;1; 1; ;[.$T$2])); (ROW() -26) * 2 ;0;2;1));"") -> 58 | E44: of:=IF([.G44];MAX(OFFSET(INDIRECT( ADDRESS(1;1; 1; ;[.$T$2])); (ROW() -26) * 2  ;0;2;1));"") -> 59 | F44: of:=IF([.G44];IF([.$T$2]="psiSkill";INDIRECT( ADDRESS((ROW()-25);1; 1; ;"ImprovedPsiSkill"));"");"") ->  | G44: of:=IF( INDIRECT( ADDRESS((ROW()-25)*2-1;1; 1;;"TU"))=0; FALSE();TRUE()) -> true | H44: of:=IF([.$G44];[.H$26];"") -> 50 | I44: of:=IF([.$G44];[.I$26];"") -> 80
A45: of:=IF([.$T$2]="psiSkill";  IF([.E45]=[.F45];[.B45];[.E45]-[.F45]); [.D45]) -> 50 | B45: of:=IF([.$T$2]="psiSkill";  IF([.E45]=0;"";[.E45]); [.E45]) -> 56 | C45: of:=IF([.A45]=[.B45];"" ;[.B45]) -> 56 | D45: of:=IF([.G45];MIN(OFFSET(INDIRECT( ADDRESS(1;1; 1; ;[.$T$2])); (ROW() -26) * 2 ;0;2;1));"") -> 50 | E45: of:=IF([.G45];MAX(OFFSET(INDIRECT( ADDRESS(1;1; 1; ;[.$T$2])); (ROW() -26) * 2  ;0;2;1));"") -> 56 | F45: of:=IF([.G45];IF([.$T$2]="psiSkill";INDIRECT( ADDRESS((ROW()-25);1; 1; ;"ImprovedPsiSkill"));"");"") ->  | G45: of:=IF( INDIRECT( ADDRESS((ROW()-25)*2-1;1; 1;;"TU"))=0; FALSE();TRUE()) -> true | H45: of:=IF([.$G45];[.H$26];"") -> 50 | I45: of:=IF([.$G45];[.I$26];"") -> 80
A46: of:=IF([.$T$2]="psiSkill";  IF([.E46]=[.F46];[.B46];[.E46]-[.F46]); [.D46]) -> 58 | B46: of:=IF([.$T$2]="psiSkill";  IF([.E46]=0;"";[.E46]); [.E46]) -> 60 | C46: of:=IF([.A46]=[.B46];"" ;[.B46]) -> 60 | D46: of:=IF([.G46];MIN(OFFSET(INDIRECT( ADDRESS(1;1; 1; ;[.$T$2])); (ROW() -26) * 2 ;0;2;1));"") -> 58 | E46: of:=IF([.G46];MAX(OFFSET(INDIRECT( ADDRESS(1;1; 1; ;[.$T$2])); (ROW() -26) * 2  ;0;2;1));"") -> 60 | F46: of:=IF([.G46];IF([.$T$2]="psiSkill";INDIRECT( ADDRESS((ROW()-25);1; 1; ;"ImprovedPsiSkill"));"");"") ->  | G46: of:=IF( INDIRECT( ADDRESS((ROW()-25)*2-1;1; 1;;"TU"))=0; FALSE();TRUE()) -> true | H46: of:=IF([.$G46];[.H$26];"") -> 50 | I46: of:=IF([.$G46];[.I$26];"") -> 80
A47: of:=IF([.$T$2]="psiSkill";  IF([.E47]=[.F47];[.B47];[.E47]-[.F47]); [.D47]) -> 53 | B47: of:=IF([.$T$2]="psiSkill";  IF([.E47]=0;"";[.E47]); [.E47]) -> 54 | C47: of:=IF([.A47]=[.B47];"" ;[.B47]) -> 54 | D47: of:=IF([.G47];MIN(OFFSET(INDIRECT( ADDRESS(1;1; 1; ;[.$T$2])); (ROW() -26) * 2 ;0;2;1));"") -> 53 | E47: of:=IF([.G47];MAX(OFFSET(INDIRECT( ADDRESS(1;1; 1; ;[.$T$2])); (ROW() -26) * 2  ;0;2;1));"") -> 54 | F47: of:=IF([.G47];IF([.$T$2]="psiSkill";INDIRECT( ADDRESS((ROW()-25);1; 1; ;"ImprovedPsiSkill"));"");"") ->  | G47: of:=IF( INDIRECT( ADDRESS((ROW()-25)*2-1;1; 1;;"TU"))=0; FALSE();TRUE()) -> true | H47: of:=IF([.$G47];[.H$26];"") -> 50 | I47: of:=IF([.$G47];[.I$26];"") -> 80
A48: of:=IF([.$T$2]="psiSkill";  IF([.E48]=[.F48];[.B48];[.E48]-[.F48]); [.D48]) -> 57 | B48: of:=IF([.$T$2]="psiSkill";  IF([.E48]=0;"";[.E48]); [.E48]) -> 59 | C48: of:=IF([.A48]=[.B48];"" ;[.B48]) -> 59 | D48: of:=IF([.G48];MIN(OFFSET(INDIRECT( ADDRESS(1;1; 1; ;[.$T$2])); (ROW() -26) * 2 ;0;2;1));"") -> 57 | E48: of:=IF([.G48];MAX(OFFSET(INDIRECT( ADDRESS(1;1; 1; ;[.$T$2])); (ROW() -26) * 2  ;0;2;1));"") -> 59 | F48: of:=IF([.G48];IF([.$T$2]="psiSkill";INDIRECT( ADDRESS((ROW()-25);1; 1; ;"ImprovedPsiSkill"));"");"") ->  | G48: of:=IF( INDIRECT( ADDRESS((ROW()-25)*2-1;1; 1;;"TU"))=0; FALSE();TRUE()) -> true | H48: of:=IF([.$G48];[.H$26];"") -> 50 | I48: of:=IF([.$G48];[.I$26];"") -> 80
A49: of:=IF([.$T$2]="psiSkill";  IF([.E49]=[.F49];[.B49];[.E49]-[.F49]); [.D49]) -> 59 | B49: of:=IF([.$T$2]="psiSkill";  IF([.E49]=0;"";[.E49]); [.E49]) -> 62 | C49: of:=IF([.A49]=[.B49];"" ;[.B49]) -> 62 | D49: of:=IF([.G49];MIN(OFFSET(INDIRECT( ADDRESS(1;1; 1; ;[.$T$2])); (ROW() -26) * 2 ;0;2;1));"") -> 59 | E49: of:=IF([.G49];MAX(OFFSET(INDIRECT( ADDRESS(1;1; 1; ;[.$T$2])); (ROW() -26) * 2  ;0;2;1));"") -> 62 | F49: of:=IF([.G49];IF([.$T$2]="psiSkill";INDIRECT( ADDRESS((ROW()-25);1; 1; ;"ImprovedPsiSkill"));"");"") ->  | G49: of:=IF( INDIRECT( ADDRESS((ROW()-25)*2-1;1; 1;;"TU"))=0; FALSE();TRUE()) -> true | H49: of:=IF([.$G49];[.H$26];"") -> 50 | I49: of:=IF([.$G49];[.I$26];"") -> 80
A50: of:=IF([.$T$2]="psiSkill";  IF([.E50]=[.F50];[.B50];[.E50]-[.F50]); [.D50]) -> 58 | B50: of:=IF([.$T$2]="psiSkill";  IF([.E50]=0;"";[.E50]); [.E50]) -> 58 | C50: of:=IF([.A50]=[.B50];"" ;[.B50]) ->  | D50: of:=IF([.G50];MIN(OFFSET(INDIRECT( ADDRESS(1;1; 1; ;[.$T$2])); (ROW() -26) * 2 ;0;2;1));"") -> 58 | E50: of:=IF([.G50];MAX(OFFSET(INDIRECT( ADDRESS(1;1; 1; ;[.$T$2])); (ROW() -26) * 2  ;0;2;1));"") -> 58 | F50: of:=IF([.G50];IF([.$T$2]="psiSkill";INDIRECT( ADDRESS((ROW()-25);1; 1; ;"ImprovedPsiSkill"));"");"") ->  | G50: of:=IF( INDIRECT( ADDRESS((ROW()-25)*2-1;1; 1;;"TU"))=0; FALSE();TRUE()) -> true | H50: of:=IF([.$G50];[.H$26];"") -> 50 | I50: of:=IF([.$G50];[.I$26];"") -> 80
A51: of:=IF([.$T$2]="psiSkill";  IF([.E51]=[.F51];[.B51];[.E51]-[.F51]); [.D51]) -> 58 | B51: of:=IF([.$T$2]="psiSkill";  IF([.E51]=0;"";[.E51]); [.E51]) -> 59 | C51: of:=IF([.A51]=[.B51];"" ;[.B51]) -> 59 | D51: of:=IF([.G51];MIN(OFFSET(INDIRECT( ADDRESS(1;1; 1; ;[.$T$2])); (ROW() -26) * 2 ;0;2;1));"") -> 58 | E51: of:=IF([.G51];MAX(OFFSET(INDIRECT( ADDRESS(1;1; 1; ;[.$T$2])); (ROW() -26) * 2  ;0;2;1));"") -> 59 | F51: of:=IF([.G51];IF([.$T$2]="psiSkill";INDIRECT( ADDRESS((ROW()-25);1; 1; ;"ImprovedPsiSkill"));"");"") ->  | G51: of:=IF( INDIRECT( ADDRESS((ROW()-25)*2-1;1; 1;;"TU"))=0; FALSE();TRUE()) -> true | H51: of:=IF([.$G51];[.H$26];"") -> 50 | I51: of:=IF([.$G51];[.I$26];"") -> 80
A52: of:=IF([.$T$2]="psiSkill";  IF([.E52]=[.F52];[.B52];[.E52]-[.F52]); [.D52]) -> 52 | B52: of:=IF([.$T$2]="psiSkill";  IF([.E52]=0;"";[.E52]); [.E52]) -> 63 | C52: of:=IF([.A52]=[.B52];"" ;[.B52]) -> 63 | D52: of:=IF([.G52];MIN(OFFSET(INDIRECT( ADDRESS(1;1; 1; ;[.$T$2])); (ROW() -26) * 2 ;0;2;1));"") -> 52 | E52: of:=IF([.G52];MAX(OFFSET(INDIRECT( ADDRESS(1;1; 1; ;[.$T$2])); (ROW() -26) * 2  ;0;2;1));"") -> 63 | F52: of:=IF([.G52];IF([.$T$2]="psiSkill";INDIRECT( ADDRESS((ROW()-25);1; 1; ;"ImprovedPsiSkill"));"");"") ->  | G52: of:=IF( INDIRECT( ADDRESS((ROW()-25)*2-1;1; 1;;"TU"))=0; FALSE();TRUE()) -> true | H52: of:=IF([.$G52];[.H$26];"") -> 50 | I52: of:=IF([.$G52];[.I$26];"") -> 80
A53: of:=IF([.$T$2]="psiSkill";  IF([.E53]=[.F53];[.B53];[.E53]-[.F53]); [.D53]) -> 57 | B53: of:=IF([.$T$2]="psiSkill";  IF([.E53]=0;"";[.E53]); [.E53]) -> 64 | C53: of:=IF([.A53]=[.B53];"" ;[.B53]) -> 64 | D53: of:=IF([.G53];MIN(OFFSET(INDIRECT( ADDRESS(1;1; 1; ;[.$T$2])); (ROW() -26) * 2 ;0;2;1));"") -> 57 | E53: of:=IF([.G53];MAX(OFFSET(INDIRECT( ADDRESS(1;1; 1; ;[.$T$2])); (ROW() -26) * 2  ;0;2;1));"") -> 64 | F53: of:=IF([.G53];IF([.$T$2]="psiSkill";INDIRECT( ADDRESS((ROW()-25);1; 1; ;"ImprovedPsiSkill"));"");"") ->  | G53: of:=IF( INDIRECT( ADDRESS((ROW()-25)*2-1;1; 1;;"TU"))=0; FALSE();TRUE()) -> true | H53: of:=IF([.$G53];[.H$26];"") -> 50 | I53: of:=IF([.$G53];[.I$26];"") -> 80
A54: of:=IF([.$T$2]="psiSkill";  IF([.E54]=[.F54];[.B54];[.E54]-[.F54]); [.D54]) -> 51 | B54: of:=IF([.$T$2]="psiSkill";  IF([.E54]=0;"";[.E54]); [.E54]) -> 57 | C54: of:=IF([.A54]=[.B54];"" ;[.B54]) -> 57 | D54: of:=IF([.G54];MIN(OFFSET(INDIRECT( ADDRESS(1;1; 1; ;[.$T$2])); (ROW() -26) * 2 ;0;2;1));"") -> 51 | E54: of:=IF([.G54];MAX(OFFSET(INDIRECT( ADDRESS(1;1; 1; ;[.$T$2])); (ROW() -26) * 2  ;0;2;1));"") -> 57 | F54: of:=IF([.G54];IF([.$T$2]="psiSkill";INDIRECT( ADDRESS((ROW()-25);1; 1; ;"ImprovedPsiSkill"));"");"") ->  | G54: of:=IF( INDIRECT( ADDRESS((ROW()-25)*2-1;1; 1;;"TU"))=0; FALSE();TRUE()) -> true | H54: of:=IF([.$G54];[.H$26];"") -> 50 | I54: of:=IF([.$G54];[.I$26];"") -> 80
A55: of:=IF([.$T$2]="psiSkill";  IF([.E55]=[.F55];[.B55];[.E55]-[.F55]); [.D55]) -> 53 | B55: of:=IF([.$T$2]="psiSkill";  IF([.E55]=0;"";[.E55]); [.E55]) -> 63 | C55: of:=IF([.A55]=[.B55];"" ;[.B55]) -> 63 | D55: of:=IF([.G55];MIN(OFFSET(INDIRECT( ADDRESS(1;1; 1; ;[.$T$2])); (ROW() -26) * 2 ;0;2;1));"") -> 53 | E55: of:=IF([.G55];MAX(OFFSET(INDIRECT( ADDRESS(1;1; 1; ;[.$T$2])); (ROW() -26) * 2  ;0;2;1));"") -> 63 | F55: of:=IF([.G55];IF([.$T$2]="psiSkill";INDIRECT( ADDRESS((ROW()-25);1; 1; ;"ImprovedPsiSkill"));"");"") ->  | G55: of:=IF( INDIRECT( ADDRESS((ROW()-25)*2-1;1; 1;;"TU"))=0; FALSE();TRUE()) -> true | H55: of:=IF([.$G55];[.H$26];"") -> 50 | I55: of:=IF([.$G55];[.I$26];"") -> 80
A56: of:=IF([.$T$2]="psiSkill";  IF([.E56]=[.F56];[.B56];[.E56]-[.F56]); [.D56]) -> 51 | B56: of:=IF([.$T$2]="psiSkill";  IF([.E56]=0;"";[.E56]); [.E56]) -> 51 | C56: of:=IF([.A56]=[.B56];"" ;[.B56]) ->  | D56: of:=IF([.G56];MIN(OFFSET(INDIRECT( ADDRESS(1;1; 1; ;[.$T$2])); (ROW() -26) * 2 ;0;2;1));"") -> 51 | E56: of:=IF([.G56];MAX(OFFSET(INDIRECT( ADDRESS(1;1; 1; ;[.$T$2])); (ROW() -26) * 2  ;0;2;1));"") -> 51 | F56: of:=IF([.G56];IF([.$T$2]="psiSkill";INDIRECT( ADDRESS((ROW()-25);1; 1; ;"ImprovedPsiSkill"));"");"") ->  | G56: of:=IF( INDIRECT( ADDRESS((ROW()-25)*2-1;1; 1;;"TU"))=0; FALSE();TRUE()) -> true | H56: of:=IF([.$G56];[.H$26];"") -> 50 | I56: of:=IF([.$G56];[.I$26];"") -> 80
A57: of:=IF([.$T$2]="psiSkill";  IF([.E57]=[.F57];[.B57];[.E57]-[.F57]); [.D57]) -> 58 | B57: of:=IF([.$T$2]="psiSkill";  IF([.E57]=0;"";[.E57]); [.E57]) -> 58 | C57: of:=IF([.A57]=[.B57];"" ;[.B57]) ->  | D57: of:=IF([.G57];MIN(OFFSET(INDIRECT( ADDRESS(1;1; 1; ;[.$T$2])); (ROW() -26) * 2 ;0;2;1));"") -> 58 | E57: of:=IF([.G57];MAX(OFFSET(INDIRECT( ADDRESS(1;1; 1; ;[.$T$2])); (ROW() -26) * 2  ;0;2;1));"") -> 58 | F57: of:=IF([.G57];IF([.$T$2]="psiSkill";INDIRECT( ADDRESS((ROW()-25);1; 1; ;"ImprovedPsiSkill"));"");"") ->  | G57: of:=IF( INDIRECT( ADDRESS((ROW()-25)*2-1;1; 1;;"TU"))=0; FALSE();TRUE()) -> true | H57: of:=IF([.$G57];[.H$26];"") -> 50 | I57: of:=IF([.$G57];[.I$26];"") -> 80
A58: of:=IF([.$T$2]="psiSkill";  IF([.E58]=[.F58];[.B58];[.E58]-[.F58]); [.D58]) -> 59 | B58: of:=IF([.$T$2]="psiSkill";  IF([.E58]=0;"";[.E58]); [.E58]) -> 59 | C58: of:=IF([.A58]=[.B58];"" ;[.B58]) ->  | D58: of:=IF([.G58];MIN(OFFSET(INDIRECT( ADDRESS(1;1; 1; ;[.$T$2])); (ROW() -26) * 2 ;0;2;1));"") -> 59 | E58: of:=IF([.G58];MAX(OFFSET(INDIRECT( ADDRESS(1;1; 1; ;[.$T$2])); (ROW() -26) * 2  ;0;2;1));"") -> 59 | F58: of:=IF([.G58];IF([.$T$2]="psiSkill";INDIRECT( ADDRESS((ROW()-25);1; 1; ;"ImprovedPsiSkill"));"");"") ->  | G58: of:=IF( INDIRECT( ADDRESS((ROW()-25)*2-1;1; 1;;"TU"))=0; FALSE();TRUE()) -> true | H58: of:=IF([.$G58];[.H$26];"") -> 50 | I58: of:=IF([.$G58];[.I$26];"") -> 80
A59: of:=IF([.$T$2]="psiSkill";  IF([.E59]=[.F59];[.B59];[.E59]-[.F59]); [.D59]) -> 52 | B59: of:=IF([.$T$2]="psiSkill";  IF([.E59]=0;"";[.E59]); [.E59]) -> 52 | C59: of:=IF([.A59]=[.B59];"" ;[.B59]) ->  | D59: of:=IF([.G59];MIN(OFFSET(INDIRECT( ADDRESS(1;1; 1; ;[.$T$2])); (ROW() -26) * 2 ;0;2;1));"") -> 52 | E59: of:=IF([.G59];MAX(OFFSET(INDIRECT( ADDRESS(1;1; 1; ;[.$T$2])); (ROW() -26) * 2  ;0;2;1));"") -> 52 | F59: of:=IF([.G59];IF([.$T$2]="psiSkill";INDIRECT( ADDRESS((ROW()-25);1; 1; ;"ImprovedPsiSkill"));"");"") ->  | G59: of:=IF( INDIRECT( ADDRESS((ROW()-25)*2-1;1; 1;;"TU"))=0; FALSE();TRUE()) -> true | H59: of:=IF([.$G59];[.H$26];"") -> 50 | I59: of:=IF([.$G59];[.I$26];"") -> 80
A60: of:=IF([.$T$2]="psiSkill";  IF([.E60]=[.F60];[.B60];[.E60]-[.F60]); [.D60]) -> 56 | B60: of:=IF([.$T$2]="psiSkill";  IF([.E60]=0;"";[.E60]); [.E60]) -> 56 | C60: of:=IF([.A60]=[.B60];"" ;[.B60]) ->  | D60: of:=IF([.G60];MIN(OFFSET(INDIRECT( ADDRESS(1;1; 1; ;[.$T$2])); (ROW() -26) * 2 ;0;2;1));"") -> 56 | E60: of:=IF([.G60];MAX(OFFSET(INDIRECT( ADDRESS(1;1; 1; ;[.$T$2])); (ROW() -26) * 2  ;0;2;1));"") -> 56 | F60: of:=IF([.G60];IF([.$T$2]="psiSkill";INDIRECT( ADDRESS((ROW()-25);1; 1; ;"ImprovedPsiSkill"));"");"") ->  | G60: of:=IF( INDIRECT( ADDRESS((ROW()-25)*2-1;1; 1;;"TU"))=0; FALSE();TRUE()) -> true | H60: of:=IF([.$G60];[.H$26];"") -> 50 | I60: of:=IF([.$G60];[.I$26];"") -> 80
A61: of:=IF([.$T$2]="psiSkill";  IF([.E61]=[.F61];[.B61];[.E61]-[.F61]); [.D61]) -> 56 | B61: of:=IF([.$T$2]="psiSkill";  IF([.E61]=0;"";[.E61]); [.E61]) -> 56 | C61: of:=IF([.A61]=[.B61];"" ;[.B61]) ->  | D61: of:=IF([.G61];MIN(OFFSET(INDIRECT( ADDRESS(1;1; 1; ;[.$T$2])); (ROW() -26) * 2 ;0;2;1));"") -> 56 | E61: of:=IF([.G61];MAX(OFFSET(INDIRECT( ADDRESS(1;1; 1; ;[.$T$2])); (ROW() -26) * 2  ;0;2;1));"") -> 56 | F61: of:=IF([.G61];IF([.$T$2]="psiSkill";INDIRECT( ADDRESS((ROW()-25);1; 1; ;"ImprovedPsiSkill"));"");"") ->  | G61: of:=IF( INDIRECT( ADDRESS((ROW()-25)*2-1;1; 1;;"TU"))=0; FALSE();TRUE()) -> true | H61: of:=IF([.$G61];[.H$26];"") -> 50 | I61: of:=IF([.$G61];[.I$26];"") -> 80
A62: of:=IF([.$T$2]="psiSkill";  IF([.E62]=[.F62];[.B62];[.E62]-[.F62]); [.D62]) -> 58 | B62: of:=IF([.$T$2]="psiSkill";  IF([.E62]=0;"";[.E62]); [.E62]) -> 58 | C62: of:=IF([.A62]=[.B62];"" ;[.B62]) ->  | D62: of:=IF([.G62];MIN(OFFSET(INDIRECT( ADDRESS(1;1; 1; ;[.$T$2])); (ROW() -26) * 2 ;0;2;1));"") -> 58 | E62: of:=IF([.G62];MAX(OFFSET(INDIRECT( ADDRESS(1;1; 1; ;[.$T$2])); (ROW() -26) * 2  ;0;2;1));"") -> 58 | F62: of:=IF([.G62];IF([.$T$2]="psiSkill";INDIRECT( ADDRESS((ROW()-25);1; 1; ;"ImprovedPsiSkill"));"");"") ->  | G62: of:=IF( INDIRECT( ADDRESS((ROW()-25)*2-1;1; 1;;"TU"))=0; FALSE();TRUE()) -> true | H62: of:=IF([.$G62];[.H$26];"") -> 50 | I62: of:=IF([.$G62];[.I$26];"") -> 80
A63: of:=IF([.$T$2]="psiSkill";  IF([.E63]=[.F63];[.B63];[.E63]-[.F63]); [.D63]) -> 54 | B63: of:=IF([.$T$2]="psiSkill";  IF([.E63]=0;"";[.E63]); [.E63]) -> 54 | C63: of:=IF([.A63]=[.B63];"" ;[.B63]) ->  | D63: of:=IF([.G63];MIN(OFFSET(INDIRECT( ADDRESS(1;1; 1; ;[.$T$2])); (ROW() -26) * 2 ;0;2;1));"") -> 54 | E63: of:=IF([.G63];MAX(OFFSET(INDIRECT( ADDRESS(1;1; 1; ;[.$T$2])); (ROW() -26) * 2  ;0;2;1));"") -> 54 | F63: of:=IF([.G63];IF([.$T$2]="psiSkill";INDIRECT( ADDRESS((ROW()-25);1; 1; ;"ImprovedPsiSkill"));"");"") ->  | G63: of:=IF( INDIRECT( ADDRESS((ROW()-25)*2-1;1; 1;;"TU"))=0; FALSE();TRUE()) -> true | H63: of:=IF([.$G63];[.H$26];"") -> 50 | I63: of:=IF([.$G63];[.I$26];"") -> 80
A64: of:=IF([.$T$2]="psiSkill";  IF([.E64]=[.F64];[.B64];[.E64]-[.F64]); [.D64]) -> 54 | B64: of:=IF([.$T$2]="psiSkill";  IF([.E64]=0;"";[.E64]); [.E64]) -> 54 | C64: of:=IF([.A64]=[.B64];"" ;[.B64]) ->  | D64: of:=IF([.G64];MIN(OFFSET(INDIRECT( ADDRESS(1;1; 1; ;[.$T$2])); (ROW() -26) * 2 ;0;2;1));"") -> 54 | E64: of:=IF([.G64];MAX(OFFSET(INDIRECT( ADDRESS(1;1; 1; ;[.$T$2])); (ROW() -26) * 2  ;0;2;1));"") -> 54 | F64: of:=IF([.G64];IF([.$T$2]="psiSkill";INDIRECT( ADDRESS((ROW()-25);1; 1; ;"ImprovedPsiSkill"));"");"") ->  | G64: of:=IF( INDIRECT( ADDRESS((ROW()-25)*2-1;1; 1;;"TU"))=0; FALSE();TRUE()) -> true | H64: of:=IF([.$G64];[.H$26];"") -> 50 | I64: of:=IF([.$G64];[.I$26];"") -> 80
A65: of:=IF([.$T$2]="psiSkill";  IF([.E65]=[.F65];[.B65];[.E65]-[.F65]); [.D65]) -> 59 | B65: of:=IF([.$T$2]="psiSkill";  IF([.E65]=0;"";[.E65]); [.E65]) -> 59 | C65: of:=IF([.A65]=[.B65];"" ;[.B65]) ->  | D65: of:=IF([.G65];MIN(OFFSET(INDIRECT( ADDRESS(1;1; 1; ;[.$T$2])); (ROW() -26) * 2 ;0;2;1));"") -> 59 | E65: of:=IF([.G65];MAX(OFFSET(INDIRECT( ADDRESS(1;1; 1; ;[.$T$2])); (ROW() -26) * 2  ;0;2;1));"") -> 59 | F65: of:=IF([.G65];IF([.$T$2]="psiSkill";INDIRECT( ADDRESS((ROW()-25);1; 1; ;"ImprovedPsiSkill"));"");"") ->  | G65: of:=IF( INDIRECT( ADDRESS((ROW()-25)*2-1;1; 1;;"TU"))=0; FALSE();TRUE()) -> true | H65: of:=IF([.$G65];[.H$26];"") -> 50 | I65: of:=IF([.$G65];[.I$26];"") -> 80
A66: of:=IF([.$T$2]="psiSkill";  IF([.E66]=[.F66];[.B66];[.E66]-[.F66]); [.D66]) -> 57 | B66: of:=IF([.$T$2]="psiSkill";  IF([.E66]=0;"";[.E66]); [.E66]) -> 59 | C66: of:=IF([.A66]=[.B66];"" ;[.B66]) -> 59 | D66: of:=IF([.G66];MIN(OFFSET(INDIRECT( ADDRESS(1;1; 1; ;[.$T$2])); (ROW() -26) * 2 ;0;2;1));"") -> 57 | E66: of:=IF([.G66];MAX(OFFSET(INDIRECT( ADDRESS(1;1; 1; ;[.$T$2])); (ROW() -26) * 2  ;0;2;1));"") -> 59 | F66: of:=IF([.G66];IF([.$T$2]="psiSkill";INDIRECT( ADDRESS((ROW()-25);1; 1; ;"ImprovedPsiSkill"));"");"") ->  | G66: of:=IF( INDIRECT( ADDRESS((ROW()-25)*2-1;1; 1;;"TU"))=0; FALSE();TRUE()) -> true | H66: of:=IF([.$G66];[.H$26];"") -> 50 | I66: of:=IF([.$G66];[.I$26];"") -> 80
A67: of:=IF([.$T$2]="psiSkill";  IF([.E67]=[.F67];[.B67];[.E67]-[.F67]); [.D67]) -> 51 | B67: of:=IF([.$T$2]="psiSkill";  IF([.E67]=0;"";[.E67]); [.E67]) -> 51 | C67: of:=IF([.A67]=[.B67];"" ;[.B67]) ->  | D67: of:=IF([.G67];MIN(OFFSET(INDIRECT( ADDRESS(1;1; 1; ;[.$T$2])); (ROW() -26) * 2 ;0;2;1));"") -> 51 | E67: of:=IF([.G67];MAX(OFFSET(INDIRECT( ADDRESS(1;1; 1; ;[.$T$2])); (ROW() -26) * 2  ;0;2;1));"") -> 51 | F67: of:=IF([.G67];IF([.$T$2]="psiSkill";INDIRECT( ADDRESS((ROW()-25);1; 1; ;"ImprovedPsiSkill"));"");"") ->  | G67: of:=IF( INDIRECT( ADDRESS((ROW()-25)*2-1;1; 1;;"TU"))=0; FALSE();TRUE()) -> true | H67: of:=IF([.$G67];[.H$26];"") -> 50 | I67: of:=IF([.$G67];[.I$26];"") -> 80
A68: of:=IF([.$T$2]="psiSkill";  IF([.E68]=[.F68];[.B68];[.E68]-[.F68]); [.D68]) -> 57 | B68: of:=IF([.$T$2]="psiSkill";  IF([.E68]=0;"";[.E68]); [.E68]) -> 59 | C68: of:=IF([.A68]=[.B68];"" ;[.B68]) -> 59 | D68: of:=IF([.G68];MIN(OFFSET(INDIRECT( ADDRESS(1;1; 1; ;[.$T$2])); (ROW() -26) * 2 ;0;2;1));"") -> 57 | E68: of:=IF([.G68];MAX(OFFSET(INDIRECT( ADDRESS(1;1; 1; ;[.$T$2])); (ROW() -26) * 2  ;0;2;1));"") -> 59 | F68: of:=IF([.G68];IF([.$T$2]="psiSkill";INDIRECT( ADDRESS((ROW()-25);1; 1; ;"ImprovedPsiSkill"));"");"") ->  | G68: of:=IF( INDIRECT( ADDRESS((ROW()-25)*2-1;1; 1;;"TU"))=0; FALSE();TRUE()) -> true | H68: of:=IF([.$G68];[.H$26];"") -> 50 | I68: of:=IF([.$G68];[.I$26];"") -> 80
A69: of:=IF([.$T$2]="psiSkill";  IF([.E69]=[.F69];[.B69];[.E69]-[.F69]); [.D69]) -> 52 | B69: of:=IF([.$T$2]="psiSkill";  IF([.E69]=0;"";[.E69]); [.E69]) -> 54 | C69: of:=IF([.A69]=[.B69];"" ;[.B69]) -> 54 | D69: of:=IF([.G69];MIN(OFFSET(INDIRECT( ADDRESS(1;1; 1; ;[.$T$2])); (ROW() -26) * 2 ;0;2;1));"") -> 52 | E69: of:=IF([.G69];MAX(OFFSET(INDIRECT( ADDRESS(1;1; 1; ;[.$T$2])); (ROW() -26) * 2  ;0;2;1));"") -> 54 | F69: of:=IF([.G69];IF([.$T$2]="psiSkill";INDIRECT( ADDRESS((ROW()-25);1; 1; ;"ImprovedPsiSkill"));"");"") ->  | G69: of:=IF( INDIRECT( ADDRESS((ROW()-25)*2-1;1; 1;;"TU"))=0; FALSE();TRUE()) -> true | H69: of:=IF([.$G69];[.H$26];"") -> 50 | I69: of:=IF([.$G69];[.I$26];"") -> 80
A70: of:=IF([.$T$2]="psiSkill";  IF([.E70]=[.F70];[.B70];[.E70]-[.F70]); [.D70]) -> 52 | B70: of:=IF([.$T$2]="psiSkill";  IF([.E70]=0;"";[.E70]); [.E70]) -> 57 | C70: of:=IF([.A70]=[.B70];"" ;[.B70]) -> 57 | D70: of:=IF([.G70];MIN(OFFSET(INDIRECT( ADDRESS(1;1; 1; ;[.$T$2])); (ROW() -26) * 2 ;0;2;1));"") -> 52 | E70: of:=IF([.G70];MAX(OFFSET(INDIRECT( ADDRESS(1;1; 1; ;[.$T$2])); (ROW() -26) * 2  ;0;2;1));"") -> 57 | F70: of:=IF([.G70];IF([.$T$2]="psiSkill";INDIRECT( ADDRESS((ROW()-25);1; 1; ;"ImprovedPsiSkill"));"");"") ->  | G70: of:=IF( INDIRECT( ADDRESS((ROW()-25)*2-1;1; 1;;"TU"))=0; FALSE();TRUE()) -> true | H70: of:=IF([.$G70];[.H$26];"") -> 50 | I70: of:=IF([.$G70];[.I$26];"") -> 80
A71: of:=IF([.$T$2]="psiSkill";  IF([.E71]=[.F71];[.B71];[.E71]-[.F71]); [.D71]) -> 50 | B71: of:=IF([.$T$2]="psiSkill";  IF([.E71]=0;"";[.E71]); [.E71]) -> 55 | C71: of:=IF([.A71]=[.B71];"" ;[.B71]) -> 55 | D71: of:=IF([.G71];MIN(OFFSET(INDIRECT( ADDRESS(1;1; 1; ;[.$T$2])); (ROW() -26) * 2 ;0;2;1));"") -> 50 | E71: of:=IF([.G71];MAX(OFFSET(INDIRECT( ADDRESS(1;1; 1; ;[.$T$2])); (ROW() -26) * 2  ;0;2;1));"") -> 55 | F71: of:=IF([.G71];IF([.$T$2]="psiSkill";INDIRECT( ADDRESS((ROW()-25);1; 1; ;"ImprovedPsiSkill"));"");"") ->  | G71: of:=IF( INDIRECT( ADDRESS((ROW()-25)*2-1;1; 1;;"TU"))=0; FALSE();TRUE()) -> true | H71: of:=IF([.$G71];[.H$26];"") -> 50 | I71: of:=IF([.$G71];[.I$26];"") -> 80
A72: of:=IF([.$T$2]="psiSkill";  IF([.E72]=[.F72];[.B72];[.E72]-[.F72]); [.D72]) -> 53 | B72: of:=IF([.$T$2]="psiSkill";  IF([.E72]=0;"";[.E72]); [.E72]) -> 53 | C72: of:=IF([.A72]=[.B72];"" ;[.B72]) ->  | D72: of:=IF([.G72];MIN(OFFSET(INDIRECT( ADDRESS(1;1; 1; ;[.$T$2])); (ROW() -26) * 2 ;0;2;1));"") -> 53 | E72: of:=IF([.G72];MAX(OFFSET(INDIRECT( ADDRESS(1;1; 1; ;[.$T$2])); (ROW() -26) * 2  ;0;2;1));"") -> 53 | F72: of:=IF([.G72];IF([.$T$2]="psiSkill";INDIRECT( ADDRESS((ROW()-25);1; 1; ;"ImprovedPsiSkill"));"");"") ->  | G72: of:=IF( INDIRECT( ADDRESS((ROW()-25)*2-1;1; 1;;"TU"))=0; FALSE();TRUE()) -> true | H72: of:=IF([.$G72];[.H$26];"") -> 50 | I72: of:=IF([.$G72];[.I$26];"") -> 80
A73: of:=IF([.$T$2]="psiSkill";  IF([.E73]=[.F73];[.B73];[.E73]-[.F73]); [.D73]) -> 51 | B73: of:=IF([.$T$2]="psiSkill";  IF([.E73]=0;"";[.E73]); [.E73]) -> 58 | C73: of:=IF([.A73]=[.B73];"" ;[.B73]) -> 58 | D73: of:=IF([.G73];MIN(OFFSET(INDIRECT( ADDRESS(1;1; 1; ;[.$T$2])); (ROW() -26) * 2 ;0;2;1));"") -> 51 | E73: of:=IF([.G73];MAX(OFFSET(INDIRECT( ADDRESS(1;1; 1; ;[.$T$2])); (ROW() -26) * 2  ;0;2;1));"") -> 58 | F73: of:=IF([.G73];IF([.$T$2]="psiSkill";INDIRECT( ADDRESS((ROW()-25);1; 1; ;"ImprovedPsiSkill"));"");"") ->  | G73: of:=IF( INDIRECT( ADDRESS((ROW()-25)*2-1;1; 1;;"TU"))=0; FALSE();TRUE()) -> true | H73: of:=IF([.$G73];[.H$26];"") -> 50 | I73: of:=IF([.$G73];[.I$26];"") -> 80
A74: of:=IF([.$T$2]="psiSkill";  IF([.E74]=[.F74];[.B74];[.E74]-[.F74]); [.D74]) -> 59 | B74: of:=IF([.$T$2]="psiSkill";  IF([.E74]=0;"";[.E74]); [.E74]) -> 59 | C74: of:=IF([.A74]=[.B74];"" ;[.B74]) ->  | D74: of:=IF([.G74];MIN(OFFSET(INDIRECT( ADDRESS(1;1; 1; ;[.$T$2])); (ROW() -26) * 2 ;0;2;1));"") -> 59 | E74: of:=IF([.G74];MAX(OFFSET(INDIRECT( ADDRESS(1;1; 1; ;[.$T$2])); (ROW() -26) * 2  ;0;2;1));"") -> 59 | F74: of:=IF([.G74];IF([.$T$2]="psiSkill";INDIRECT( ADDRESS((ROW()-25);1; 1; ;"ImprovedPsiSkill"));"");"") ->  | G74: of:=IF( INDIRECT( ADDRESS((ROW()-25)*2-1;1; 1;;"TU"))=0; FALSE();TRUE()) -> true | H74: of:=IF([.$G74];[.H$26];"") -> 50 | I74: of:=IF([.$G74];[.I$26];"") -> 80
A75: of:=IF([.$T$2]="psiSkill";  IF([.E75]=[.F75];[.B75];[.E75]-[.F75]); [.D75]) -> 58 | B75: of:=IF([.$T$2]="psiSkill";  IF([.E75]=0;"";[.E75]); [.E75]) -> 59 | C75: of:=IF([.A75]=[.B75];"" ;[.B75]) -> 59 | D75: of:=IF([.G75];MIN(OFFSET(INDIRECT( ADDRESS(1;1; 1; ;[.$T$2])); (ROW() -26) * 2 ;0;2;1));"") -> 58 | E75: of:=IF([.G75];MAX(OFFSET(INDIRECT( ADDRESS(1;1; 1; ;[.$T$2])); (ROW() -26) * 2  ;0;2;1));"") -> 59 | F75: of:=IF([.G75];IF([.$T$2]="psiSkill";INDIRECT( ADDRESS((ROW()-25);1; 1; ;"ImprovedPsiSkill"));"");"") ->  | G75: of:=IF( INDIRECT( ADDRESS((ROW()-25)*2-1;1; 1;;"TU"))=0; FALSE();TRUE()) -> true | H75: of:=IF([.$G75];[.H$26];"") -> 50 | I75: of:=IF([.$G75];[.I$26];"") -> 80
A76: of:=IF([.$T$2]="psiSkill";  IF([.E76]=[.F76];[.B76];[.E76]-[.F76]); [.D76]) -> 55 | B76: of:=IF([.$T$2]="psiSkill";  IF([.E76]=0;"";[.E76]); [.E76]) -> 57 | C76: of:=IF([.A76]=[.B76];"" ;[.B76]) -> 57 | D76: of:=IF([.G76];MIN(OFFSET(INDIRECT( ADDRESS(1;1; 1; ;[.$T$2])); (ROW() -26) * 2 ;0;2;1));"") -> 55 | E76: of:=IF([.G76];MAX(OFFSET(INDIRECT( ADDRESS(1;1; 1; ;[.$T$2])); (ROW() -26) * 2  ;0;2;1));"") -> 57 | F76: of:=IF([.G76];IF([.$T$2]="psiSkill";INDIRECT( ADDRESS((ROW()-25);1; 1; ;"ImprovedPsiSkill"));"");"") ->  | G76: of:=IF( INDIRECT( ADDRESS((ROW()-25)*2-1;1; 1;;"TU"))=0; FALSE();TRUE()) -> true | H76: of:=IF([.$G76];[.H$26];"") -> 50 | I76: of:=IF([.$G76];[.I$26];"") -> 80
A77: of:=IF([.$T$2]="psiSkill";  IF([.E77]=[.F77];[.B77];[.E77]-[.F77]); [.D77]) -> 54 | B77: of:=IF([.$T$2]="psiSkill";  IF([.E77]=0;"";[.E77]); [.E77]) -> 64 | C77: of:=IF([.A77]=[.B77];"" ;[.B77]) -> 64 | D77: of:=IF([.G77];MIN(OFFSET(INDIRECT( ADDRESS(1;1; 1; ;[.$T$2])); (ROW() -26) * 2 ;0;2;1));"") -> 54 | E77: of:=IF([.G77];MAX(OFFSET(INDIRECT( ADDRESS(1;1; 1; ;[.$T$2])); (ROW() -26) * 2  ;0;2;1));"") -> 64 | F77: of:=IF([.G77];IF([.$T$2]="psiSkill";INDIRECT( ADDRESS((ROW()-25);1; 1; ;"ImprovedPsiSkill"));"");"") ->  | G77: of:=IF( INDIRECT( ADDRESS((ROW()-25)*2-1;1; 1;;"TU"))=0; FALSE();TRUE()) -> true | H77: of:=IF([.$G77];[.H$26];"") -> 50 | I77: of:=IF([.$G77];[.I$26];"") -> 80
A78: of:=IF([.$T$2]="psiSkill";  IF([.E78]=[.F78];[.B78];[.E78]-[.F78]); [.D78]) -> 53 | B78: of:=IF([.$T$2]="psiSkill";  IF([.E78]=0;"";[.E78]); [.E78]) -> 62 | C78: of:=IF([.A78]=[.B78];"" ;[.B78]) -> 62 | D78: of:=IF([.G78];MIN(OFFSET(INDIRECT( ADDRESS(1;1; 1; ;[.$T$2])); (ROW() -26) * 2 ;0;2;1));"") -> 53 | E78: of:=IF([.G78];MAX(OFFSET(INDIRECT( ADDRESS(1;1; 1; ;[.$T$2])); (ROW() -26) * 2  ;0;2;1));"") -> 62 | F78: of:=IF([.G78];IF([.$T$2]="psiSkill";INDIRECT( ADDRESS((ROW()-25);1; 1; ;"ImprovedPsiSkill"));"");"") ->  | G78: of:=IF( INDIRECT( ADDRESS((ROW()-25)*2-1;1; 1;;"TU"))=0; FALSE();TRUE()) -> true | H78: of:=IF([.$G78];[.H$26];"") -> 50 | I78: of:=IF([.$G78];[.I$26];"") -> 80
A79: of:=IF([.$T$2]="psiSkill";  IF([.E79]=[.F79];[.B79];[.E79]-[.F79]); [.D79]) -> 50 | B79: of:=IF([.$T$2]="psiSkill";  IF([.E79]=0;"";[.E79]); [.E79]) -> 64 | C79: of:=IF([.A79]=[.B79];"" ;[.B79]) -> 64 | D79: of:=IF([.G79];MIN(OFFSET(INDIRECT( ADDRESS(1;1; 1; ;[.$T$2])); (ROW() -26) * 2 ;0;2;1));"") -> 50 | E79: of:=IF([.G79];MAX(OFFSET(INDIRECT( ADDRESS(1;1; 1; ;[.$T$2])); (ROW() -26) * 2  ;0;2;1));"") -> 64 | F79: of:=IF([.G79];IF([.$T$2]="psiSkill";INDIRECT( ADDRESS((ROW()-25);1; 1; ;"ImprovedPsiSkill"));"");"") ->  | G79: of:=IF( INDIRECT( ADDRESS((ROW()-25)*2-1;1; 1;;"TU"))=0; FALSE();TRUE()) -> true | H79: of:=IF([.$G79];[.H$26];"") -> 50 | I79: of:=IF([.$G79];[.I$26];"") -> 80
A80: of:=IF([.$T$2]="psiSkill";  IF([.E80]=[.F80];[.B80];[.E80]-[.F80]); [.D80]) -> 52 | B80: of:=IF([.$T$2]="psiSkill";  IF([.E80]=0;"";[.E80]); [.E80]) -> 52 | C80: of:=IF([.A80]=[.B80];"" ;[.B80]) ->  | D80: of:=IF([.G80];MIN(OFFSET(INDIRECT( ADDRESS(1;1; 1; ;[.$T$2])); (ROW() -26) * 2 ;0;2;1));"") -> 52 | E80: of:=IF([.G80];MAX(OFFSET(INDIRECT( ADDRESS(1;1; 1; ;[.$T$2])); (ROW() -26) * 2  ;0;2;1));"") -> 52 | F80: of:=IF([.G80];IF([.$T$2]="psiSkill";INDIRECT( ADDRESS((ROW()-25);1; 1; ;"ImprovedPsiSkill"));"");"") ->  | G80: of:=IF( INDIRECT( ADDRESS((ROW()-25)*2-1;1; 1;;"TU"))=0; FALSE();TRUE()) -> true | H80: of:=IF([.$G80];[.H$26];"") -> 50 | I80: of:=IF([.$G80];[.I$26];"") -> 80
A81: of:=IF([.$T$2]="psiSkill";  IF([.E81]=[.F81];[.B81];[.E81]-[.F81]); [.D81]) -> 51 | B81: of:=IF([.$T$2]="psiSkill";  IF([.E81]=0;"";[.E81]); [.E81]) -> 51 | C81: of:=IF([.A81]=[.B81];"" ;[.B81]) ->  | D81: of:=IF([.G81];MIN(OFFSET(INDIRECT( ADDRESS(1;1; 1; ;[.$T$2])); (ROW() -26) * 2 ;0;2;1));"") -> 51 | E81: of:=IF([.G81];MAX(OFFSET(INDIRECT( ADDRESS(1;1; 1; ;[.$T$2])); (ROW() -26) * 2  ;0;2;1));"") -> 51 | F81: of:=IF([.G81];IF([.$T$2]="psiSkill";INDIRECT( ADDRESS((ROW()-25);1; 1; ;"ImprovedPsiSkill"));"");"") ->  | G81: of:=IF( INDIRECT( ADDRESS((ROW()-25)*2-1;1; 1;;"TU"))=0; FALSE();TRUE()) -> true | H81: of:=IF([.$G81];[.H$26];"") -> 50 | I81: of:=IF([.$G81];[.I$26];"") -> 80
A82: of:=IF([.$T$2]="psiSkill";  IF([.E82]=[.F82];[.B82];[.E82]-[.F82]); [.D82]) -> 60 | B82: of:=IF([.$T$2]="psiSkill";  IF([.E82]=0;"";[.E82]); [.E82]) -> 60 | C82: of:=IF([.A82]=[.B82];"" ;[.B82]) ->  | D82: of:=IF([.G82];MIN(OFFSET(INDIRECT( ADDRESS(1;1; 1; ;[.$T$2])); (ROW() -26) * 2 ;0;2;1));"") -> 60 | E82: of:=IF([.G82];MAX(OFFSET(INDIRECT( ADDRESS(1;1; 1; ;[.$T$2])); (ROW() -26) * 2  ;0;2;1));"") -> 60 | F82: of:=IF([.G82];IF([.$T$2]="psiSkill";INDIRECT( ADDRESS((ROW()-25);1; 1; ;"ImprovedPsiSkill"));"");"") ->  | G82: of:=IF( INDIRECT( ADDRESS((ROW()-25)*2-1;1; 1;;"TU"))=0; FALSE();TRUE()) -> true | H82: of:=IF([.$G82];[.H$26];"") -> 50 | I82: of:=IF([.$G82];[.I$26];"") -> 80
A83: of:=IF([.$T$2]="psiSkill";  IF([.E83]=[.F83];[.B83];[.E83]-[.F83]); [.D83]) -> 52 | B83: of:=IF([.$T$2]="psiSkill";  IF([.E83]=0;"";[.E83]); [.E83]) -> 52 | C83: of:=IF([.A83]=[.B83];"" ;[.B83]) ->  | D83: of:=IF([.G83];MIN(OFFSET(INDIRECT( ADDRESS(1;1; 1; ;[.$T$2])); (ROW() -26) * 2 ;0;2;1));"") -> 52 | E83: of:=IF([.G83];MAX(OFFSET(INDIRECT( ADDRESS(1;1; 1; ;[.$T$2])); (ROW() -26) * 2  ;0;2;1));"") -> 52 | F83: of:=IF([.G83];IF([.$T$2]="psiSkill";INDIRECT( ADDRESS((ROW()-25);1; 1; ;"ImprovedPsiSkill"));"");"") ->  | G83: of:=IF( INDIRECT( ADDRESS((ROW()-25)*2-1;1; 1;;"TU"))=0; FALSE();TRUE()) -> true | H83: of:=IF([.$G83];[.H$26];"") -> 50 | I83: of:=IF([.$G83];[.I$26];"") -> 80
A84: of:=IF([.$T$2]="psiSkill";  IF([.E84]=[.F84];[.B84];[.E84]-[.F84]); [.D84]) -> 56 | B84: of:=IF([.$T$2]="psiSkill";  IF([.E84]=0;"";[.E84]); [.E84]) -> 56 | C84: of:=IF([.A84]=[.B84];"" ;[.B84]) ->  | D84: of:=IF([.G84];MIN(OFFSET(INDIRECT( ADDRESS(1;1; 1; ;[.$T$2])); (ROW() -26) * 2 ;0;2;1));"") -> 56 | E84: of:=IF([.G84];MAX(OFFSET(INDIRECT( ADDRESS(1;1; 1; ;[.$T$2])); (ROW() -26) * 2  ;0;2;1));"") -> 56 | F84: of:=IF([.G84];IF([.$T$2]="psiSkill";INDIRECT( ADDRESS((ROW()-25);1; 1; ;"ImprovedPsiSkill"));"");"") ->  | G84: of:=IF( INDIRECT( ADDRESS((ROW()-25)*2-1;1; 1;;"TU"))=0; FALSE();TRUE()) -> true | H84: of:=IF([.$G84];[.H$26];"") -> 50 | I84: of:=IF([.$G84];[.I$26];"") -> 80
A85: of:=IF([.$T$2]="psiSkill";  IF([.E85]=[.F85];[.B85];[.E85]-[.F85]); [.D85]) -> 52 | B85: of:=IF([.$T$2]="psiSkill";  IF([.E85]=0;"";[.E85]); [.E85]) -> 52 | C85: of:=IF([.A85]=[.B85];"" ;[.B85]) ->  | D85: of:=IF([.G85];MIN(OFFSET(INDIRECT( ADDRESS(1;1; 1; ;[.$T$2])); (ROW() -26) * 2 ;0;2;1));"") -> 52 | E85: of:=IF([.G85];MAX(OFFSET(INDIRECT( ADDRESS(1;1; 1; ;[.$T$2])); (ROW() -26) * 2  ;0;2;1));"") -> 52 | F85: of:=IF([.G85];IF([.$T$2]="psiSkill";INDIRECT( ADDRESS((ROW()-25);1; 1; ;"ImprovedPsiSkill"));"");"") ->  | G85: of:=IF( INDIRECT( ADDRESS((ROW()-25)*2-1;1; 1;;"TU"))=0; FALSE();TRUE()) -> true | H85: of:=IF([.$G85];[.H$26];"") -> 50 | I85: of:=IF([.$G85];[.I$26];"") -> 80
A86: of:=IF([.$T$2]="psiSkill";  IF([.E86]=[.F86];[.B86];[.E86]-[.F86]); [.D86]) -> 54 | B86: of:=IF([.$T$2]="psiSkill";  IF([.E86]=0;"";[.E86]); [.E86]) -> 54 | C86: of:=IF([.A86]=[.B86];"" ;[.B86]) ->  | D86: of:=IF([.G86];MIN(OFFSET(INDIRECT( ADDRESS(1;1; 1; ;[.$T$2])); (ROW() -26) * 2 ;0;2;1));"") -> 54 | E86: of:=IF([.G86];MAX(OFFSET(INDIRECT( ADDRESS(1;1; 1; ;[.$T$2])); (ROW() -26) * 2  ;0;2;1));"") -> 54 | F86: of:=IF([.G86];IF([.$T$2]="psiSkill";INDIRECT( ADDRESS((ROW()-25);1; 1; ;"ImprovedPsiSkill"));"");"") ->  | G86: of:=IF( INDIRECT( ADDRESS((ROW()-25)*2-1;1; 1;;"TU"))=0; FALSE();TRUE()) -> true | H86: of:=IF([.$G86];[.H$26];"") -> 50 | I86: of:=IF([.$G86];[.I$26];"") -> 80
A87: of:=IF([.$T$2]="psiSkill";  IF([.E87]=[.F87];[.B87];[.E87]-[.F87]); [.D87]) -> 60 | B87: of:=IF([.$T$2]="psiSkill";  IF([.E87]=0;"";[.E87]); [.E87]) -> 60 | C87: of:=IF([.A87]=[.B87];"" ;[.B87]) ->  | D87: of:=IF([.G87];MIN(OFFSET(INDIRECT( ADDRESS(1;1; 1; ;[.$T$2])); (ROW() -26) * 2 ;0;2;1));"") -> 60 | E87: of:=IF([.G87];MAX(OFFSET(INDIRECT( ADDRESS(1;1; 1; ;[.$T$2])); (ROW() -26) * 2  ;0;2;1));"") -> 60 | F87: of:=IF([.G87];IF([.$T$2]="psiSkill";INDIRECT( ADDRESS((ROW()-25);1; 1; ;"ImprovedPsiSkill"));"");"") ->  | G87: of:=IF( INDIRECT( ADDRESS((ROW()-25)*2-1;1; 1;;"TU"))=0; FALSE();TRUE()) -> true | H87: of:=IF([.$G87];[.H$26];"") -> 50 | I87: of:=IF([.$G87];[.I$26];"") -> 80
A88: of:=IF([.$T$2]="psiSkill";  IF([.E88]=[.F88];[.B88];[.E88]-[.F88]); [.D88]) -> 58 | B88: of:=IF([.$T$2]="psiSkill";  IF([.E88]=0;"";[.E88]); [.E88]) -> 58 | C88: of:=IF([.A88]=[.B88];"" ;[.B88]) ->  | D88: of:=IF([.G88];MIN(OFFSET(INDIRECT( ADDRESS(1;1; 1; ;[.$T$2])); (ROW() -26) * 2 ;0;2;1));"") -> 58 | E88: of:=IF([.G88];MAX(OFFSET(INDIRECT( ADDRESS(1;1; 1; ;[.$T$2])); (ROW() -26) * 2  ;0;2;1));"") -> 58 | F88: of:=IF([.G88];IF([.$T$2]="psiSkill";INDIRECT( ADDRESS((ROW()-25);1; 1; ;"ImprovedPsiSkill"));"");"") ->  | G88: of:=IF( INDIRECT( ADDRESS((ROW()-25)*2-1;1; 1;;"TU"))=0; FALSE();TRUE()) -> true | H88: of:=IF([.$G88];[.H$26];"") -> 50 | I88: of:=IF([.$G88];[.I$26];"") -> 80
A89: of:=IF([.$T$2]="psiSkill";  IF([.E89]=[.F89];[.B89];[.E89]-[.F89]); [.D89]) -> 55 | B89: of:=IF([.$T$2]="psiSkill";  IF([.E89]=0;"";[.E89]); [.E89]) -> 55 | C89: of:=IF([.A89]=[.B89];"" ;[.B89]) ->  | D89: of:=IF([.G89];MIN(OFFSET(INDIRECT( ADDRESS(1;1; 1; ;[.$T$2])); (ROW() -26) * 2 ;0;2;1));"") -> 55 | E89: of:=IF([.G89];MAX(OFFSET(INDIRECT( ADDRESS(1;1; 1; ;[.$T$2])); (ROW() -26) * 2  ;0;2;1));"") -> 55 | F89: of:=IF([.G89];IF([.$T$2]="psiSkill";INDIRECT( ADDRESS((ROW()-25);1; 1; ;"ImprovedPsiSkill"));"");"") ->  | G89: of:=IF( INDIRECT( ADDRESS((ROW()-25)*2-1;1; 1;;"TU"))=0; FALSE();TRUE()) -> true | H89: of:=IF([.$G89];[.H$26];"") -> 50 | I89: of:=IF([.$G89];[.I$26];"") -> 80
A90: of:=IF([.$T$2]="psiSkill";  IF([.E90]=[.F90];[.B90];[.E90]-[.F90]); [.D90]) -> 59 | B90: of:=IF([.$T$2]="psiSkill";  IF([.E90]=0;"";[.E90]); [.E90]) -> 59 | C90: of:=IF([.A90]=[.B90];"" ;[.B90]) ->  | D90: of:=IF([.G90];MIN(OFFSET(INDIRECT( ADDRESS(1;1; 1; ;[.$T$2])); (ROW() -26) * 2 ;0;2;1));"") -> 59 | E90: of:=IF([.G90];MAX(OFFSET(INDIRECT( ADDRESS(1;1; 1; ;[.$T$2])); (ROW() -26) * 2  ;0;2;1));"") -> 59 | F90: of:=IF([.G90];IF([.$T$2]="psiSkill";INDIRECT( ADDRESS((ROW()-25);1; 1; ;"ImprovedPsiSkill"));"");"") ->  | G90: of:=IF( INDIRECT( ADDRESS((ROW()-25)*2-1;1; 1;;"TU"))=0; FALSE();TRUE()) -> true | H90: of:=IF([.$G90];[.H$26];"") -> 50 | I90: of:=IF([.$G90];[.I$26];"") -> 80
A91: of:=IF([.$T$2]="psiSkill";  IF([.E91]=[.F91];[.B91];[.E91]-[.F91]); [.D91]) -> 55 | B91: of:=IF([.$T$2]="psiSkill";  IF([.E91]=0;"";[.E91]); [.E91]) -> 55 | C91: of:=IF([.A91]=[.B91];"" ;[.B91]) ->  | D91: of:=IF([.G91];MIN(OFFSET(INDIRECT( ADDRESS(1;1; 1; ;[.$T$2])); (ROW() -26) * 2 ;0;2;1));"") -> 55 | E91: of:=IF([.G91];MAX(OFFSET(INDIRECT( ADDRESS(1;1; 1; ;[.$T$2])); (ROW() -26) * 2  ;0;2;1));"") -> 55 | F91: of:=IF([.G91];IF([.$T$2]="psiSkill";INDIRECT( ADDRESS((ROW()-25);1; 1; ;"ImprovedPsiSkill"));"");"") ->  | G91: of:=IF( INDIRECT( ADDRESS((ROW()-25)*2-1;1; 1;;"TU"))=0; FALSE();TRUE()) -> true | H91: of:=IF([.$G91];[.H$26];"") -> 50 | I91: of:=IF([.$G91];[.I$26];"") -> 80
A92: of:=IF([.$T$2]="psiSkill";  IF([.E92]=[.F92];[.B92];[.E92]-[.F92]); [.D92]) -> 55 | B92: of:=IF([.$T$2]="psiSkill";  IF([.E92]=0;"";[.E92]); [.E92]) -> 55 | C92: of:=IF([.A92]=[.B92];"" ;[.B92]) ->  | D92: of:=IF([.G92];MIN(OFFSET(INDIRECT( ADDRESS(1;1; 1; ;[.$T$2])); (ROW() -26) * 2 ;0;2;1));"") -> 55 | E92: of:=IF([.G92];MAX(OFFSET(INDIRECT( ADDRESS(1;1; 1; ;[.$T$2])); (ROW() -26) * 2  ;0;2;1));"") -> 55 | F92: of:=IF([.G92];IF([.$T$2]="psiSkill";INDIRECT( ADDRESS((ROW()-25);1; 1; ;"ImprovedPsiSkill"));"");"") ->  | G92: of:=IF( INDIRECT( ADDRESS((ROW()-25)*2-1;1; 1;;"TU"))=0; FALSE();TRUE()) -> true | H92: of:=IF([.$G92];[.H$26];"") -> 50 | I92: of:=IF([.$G92];[.I$26];"") -> 80
A93: of:=IF([.$T$2]="psiSkill";  IF([.E93]=[.F93];[.B93];[.E93]-[.F93]); [.D93]) -> 58 | B93: of:=IF([.$T$2]="psiSkill";  IF([.E93]=0;"";[.E93]); [.E93]) -> 58 | C93: of:=IF([.A93]=[.B93];"" ;[.B93]) ->  | D93: of:=IF([.G93];MIN(OFFSET(INDIRECT( ADDRESS(1;1; 1; ;[.$T$2])); (ROW() -26) * 2 ;0;2;1));"") -> 58 | E93: of:=IF([.G93];MAX(OFFSET(INDIRECT( ADDRESS(1;1; 1; ;[.$T$2])); (ROW() -26) * 2  ;0;2;1));"") -> 58 | F93: of:=IF([.G93];IF([.$T$2]="psiSkill";INDIRECT( ADDRESS((ROW()-25);1; 1; ;"ImprovedPsiSkill"));"");"") ->  | G93: of:=IF( INDIRECT( ADDRESS((ROW()-25)*2-1;1; 1;;"TU"))=0; FALSE();TRUE()) -> true | H93: of:=IF([.$G93];[.H$26];"") -> 50 | I93: of:=IF([.$G93];[.I$26];"") -> 80
A94: of:=IF([.$T$2]="psiSkill";  IF([.E94]=[.F94];[.B94];[.E94]-[.F94]); [.D94]) -> 59 | B94: of:=IF([.$T$2]="psiSkill";  IF([.E94]=0;"";[.E94]); [.E94]) -> 63 | C94: of:=IF([.A94]=[.B94];"" ;[.B94]) -> 63 | D94: of:=IF([.G94];MIN(OFFSET(INDIRECT( ADDRESS(1;1; 1; ;[.$T$2])); (ROW() -26) * 2 ;0;2;1));"") -> 59 | E94: of:=IF([.G94];MAX(OFFSET(INDIRECT( ADDRESS(1;1; 1; ;[.$T$2])); (ROW() -26) * 2  ;0;2;1));"") -> 63 | F94: of:=IF([.G94];IF([.$T$2]="psiSkill";INDIRECT( ADDRESS((ROW()-25);1; 1; ;"ImprovedPsiSkill"));"");"") ->  | G94: of:=IF( INDIRECT( ADDRESS((ROW()-25)*2-1;1; 1;;"TU"))=0; FALSE();TRUE()) -> true | H94: of:=IF([.$G94];[.H$26];"") -> 50 | I94: of:=IF([.$G94];[.I$26];"") -> 80
A95: of:=IF([.$T$2]="psiSkill";  IF([.E95]=[.F95];[.B95];[.E95]-[.F95]); [.D95]) -> 60 | B95: of:=IF([.$T$2]="psiSkill";  IF([.E95]=0;"";[.E95]); [.E95]) -> 65 | C95: of:=IF([.A95]=[.B95];"" ;[.B95]) -> 65 | D95: of:=IF([.G95];MIN(OFFSET(INDIRECT( ADDRESS(1;1; 1; ;[.$T$2])); (ROW() -26) * 2 ;0;2;1));"") -> 60 | E95: of:=IF([.G95];MAX(OFFSET(INDIRECT( ADDRESS(1;1; 1; ;[.$T$2])); (ROW() -26) * 2  ;0;2;1));"") -> 65 | F95: of:=IF([.G95];IF([.$T$2]="psiSkill";INDIRECT( ADDRESS((ROW()-25);1; 1; ;"ImprovedPsiSkill"));"");"") ->  | G95: of:=IF( INDIRECT( ADDRESS((ROW()-25)*2-1;1; 1;;"TU"))=0; FALSE();TRUE()) -> true | H95: of:=IF([.$G95];[.H$26];"") -> 50 | I95: of:=IF([.$G95];[.I$26];"") -> 80
A96: of:=IF([.$T$2]="psiSkill";  IF([.E96]=[.F96];[.B96];[.E96]-[.F96]); [.D96]) -> 60 | B96: of:=IF([.$T$2]="psiSkill";  IF([.E96]=0;"";[.E96]); [.E96]) -> 63 | C96: of:=IF([.A96]=[.B96];"" ;[.B96]) -> 63 | D96: of:=IF([.G96];MIN(OFFSET(INDIRECT( ADDRESS(1;1; 1; ;[.$T$2])); (ROW() -26) * 2 ;0;2;1));"") -> 60 | E96: of:=IF([.G96];MAX(OFFSET(INDIRECT( ADDRESS(1;1; 1; ;[.$T$2])); (ROW() -26) * 2  ;0;2;1));"") -> 63 | F96: of:=IF([.G96];IF([.$T$2]="psiSkill";INDIRECT( ADDRESS((ROW()-25);1; 1; ;"ImprovedPsiSkill"));"");"") ->  | G96: of:=IF( INDIRECT( ADDRESS((ROW()-25)*2-1;1; 1;;"TU"))=0; FALSE();TRUE()) -> true | H96: of:=IF([.$G96];[.H$26];"") -> 50 | I96: of:=IF([.$G96];[.I$26];"") -> 80
A97: of:=IF([.$T$2]="psiSkill";  IF([.E97]=[.F97];[.B97];[.E97]-[.F97]); [.D97]) -> 56 | B97: of:=IF([.$T$2]="psiSkill";  IF([.E97]=0;"";[.E97]); [.E97]) -> 56 | C97: of:=IF([.A97]=[.B97];"" ;[.B97]) ->  | D97: of:=IF([.G97];MIN(OFFSET(INDIRECT( ADDRESS(1;1; 1; ;[.$T$2])); (ROW() -26) * 2 ;0;2;1));"") -> 56 | E97: of:=IF([.G97];MAX(OFFSET(INDIRECT( ADDRESS(1;1; 1; ;[.$T$2])); (ROW() -26) * 2  ;0;2;1));"") -> 56 | F97: of:=IF([.G97];IF([.$T$2]="psiSkill";INDIRECT( ADDRESS((ROW()-25);1; 1; ;"ImprovedPsiSkill"));"");"") ->  | G97: of:=IF( INDIRECT( ADDRESS((ROW()-25)*2-1;1; 1;;"TU"))=0; FALSE();TRUE()) -> true | H97: of:=IF([.$G97];[.H$26];"") -> 50 | I97: of:=IF([.$G97];[.I$26];"") -> 80
A98: of:=IF([.$T$2]="psiSkill";  IF([.E98]=[.F98];[.B98];[.E98]-[.F98]); [.D98]) -> 59 | B98: of:=IF([.$T$2]="psiSkill";  IF([.E98]=0;"";[.E98]); [.E98]) -> 59 | C98: of:=IF([.A98]=[.B98];"" ;[.B98]) ->  | D98: of:=IF([.G98];MIN(OFFSET(INDIRECT( ADDRESS(1;1; 1; ;[.$T$2])); (ROW() -26) * 2 ;0;2;1));"") -> 59 | E98: of:=IF([.G98];MAX(OFFSET(INDIRECT( ADDRESS(1;1; 1; ;[.$T$2])); (ROW() -26) * 2  ;0;2;1));"") -> 59 | F98: of:=IF([.G98];IF([.$T$2]="psiSkill";INDIRECT( ADDRESS((ROW()-25);1; 1; ;"ImprovedPsiSkill"));"");"") ->  | G98: of:=IF( INDIRECT( ADDRESS((ROW()-25)*2-1;1; 1;;"TU"))=0; FALSE();TRUE()) -> true | H98: of:=IF([.$G98];[.H$26];"") -> 50 | I98: of:=IF([.$G98];[.I$26];"") -> 80
A99: of:=IF([.$T$2]="psiSkill";  IF([.E99]=[.F99];[.B99];[.E99]-[.F99]); [.D99]) -> 50 | B99: of:=IF([.$T$2]="psiSkill";  IF([.E99]=0;"";[.E99]); [.E99]) -> 61 | C99: of:=IF([.A99]=[.B99];"" ;[.B99]) -> 61 | D99: of:=IF([.G99];MIN(OFFSET(INDIRECT( ADDRESS(1;1; 1; ;[.$T$2])); (ROW() -26) * 2 ;0;2;1));"") -> 50 | E99: of:=IF([.G99];MAX(OFFSET(INDIRECT( ADDRESS(1;1; 1; ;[.$T$2])); (ROW() -26) * 2  ;0;2;1));"") -> 61 | F99: of:=IF([.G99];IF([.$T$2]="psiSkill";INDIRECT( ADDRESS((ROW()-25);1; 1; ;"ImprovedPsiSkill"));"");"") ->  | G99: of:=IF( INDIRECT( ADDRESS((ROW()-25)*2-1;1; 1;;"TU"))=0; FALSE();TRUE()) -> true | H99: of:=IF([.$G99];[.H$26];"") -> 50 | I99: of:=IF([.$G99];[.I$26];"") -> 80
A100: of:=IF([.$T$2]="psiSkill";  IF([.E100]=[.F100];[.B100];[.E100]-[.F100]); [.D100]) -> 56 | B100: of:=IF([.$T$2]="psiSkill";  IF([.E100]=0;"";[.E100]); [.E100]) -> 65 | C100: of:=IF([.A100]=[.B100];"" ;[.B100]) -> 65 | D100: of:=IF([.G100];MIN(OFFSET(INDIRECT( ADDRESS(1;1; 1; ;[.$T$2])); (ROW() -26) * 2 ;0;2;1));"") -> 56 | E100: of:=IF([.G100];MAX(OFFSET(INDIRECT( ADDRESS(1;1; 1; ;[.$T$2])); (ROW() -26) * 2  ;0;2;1));"") -> 65 | F100: of:=IF([.G100];IF([.$T$2]="psiSkill";INDIRECT( ADDRESS((ROW()-25);1; 1; ;"ImprovedPsiSkill"));"");"") ->  | G100: of:=IF( INDIRECT( ADDRESS((ROW()-25)*2-1;1; 1;;"TU"))=0; FALSE();TRUE()) -> true | H100: of:=IF([.$G100];[.H$26];"") -> 50 | I100: of:=IF([.$G100];[.I$26];"") -> 80
A101: of:=IF([.$T$2]="psiSkill";  IF([.E101]=[.F101];[.B101];[.E101]-[.F101]); [.D101]) -> 52 | B101: of:=IF([.$T$2]="psiSkill";  IF([.E101]=0;"";[.E101]); [.E101]) -> 52 | C101: of:=IF([.A101]=[.B101];"" ;[.B101]) ->  | D101: of:=IF([.G101];MIN(OFFSET(INDIRECT( ADDRESS(1;1; 1; ;[.$T$2])); (ROW() -26) * 2 ;0;2;1));"") -> 52 | E101: of:=IF([.G101];MAX(OFFSET(INDIRECT( ADDRESS(1;1; 1; ;[.$T$2])); (ROW() -26) * 2  ;0;2;1));"") -> 52 | F101: of:=IF([.G101];IF([.$T$2]="psiSkill";INDIRECT( ADDRESS((ROW()-25);1; 1; ;"ImprovedPsiSkill"));"");"") ->  | G101: of:=IF( INDIRECT( ADDRESS((ROW()-25)*2-1;1; 1;;"TU"))=0; FALSE();TRUE()) -> true | H101: of:=IF([.$G101];[.H$26];"") -> 50 | I101: of:=IF([.$G101];[.I$26];"") -> 80
A102: of:=IF([.$T$2]="psiSkill";  IF([.E102]=[.F102];[.B102];[.E102]-[.F102]); [.D102]) -> 53 | B102: of:=IF([.$T$2]="psiSkill";  IF([.E102]=0;"";[.E102]); [.E102]) -> 53 | C102: of:=IF([.A102]=[.B102];"" ;[.B102]) ->  | D102: of:=IF([.G102];MIN(OFFSET(INDIRECT( ADDRESS(1;1; 1; ;[.$T$2])); (ROW() -26) * 2 ;0;2;1));"") -> 53 | E102: of:=IF([.G102];MAX(OFFSET(INDIRECT( ADDRESS(1;1; 1; ;[.$T$2])); (ROW() -26) * 2  ;0;2;1));"") -> 53 | F102: of:=IF([.G102];IF([.$T$2]="psiSkill";INDIRECT( ADDRESS((ROW()-25);1; 1; ;"ImprovedPsiSkill"));"");"") ->  | G102: of:=IF( INDIRECT( ADDRESS((ROW()-25)*2-1;1; 1;;"TU"))=0; FALSE();TRUE()) -> true | H102: of:=IF([.$G102];[.H$26];"") -> 50 | I102: of:=IF([.$G102];[.I$26];"") -> 80
A103: of:=IF([.$T$2]="psiSkill";  IF([.E103]=[.F103];[.B103];[.E103]-[.F103]); [.D103]) -> 50 | B103: of:=IF([.$T$2]="psiSkill";  IF([.E103]=0;"";[.E103]); [.E103]) -> 50 | C103: of:=IF([.A103]=[.B103];"" ;[.B103]) ->  | D103: of:=IF([.G103];MIN(OFFSET(INDIRECT( ADDRESS(1;1; 1; ;[.$T$2])); (ROW() -26) * 2 ;0;2;1));"") -> 50 | E103: of:=IF([.G103];MAX(OFFSET(INDIRECT( ADDRESS(1;1; 1; ;[.$T$2])); (ROW() -26) * 2  ;0;2;1));"") -> 50 | F103: of:=IF([.G103];IF([.$T$2]="psiSkill";INDIRECT( ADDRESS((ROW()-25);1; 1; ;"ImprovedPsiSkill"));"");"") ->  | G103: of:=IF( INDIRECT( ADDRESS((ROW()-25)*2-1;1; 1;;"TU"))=0; FALSE();TRUE()) -> true | H103: of:=IF([.$G103];[.H$26];"") -> 50 | I103: of:=IF([.$G103];[.I$26];"") -> 80
A104: of:=IF([.$T$2]="psiSkill";  IF([.E104]=[.F104];[.B104];[.E104]-[.F104]); [.D104]) -> 50 | B104: of:=IF([.$T$2]="psiSkill";  IF([.E104]=0;"";[.E104]); [.E104]) -> 50 | C104: of:=IF([.A104]=[.B104];"" ;[.B104]) ->  | D104: of:=IF([.G104];MIN(OFFSET(INDIRECT( ADDRESS(1;1; 1; ;[.$T$2])); (ROW() -26) * 2 ;0;2;1));"") -> 50 | E104: of:=IF([.G104];MAX(OFFSET(INDIRECT( ADDRESS(1;1; 1; ;[.$T$2])); (ROW() -26) * 2  ;0;2;1));"") -> 50 | F104: of:=IF([.G104];IF([.$T$2]="psiSkill";INDIRECT( ADDRESS((ROW()-25);1; 1; ;"ImprovedPsiSkill"));"");"") ->  | G104: of:=IF( INDIRECT( ADDRESS((ROW()-25)*2-1;1; 1;;"TU"))=0; FALSE();TRUE()) -> true | H104: of:=IF([.$G104];[.H$26];"") -> 50 | I104: of:=IF([.$G104];[.I$26];"") -> 80
A105: of:=IF([.$T$2]="psiSkill";  IF([.E105]=[.F105];[.B105];[.E105]-[.F105]); [.D105]) -> 55 | B105: of:=IF([.$T$2]="psiSkill";  IF([.E105]=0;"";[.E105]); [.E105]) -> 55 | C105: of:=IF([.A105]=[.B105];"" ;[.B105]) ->  | D105: of:=IF([.G105];MIN(OFFSET(INDIRECT( ADDRESS(1;1; 1; ;[.$T$2])); (ROW() -26) * 2 ;0;2;1));"") -> 55 | E105: of:=IF([.G105];MAX(OFFSET(INDIRECT( ADDRESS(1;1; 1; ;[.$T$2])); (ROW() -26) * 2  ;0;2;1));"") -> 55 | F105: of:=IF([.G105];IF([.$T$2]="psiSkill";INDIRECT( ADDRESS((ROW()-25);1; 1; ;"ImprovedPsiSkill"));"");"") ->  | G105: of:=IF( INDIRECT( ADDRESS((ROW()-25)*2-1;1; 1;;"TU"))=0; FALSE();TRUE()) -> true | H105: of:=IF([.$G105];[.H$26];"") -> 50 | I105: of:=IF([.$G105];[.I$26];"") -> 80
A106: of:=IF([.$T$2]="psiSkill";  IF([.E106]=[.F106];[.B106];[.E106]-[.F106]); [.D106]) -> 52 | B106: of:=IF([.$T$2]="psiSkill";  IF([.E106]=0;"";[.E106]); [.E106]) -> 54 | C106: of:=IF([.A106]=[.B106];"" ;[.B106]) -> 54 | D106: of:=IF([.G106];MIN(OFFSET(INDIRECT( ADDRESS(1;1; 1; ;[.$T$2])); (ROW() -26) * 2 ;0;2;1));"") -> 52 | E106: of:=IF([.G106];MAX(OFFSET(INDIRECT( ADDRESS(1;1; 1; ;[.$T$2])); (ROW() -26) * 2  ;0;2;1));"") -> 54 | F106: of:=IF([.G106];IF([.$T$2]="psiSkill";INDIRECT( ADDRESS((ROW()-25);1; 1; ;"ImprovedPsiSkill"));"");"") ->  | G106: of:=IF( INDIRECT( ADDRESS((ROW()-25)*2-1;1; 1;;"TU"))=0; FALSE();TRUE()) -> true | H106: of:=IF([.$G106];[.H$26];"") -> 50 | I106: of:=IF([.$G106];[.I$26];"") -> 80
A107: of:=IF([.$T$2]="psiSkill";  IF([.E107]=[.F107];[.B107];[.E107]-[.F107]); [.D107]) -> 53 | B107: of:=IF([.$T$2]="psiSkill";  IF([.E107]=0;"";[.E107]); [.E107]) -> 53 | C107: of:=IF([.A107]=[.B107];"" ;[.B107]) ->  | D107: of:=IF([.G107];MIN(OFFSET(INDIRECT( ADDRESS(1;1; 1; ;[.$T$2])); (ROW() -26) * 2 ;0;2;1));"") -> 53 | E107: of:=IF([.G107];MAX(OFFSET(INDIRECT( ADDRESS(1;1; 1; ;[.$T$2])); (ROW() -26) * 2  ;0;2;1));"") -> 53 | F107: of:=IF([.G107];IF([.$T$2]="psiSkill";INDIRECT( ADDRESS((ROW()-25);1; 1; ;"ImprovedPsiSkill"));"");"") ->  | G107: of:=IF( INDIRECT( ADDRESS((ROW()-25)*2-1;1; 1;;"TU"))=0; FALSE();TRUE()) -> true | H107: of:=IF([.$G107];[.H$26];"") -> 50 | I107: of:=IF([.$G107];[.I$26];"") -> 80
A108: of:=IF([.$T$2]="psiSkill";  IF([.E108]=[.F108];[.B108];[.E108]-[.F108]); [.D108]) -> 56 | B108: of:=IF([.$T$2]="psiSkill";  IF([.E108]=0;"";[.E108]); [.E108]) -> 59 | C108: of:=IF([.A108]=[.B108];"" ;[.B108]) -> 59 | D108: of:=IF([.G108];MIN(OFFSET(INDIRECT( ADDRESS(1;1; 1; ;[.$T$2])); (ROW() -26) * 2 ;0;2;1));"") -> 56 | E108: of:=IF([.G108];MAX(OFFSET(INDIRECT( ADDRESS(1;1; 1; ;[.$T$2])); (ROW() -26) * 2  ;0;2;1));"") -> 59 | F108: of:=IF([.G108];IF([.$T$2]="psiSkill";INDIRECT( ADDRESS((ROW()-25);1; 1; ;"ImprovedPsiSkill"));"");"") ->  | G108: of:=IF( INDIRECT( ADDRESS((ROW()-25)*2-1;1; 1;;"TU"))=0; FALSE();TRUE()) -> true | H108: of:=IF([.$G108];[.H$26];"") -> 50 | I108: of:=IF([.$G108];[.I$26];"") -> 80
A109: of:=IF([.$T$2]="psiSkill";  IF([.E109]=[.F109];[.B109];[.E109]-[.F109]); [.D109]) -> 50 | B109: of:=IF([.$T$2]="psiSkill";  IF([.E109]=0;"";[.E109]); [.E109]) -> 55 | C109: of:=IF([.A109]=[.B109];"" ;[.B109]) -> 55 | D109: of:=IF([.G109];MIN(OFFSET(INDIRECT( ADDRESS(1;1; 1; ;[.$T$2])); (ROW() -26) * 2 ;0;2;1));"") -> 50 | E109: of:=IF([.G109];MAX(OFFSET(INDIRECT( ADDRESS(1;1; 1; ;[.$T$2])); (ROW() -26) * 2  ;0;2;1));"") -> 55 | F109: of:=IF([.G109];IF([.$T$2]="psiSkill";INDIRECT( ADDRESS((ROW()-25);1; 1; ;"ImprovedPsiSkill"));"");"") ->  | G109: of:=IF( INDIRECT( ADDRESS((ROW()-25)*2-1;1; 1;;"TU"))=0; FALSE();TRUE()) -> true | H109: of:=IF([.$G109];[.H$26];"") -> 50 | I109: of:=IF([.$G109];[.I$26];"") -> 80
A110: of:=IF([.$T$2]="psiSkill";  IF([.E110]=[.F110];[.B110];[.E110]-[.F110]); [.D110]) -> 59 | B110: of:=IF([.$T$2]="psiSkill";  IF([.E110]=0;"";[.E110]); [.E110]) -> 59 | C110: of:=IF([.A110]=[.B110];"" ;[.B110]) ->  | D110: of:=IF([.G110];MIN(OFFSET(INDIRECT( ADDRESS(1;1; 1; ;[.$T$2])); (ROW() -26) * 2 ;0;2;1));"") -> 59 | E110: of:=IF([.G110];MAX(OFFSET(INDIRECT( ADDRESS(1;1; 1; ;[.$T$2])); (ROW() -26) * 2  ;0;2;1));"") -> 59 | F110: of:=IF([.G110];IF([.$T$2]="psiSkill";INDIRECT( ADDRESS((ROW()-25);1; 1; ;"ImprovedPsiSkill"));"");"") ->  | G110: of:=IF( INDIRECT( ADDRESS((ROW()-25)*2-1;1; 1;;"TU"))=0; FALSE();TRUE()) -> true | H110: of:=IF([.$G110];[.H$26];"") -> 50 | I110: of:=IF([.$G110];[.I$26];"") -> 80
A111: of:=IF([.$T$2]="psiSkill";  IF([.E111]=[.F111];[.B111];[.E111]-[.F111]); [.D111]) -> 52 | B111: of:=IF([.$T$2]="psiSkill";  IF([.E111]=0;"";[.E111]); [.E111]) -> 52 | C111: of:=IF([.A111]=[.B111];"" ;[.B111]) ->  | D111: of:=IF([.G111];MIN(OFFSET(INDIRECT( ADDRESS(1;1; 1; ;[.$T$2])); (ROW() -26) * 2 ;0;2;1));"") -> 52 | E111: of:=IF([.G111];MAX(OFFSET(INDIRECT( ADDRESS(1;1; 1; ;[.$T$2])); (ROW() -26) * 2  ;0;2;1));"") -> 52 | F111: of:=IF([.G111];IF([.$T$2]="psiSkill";INDIRECT( ADDRESS((ROW()-25);1; 1; ;"ImprovedPsiSkill"));"");"") ->  | G111: of:=IF( INDIRECT( ADDRESS((ROW()-25)*2-1;1; 1;;"TU"))=0; FALSE();TRUE()) -> true | H111: of:=IF([.$G111];[.H$26];"") -> 50 | I111: of:=IF([.$G111];[.I$26];"") -> 80
A112: of:=IF([.$T$2]="psiSkill";  IF([.E112]=[.F112];[.B112];[.E112]-[.F112]); [.D112]) -> 55 | B112: of:=IF([.$T$2]="psiSkill";  IF([.E112]=0;"";[.E112]); [.E112]) -> 55 | C112: of:=IF([.A112]=[.B112];"" ;[.B112]) ->  | D112: of:=IF([.G112];MIN(OFFSET(INDIRECT( ADDRESS(1;1; 1; ;[.$T$2])); (ROW() -26) * 2 ;0;2;1));"") -> 55 | E112: of:=IF([.G112];MAX(OFFSET(INDIRECT( ADDRESS(1;1; 1; ;[.$T$2])); (ROW() -26) * 2  ;0;2;1));"") -> 55 | F112: of:=IF([.G112];IF([.$T$2]="psiSkill";INDIRECT( ADDRESS((ROW()-25);1; 1; ;"ImprovedPsiSkill"));"");"") ->  | G112: of:=IF( INDIRECT( ADDRESS((ROW()-25)*2-1;1; 1;;"TU"))=0; FALSE();TRUE()) -> true | H112: of:=IF([.$G112];[.H$26];"") -> 50 | I112: of:=IF([.$G112];[.I$26];"") -> 80
A113: of:=IF([.$T$2]="psiSkill";  IF([.E113]=[.F113];[.B113];[.E113]-[.F113]); [.D113]) -> 58 | B113: of:=IF([.$T$2]="psiSkill";  IF([.E113]=0;"";[.E113]); [.E113]) -> 58 | C113: of:=IF([.A113]=[.B113];"" ;[.B113]) ->  | D113: of:=IF([.G113];MIN(OFFSET(INDIRECT( ADDRESS(1;1; 1; ;[.$T$2])); (ROW() -26) * 2 ;0;2;1));"") -> 58 | E113: of:=IF([.G113];MAX(OFFSET(INDIRECT( ADDRESS(1;1; 1; ;[.$T$2])); (ROW() -26) * 2  ;0;2;1));"") -> 58 | F113: of:=IF([.G113];IF([.$T$2]="psiSkill";INDIRECT( ADDRESS((ROW()-25);1; 1; ;"ImprovedPsiSkill"));"");"") ->  | G113: of:=IF( INDIRECT( ADDRESS((ROW()-25)*2-1;1; 1;;"TU"))=0; FALSE();TRUE()) -> true | H113: of:=IF([.$G113];[.H$26];"") -> 50 | I113: of:=IF([.$G113];[.I$26];"") -> 80
A114: of:=IF([.$T$2]="psiSkill";  IF([.E114]=[.F114];[.B114];[.E114]-[.F114]); [.D114]) -> 55 | B114: of:=IF([.$T$2]="psiSkill";  IF([.E114]=0;"";[.E114]); [.E114]) -> 56 | C114: of:=IF([.A114]=[.B114];"" ;[.B114]) -> 56 | D114: of:=IF([.G114];MIN(OFFSET(INDIRECT( ADDRESS(1;1; 1; ;[.$T$2])); (ROW() -26) * 2 ;0;2;1));"") -> 55 | E114: of:=IF([.G114];MAX(OFFSET(INDIRECT( ADDRESS(1;1; 1; ;[.$T$2])); (ROW() -26) * 2  ;0;2;1));"") -> 56 | F114: of:=IF([.G114];IF([.$T$2]="psiSkill";INDIRECT( ADDRESS((ROW()-25);1; 1; ;"ImprovedPsiSkill"));"");"") ->  | G114: of:=IF( INDIRECT( ADDRESS((ROW()-25)*2-1;1; 1;;"TU"))=0; FALSE();TRUE()) -> true | H114: of:=IF([.$G114];[.H$26];"") -> 50 | I114: of:=IF([.$G114];[.I$26];"") -> 80
A115: of:=IF([.$T$2]="psiSkill";  IF([.E115]=[.F115];[.B115];[.E115]-[.F115]); [.D115]) -> 56 | B115: of:=IF([.$T$2]="psiSkill";  IF([.E115]=0;"";[.E115]); [.E115]) -> 56 | C115: of:=IF([.A115]=[.B115];"" ;[.B115]) ->  | D115: of:=IF([.G115];MIN(OFFSET(INDIRECT( ADDRESS(1;1; 1; ;[.$T$2])); (ROW() -26) * 2 ;0;2;1));"") -> 56 | E115: of:=IF([.G115];MAX(OFFSET(INDIRECT( ADDRESS(1;1; 1; ;[.$T$2])); (ROW() -26) * 2  ;0;2;1));"") -> 56 | F115: of:=IF([.G115];IF([.$T$2]="psiSkill";INDIRECT( ADDRESS((ROW()-25);1; 1; ;"ImprovedPsiSkill"));"");"") ->  | G115: of:=IF( INDIRECT( ADDRESS((ROW()-25)*2-1;1; 1;;"TU"))=0; FALSE();TRUE()) -> true | H115: of:=IF([.$G115];[.H$26];"") -> 50 | I115: of:=IF([.$G115];[.I$26];"") -> 80
A116: of:=IF([.$T$2]="psiSkill";  IF([.E116]=[.F116];[.B116];[.E116]-[.F116]); [.D116]) -> 56 | B116: of:=IF([.$T$2]="psiSkill";  IF([.E116]=0;"";[.E116]); [.E116]) -> 56 | C116: of:=IF([.A116]=[.B116];"" ;[.B116]) ->  | D116: of:=IF([.G116];MIN(OFFSET(INDIRECT( ADDRESS(1;1; 1; ;[.$T$2])); (ROW() -26) * 2 ;0;2;1));"") -> 56 | E116: of:=IF([.G116];MAX(OFFSET(INDIRECT( ADDRESS(1;1; 1; ;[.$T$2])); (ROW() -26) * 2  ;0;2;1));"") -> 56 | F116: of:=IF([.G116];IF([.$T$2]="psiSkill";INDIRECT( ADDRESS((ROW()-25);1; 1; ;"ImprovedPsiSkill"));"");"") ->  | G116: of:=IF( INDIRECT( ADDRESS((ROW()-25)*2-1;1; 1;;"TU"))=0; FALSE();TRUE()) -> true | H116: of:=IF([.$G116];[.H$26];"") -> 50 | I116: of:=IF([.$G116];[.I$26];"") -> 80
A117: of:=IF([.$T$2]="psiSkill";  IF([.E117]=[.F117];[.B117];[.E117]-[.F117]); [.D117]) -> 59 | B117: of:=IF([.$T$2]="psiSkill";  IF([.E117]=0;"";[.E117]); [.E117]) -> 59 | C117: of:=IF([.A117]=[.B117];"" ;[.B117]) ->  | D117: of:=IF([.G117];MIN(OFFSET(INDIRECT( ADDRESS(1;1; 1; ;[.$T$2])); (ROW() -26) * 2 ;0;2;1));"") -> 59 | E117: of:=IF([.G117];MAX(OFFSET(INDIRECT( ADDRESS(1;1; 1; ;[.$T$2])); (ROW() -26) * 2  ;0;2;1));"") -> 59 | F117: of:=IF([.G117];IF([.$T$2]="psiSkill";INDIRECT( ADDRESS((ROW()-25);1; 1; ;"ImprovedPsiSkill"));"");"") ->  | G117: of:=IF( INDIRECT( ADDRESS((ROW()-25)*2-1;1; 1;;"TU"))=0; FALSE();TRUE()) -> true | H117: of:=IF([.$G117];[.H$26];"") -> 50 | I117: of:=IF([.$G117];[.I$26];"") -> 80
A118: of:=IF([.$T$2]="psiSkill";  IF([.E118]=[.F118];[.B118];[.E118]-[.F118]); [.D118]) -> 58 | B118: of:=IF([.$T$2]="psiSkill";  IF([.E118]=0;"";[.E118]); [.E118]) -> 62 | C118: of:=IF([.A118]=[.B118];"" ;[.B118]) -> 62 | D118: of:=IF([.G118];MIN(OFFSET(INDIRECT( ADDRESS(1;1; 1; ;[.$T$2])); (ROW() -26) * 2 ;0;2;1));"") -> 58 | E118: of:=IF([.G118];MAX(OFFSET(INDIRECT( ADDRESS(1;1; 1; ;[.$T$2])); (ROW() -26) * 2  ;0;2;1));"") -> 62 | F118: of:=IF([.G118];IF([.$T$2]="psiSkill";INDIRECT( ADDRESS((ROW()-25);1; 1; ;"ImprovedPsiSkill"));"");"") ->  | G118: of:=IF( INDIRECT( ADDRESS((ROW()-25)*2-1;1; 1;;"TU"))=0; FALSE();TRUE()) -> true | H118: of:=IF([.$G118];[.H$26];"") -> 50 | I118: of:=IF([.$G118];[.I$26];"") -> 80
A119: of:=IF([.$T$2]="psiSkill";  IF([.E119]=[.F119];[.B119];[.E119]-[.F119]); [.D119]) -> 55 | B119: of:=IF([.$T$2]="psiSkill";  IF([.E119]=0;"";[.E119]); [.E119]) -> 59 | C119: of:=IF([.A119]=[.B119];"" ;[.B119]) -> 59 | D119: of:=IF([.G119];MIN(OFFSET(INDIRECT( ADDRESS(1;1; 1; ;[.$T$2])); (ROW() -26) * 2 ;0;2;1));"") -> 55 | E119: of:=IF([.G119];MAX(OFFSET(INDIRECT( ADDRESS(1;1; 1; ;[.$T$2])); (ROW() -26) * 2  ;0;2;1));"") -> 59 | F119: of:=IF([.G119];IF([.$T$2]="psiSkill";INDIRECT( ADDRESS((ROW()-25);1; 1; ;"ImprovedPsiSkill"));"");"") ->  | G119: of:=IF( INDIRECT( ADDRESS((ROW()-25)*2-1;1; 1;;"TU"))=0; FALSE();TRUE()) -> true | H119: of:=IF([.$G119];[.H$26];"") -> 50 | I119: of:=IF([.$G119];[.I$26];"") -> 80
A120: of:=IF([.$T$2]="psiSkill";  IF([.E120]=[.F120];[.B120];[.E120]-[.F120]); [.D120]) -> 52 | B120: of:=IF([.$T$2]="psiSkill";  IF([.E120]=0;"";[.E120]); [.E120]) -> 57 | C120: of:=IF([.A120]=[.B120];"" ;[.B120]) -> 57 | D120: of:=IF([.G120];MIN(OFFSET(INDIRECT( ADDRESS(1;1; 1; ;[.$T$2])); (ROW() -26) * 2 ;0;2;1));"") -> 52 | E120: of:=IF([.G120];MAX(OFFSET(INDIRECT( ADDRESS(1;1; 1; ;[.$T$2])); (ROW() -26) * 2  ;0;2;1));"") -> 57 | F120: of:=IF([.G120];IF([.$T$2]="psiSkill";INDIRECT( ADDRESS((ROW()-25);1; 1; ;"ImprovedPsiSkill"));"");"") ->  | G120: of:=IF( INDIRECT( ADDRESS((ROW()-25)*2-1;1; 1;;"TU"))=0; FALSE();TRUE()) -> true | H120: of:=IF([.$G120];[.H$26];"") -> 50 | I120: of:=IF([.$G120];[.I$26];"") -> 80
A121: of:=IF([.$T$2]="psiSkill";  IF([.E121]=[.F121];[.B121];[.E121]-[.F121]); [.D121]) -> 56 | B121: of:=IF([.$T$2]="psiSkill";  IF([.E121]=0;"";[.E121]); [.E121]) -> 56 | C121: of:=IF([.A121]=[.B121];"" ;[.B121]) ->  | D121: of:=IF([.G121];MIN(OFFSET(INDIRECT( ADDRESS(1;1; 1; ;[.$T$2])); (ROW() -26) * 2 ;0;2;1));"") -> 56 | E121: of:=IF([.G121];MAX(OFFSET(INDIRECT( ADDRESS(1;1; 1; ;[.$T$2])); (ROW() -26) * 2  ;0;2;1));"") -> 56 | F121: of:=IF([.G121];IF([.$T$2]="psiSkill";INDIRECT( ADDRESS((ROW()-25);1; 1; ;"ImprovedPsiSkill"));"");"") ->  | G121: of:=IF( INDIRECT( ADDRESS((ROW()-25)*2-1;1; 1;;"TU"))=0; FALSE();TRUE()) -> true | H121: of:=IF([.$G121];[.H$26];"") -> 50 | I121: of:=IF([.$G121];[.I$26];"") -> 80
A122: of:=IF([.$T$2]="psiSkill";  IF([.E122]=[.F122];[.B122];[.E122]-[.F122]); [.D122]) -> 60 | B122: of:=IF([.$T$2]="psiSkill";  IF([.E122]=0;"";[.E122]); [.E122]) -> 60 | C122: of:=IF([.A122]=[.B122];"" ;[.B122]) ->  | D122: of:=IF([.G122];MIN(OFFSET(INDIRECT( ADDRESS(1;1; 1; ;[.$T$2])); (ROW() -26) * 2 ;0;2;1));"") -> 60 | E122: of:=IF([.G122];MAX(OFFSET(INDIRECT( ADDRESS(1;1; 1; ;[.$T$2])); (ROW() -26) * 2  ;0;2;1));"") -> 60 | F122: of:=IF([.G122];IF([.$T$2]="psiSkill";INDIRECT( ADDRESS((ROW()-25);1; 1; ;"ImprovedPsiSkill"));"");"") ->  | G122: of:=IF( INDIRECT( ADDRESS((ROW()-25)*2-1;1; 1;;"TU"))=0; FALSE();TRUE()) -> true | H122: of:=IF([.$G122];[.H$26];"") -> 50 | I122: of:=IF([.$G122];[.I$26];"") -> 80
A123: of:=IF([.$T$2]="psiSkill";  IF([.E123]=[.F123];[.B123];[.E123]-[.F123]); [.D123]) -> 58 | B123: of:=IF([.$T$2]="psiSkill";  IF([.E123]=0;"";[.E123]); [.E123]) -> 58 | C123: of:=IF([.A123]=[.B123];"" ;[.B123]) ->  | D123: of:=IF([.G123];MIN(OFFSET(INDIRECT( ADDRESS(1;1; 1; ;[.$T$2])); (ROW() -26) * 2 ;0;2;1));"") -> 58 | E123: of:=IF([.G123];MAX(OFFSET(INDIRECT( ADDRESS(1;1; 1; ;[.$T$2])); (ROW() -26) * 2  ;0;2;1));"") -> 58 | F123: of:=IF([.G123];IF([.$T$2]="psiSkill";INDIRECT( ADDRESS((ROW()-25);1; 1; ;"ImprovedPsiSkill"));"");"") ->  | G123: of:=IF( INDIRECT( ADDRESS((ROW()-25)*2-1;1; 1;;"TU"))=0; FALSE();TRUE()) -> true | H123: of:=IF([.$G123];[.H$26];"") -> 50 | I123: of:=IF([.$G123];[.I$26];"") -> 80
A124: of:=IF([.$T$2]="psiSkill";  IF([.E124]=[.F124];[.B124];[.E124]-[.F124]); [.D124]) -> 57 | B124: of:=IF([.$T$2]="psiSkill";  IF([.E124]=0;"";[.E124]); [.E124]) -> 57 | C124: of:=IF([.A124]=[.B124];"" ;[.B124]) ->  | D124: of:=IF([.G124];MIN(OFFSET(INDIRECT( ADDRESS(1;1; 1; ;[.$T$2])); (ROW() -26) * 2 ;0;2;1));"") -> 57 | E124: of:=IF([.G124];MAX(OFFSET(INDIRECT( ADDRESS(1;1; 1; ;[.$T$2])); (ROW() -26) * 2  ;0;2;1));"") -> 57 | F124: of:=IF([.G124];IF([.$T$2]="psiSkill";INDIRECT( ADDRESS((ROW()-25);1; 1; ;"ImprovedPsiSkill"));"");"") ->  | G124: of:=IF( INDIRECT( ADDRESS((ROW()-25)*2-1;1; 1;;"TU"))=0; FALSE();TRUE()) -> true | H124: of:=IF([.$G124];[.H$26];"") -> 50 | I124: of:=IF([.$G124];[.I$26];"") -> 80
A125: of:=IF([.$T$2]="psiSkill";  IF([.E125]=[.F125];[.B125];[.E125]-[.F125]); [.D125]) -> 59 | B125: of:=IF([.$T$2]="psiSkill";  IF([.E125]=0;"";[.E125]); [.E125]) -> 59 | C125: of:=IF([.A125]=[.B125];"" ;[.B125]) ->  | D125: of:=IF([.G125];MIN(OFFSET(INDIRECT( ADDRESS(1;1; 1; ;[.$T$2])); (ROW() -26) * 2 ;0;2;1));"") -> 59 | E125: of:=IF([.G125];MAX(OFFSET(INDIRECT( ADDRESS(1;1; 1; ;[.$T$2])); (ROW() -26) * 2  ;0;2;1));"") -> 59 | F125: of:=IF([.G125];IF([.$T$2]="psiSkill";INDIRECT( ADDRESS((ROW()-25);1; 1; ;"ImprovedPsiSkill"));"");"") ->  | G125: of:=IF( INDIRECT( ADDRESS((ROW()-25)*2-1;1; 1;;"TU"))=0; FALSE();TRUE()) -> true | H125: of:=IF([.$G125];[.H$26];"") -> 50 | I125: of:=IF([.$G125];[.I$26];"") -> 80
A126: of:=IF([.$T$2]="psiSkill";  IF([.E126]=[.F126];[.B126];[.E126]-[.F126]); [.D126]) -> 59 | B126: of:=IF([.$T$2]="psiSkill";  IF([.E126]=0;"";[.E126]); [.E126]) -> 59 | C126: of:=IF([.A126]=[.B126];"" ;[.B126]) ->  | D126: of:=IF([.G126];MIN(OFFSET(INDIRECT( ADDRESS(1;1; 1; ;[.$T$2])); (ROW() -26) * 2 ;0;2;1));"") -> 59 | E126: of:=IF([.G126];MAX(OFFSET(INDIRECT( ADDRESS(1;1; 1; ;[.$T$2])); (ROW() -26) * 2  ;0;2;1));"") -> 59 | F126: of:=IF([.G126];IF([.$T$2]="psiSkill";INDIRECT( ADDRESS((ROW()-25);1; 1; ;"ImprovedPsiSkill"));"");"") ->  | G126: of:=IF( INDIRECT( ADDRESS((ROW()-25)*2-1;1; 1;;"TU"))=0; FALSE();TRUE()) -> true | H126: of:=IF([.$G126];[.H$26];"") -> 50 | I126: of:=IF([.$G126];[.I$26];"") -> 80
A127: of:=IF([.$T$2]="psiSkill";  IF([.E127]=[.F127];[.B127];[.E127]-[.F127]); [.D127]) -> 60 | B127: of:=IF([.$T$2]="psiSkill";  IF([.E127]=0;"";[.E127]); [.E127]) -> 60 | C127: of:=IF([.A127]=[.B127];"" ;[.B127]) ->  | D127: of:=IF([.G127];MIN(OFFSET(INDIRECT( ADDRESS(1;1; 1; ;[.$T$2])); (ROW() -26) * 2 ;0;2;1));"") -> 60 | E127: of:=IF([.G127];MAX(OFFSET(INDIRECT( ADDRESS(1;1; 1; ;[.$T$2])); (ROW() -26) * 2  ;0;2;1));"") -> 60 | F127: of:=IF([.G127];IF([.$T$2]="psiSkill";INDIRECT( ADDRESS((ROW()-25);1; 1; ;"ImprovedPsiSkill"));"");"") ->  | G127: of:=IF( INDIRECT( ADDRESS((ROW()-25)*2-1;1; 1;;"TU"))=0; FALSE();TRUE()) -> true | H127: of:=IF([.$G127];[.H$26];"") -> 50 | I127: of:=IF([.$G127];[.I$26];"") -> 80
A128: of:=IF([.$T$2]="psiSkill";  IF([.E128]=[.F128];[.B128];[.E128]-[.F128]); [.D128]) -> 55 | B128: of:=IF([.$T$2]="psiSkill";  IF([.E128]=0;"";[.E128]); [.E128]) -> 55 | C128: of:=IF([.A128]=[.B128];"" ;[.B128]) ->  | D128: of:=IF([.G128];MIN(OFFSET(INDIRECT( ADDRESS(1;1; 1; ;[.$T$2])); (ROW() -26) * 2 ;0;2;1));"") -> 55 | E128: of:=IF([.G128];MAX(OFFSET(INDIRECT( ADDRESS(1;1; 1; ;[.$T$2])); (ROW() -26) * 2  ;0;2;1));"") -> 55 | F128: of:=IF([.G128];IF([.$T$2]="psiSkill";INDIRECT( ADDRESS((ROW()-25);1; 1; ;"ImprovedPsiSkill"));"");"") ->  | G128: of:=IF( INDIRECT( ADDRESS((ROW()-25)*2-1;1; 1;;"TU"))=0; FALSE();TRUE()) -> true | H128: of:=IF([.$G128];[.H$26];"") -> 50 | I128: of:=IF([.$G128];[.I$26];"") -> 80
A129: of:=IF([.$T$2]="psiSkill";  IF([.E129]=[.F129];[.B129];[.E129]-[.F129]); [.D129]) -> 59 | B129: of:=IF([.$T$2]="psiSkill";  IF([.E129]=0;"";[.E129]); [.E129]) -> 59 | C129: of:=IF([.A129]=[.B129];"" ;[.B129]) ->  | D129: of:=IF([.G129];MIN(OFFSET(INDIRECT( ADDRESS(1;1; 1; ;[.$T$2])); (ROW() -26) * 2 ;0;2;1));"") -> 59 | E129: of:=IF([.G129];MAX(OFFSET(INDIRECT( ADDRESS(1;1; 1; ;[.$T$2])); (ROW() -26) * 2  ;0;2;1));"") -> 59 | F129: of:=IF([.G129];IF([.$T$2]="psiSkill";INDIRECT( ADDRESS((ROW()-25);1; 1; ;"ImprovedPsiSkill"));"");"") ->  | G129: of:=IF( INDIRECT( ADDRESS((ROW()-25)*2-1;1; 1;;"TU"))=0; FALSE();TRUE()) -> true | H129: of:=IF([.$G129];[.H$26];"") -> 50 | I129: of:=IF([.$G129];[.I$26];"") -> 80
A130: of:=IF([.$T$2]="psiSkill";  IF([.E130]=[.F130];[.B130];[.E130]-[.F130]); [.D130]) -> 59 | B130: of:=IF([.$T$2]="psiSkill";  IF([.E130]=0;"";[.E130]); [.E130]) -> 59 | C130: of:=IF([.A130]=[.B130];"" ;[.B130]) ->  | D130: of:=IF([.G130];MIN(OFFSET(INDIRECT( ADDRESS(1;1; 1; ;[.$T$2])); (ROW() -26) * 2 ;0;2;1));"") -> 59 | E130: of:=IF([.G130];MAX(OFFSET(INDIRECT( ADDRESS(1;1; 1; ;[.$T$2])); (ROW() -26) * 2  ;0;2;1));"") -> 59 | F130: of:=IF([.G130];IF([.$T$2]="psiSkill";INDIRECT( ADDRESS((ROW()-25);1; 1; ;"ImprovedPsiSkill"));"");"") ->  | G130: of:=IF( INDIRECT( ADDRESS((ROW()-25)*2-1;1; 1;;"TU"))=0; FALSE();TRUE()) -> true | H130: of:=IF([.$G130];[.H$26];"") -> 50 | I130: of:=IF([.$G130];[.I$26];"") -> 80
A131: of:=IF([.$T$2]="psiSkill";  IF([.E131]=[.F131];[.B131];[.E131]-[.F131]); [.D131]) -> 55 | B131: of:=IF([.$T$2]="psiSkill";  IF([.E131]=0;"";[.E131]); [.E131]) -> 57 | C131: of:=IF([.A131]=[.B131];"" ;[.B131]) -> 57 | D131: of:=IF([.G131];MIN(OFFSET(INDIRECT( ADDRESS(1;1; 1; ;[.$T$2])); (ROW() -26) * 2 ;0;2;1));"") -> 55 | E131: of:=IF([.G131];MAX(OFFSET(INDIRECT( ADDRESS(1;1; 1; ;[.$T$2])); (ROW() -26) * 2  ;0;2;1));"") -> 57 | F131: of:=IF([.G131];IF([.$T$2]="psiSkill";INDIRECT( ADDRESS((ROW()-25);1; 1; ;"ImprovedPsiSkill"));"");"") ->  | G131: of:=IF( INDIRECT( ADDRESS((ROW()-25)*2-1;1; 1;;"TU"))=0; FALSE();TRUE()) -> true | H131: of:=IF([.$G131];[.H$26];"") -> 50 | I131: of:=IF([.$G131];[.I$26];"") -> 80
A132: of:=IF([.$T$2]="psiSkill";  IF([.E132]=[.F132];[.B132];[.E132]-[.F132]); [.D132]) -> 59 | B132: of:=IF([.$T$2]="psiSkill";  IF([.E132]=0;"";[.E132]); [.E132]) -> 59 | C132: of:=IF([.A132]=[.B132];"" ;[.B132]) ->  | D132: of:=IF([.G132];MIN(OFFSET(INDIRECT( ADDRESS(1;1; 1; ;[.$T$2])); (ROW() -26) * 2 ;0;2;1));"") -> 59 | E132: of:=IF([.G132];MAX(OFFSET(INDIRECT( ADDRESS(1;1; 1; ;[.$T$2])); (ROW() -26) * 2  ;0;2;1));"") -> 59 | F132: of:=IF([.G132];IF([.$T$2]="psiSkill";INDIRECT( ADDRESS((ROW()-25);1; 1; ;"ImprovedPsiSkill"));"");"") ->  | G132: of:=IF( INDIRECT( ADDRESS((ROW()-25)*2-1;1; 1;;"TU"))=0; FALSE();TRUE()) -> true | H132: of:=IF([.$G132];[.H$26];"") -> 50 | I132: of:=IF([.$G132];[.I$26];"") -> 80
A133: of:=IF([.$T$2]="psiSkill";  IF([.E133]=[.F133];[.B133];[.E133]-[.F133]); [.D133]) -> 58 | B133: of:=IF([.$T$2]="psiSkill";  IF([.E133]=0;"";[.E133]); [.E133]) -> 58 | C133: of:=IF([.A133]=[.B133];"" ;[.B133]) ->  | D133: of:=IF([.G133];MIN(OFFSET(INDIRECT( ADDRESS(1;1; 1; ;[.$T$2])); (ROW() -26) * 2 ;0;2;1));"") -> 58 | E133: of:=IF([.G133];MAX(OFFSET(INDIRECT( ADDRESS(1;1; 1; ;[.$T$2])); (ROW() -26) * 2  ;0;2;1));"") -> 58 | F133: of:=IF([.G133];IF([.$T$2]="psiSkill";INDIRECT( ADDRESS((ROW()-25);1; 1; ;"ImprovedPsiSkill"));"");"") ->  | G133: of:=IF( INDIRECT( ADDRESS((ROW()-25)*2-1;1; 1;;"TU"))=0; FALSE();TRUE()) -> true | H133: of:=IF([.$G133];[.H$26];"") -> 50 | I133: of:=IF([.$G133];[.I$26];"") -> 80
A134: of:=IF([.$T$2]="psiSkill";  IF([.E134]=[.F134];[.B134];[.E134]-[.F134]); [.D134]) -> 54 | B134: of:=IF([.$T$2]="psiSkill";  IF([.E134]=0;"";[.E134]); [.E134]) -> 56 | C134: of:=IF([.A134]=[.B134];"" ;[.B134]) -> 56 | D134: of:=IF([.G134];MIN(OFFSET(INDIRECT( ADDRESS(1;1; 1; ;[.$T$2])); (ROW() -26) * 2 ;0;2;1));"") -> 54 | E134: of:=IF([.G134];MAX(OFFSET(INDIRECT( ADDRESS(1;1; 1; ;[.$T$2])); (ROW() -26) * 2  ;0;2;1));"") -> 56 | F134: of:=IF([.G134];IF([.$T$2]="psiSkill";INDIRECT( ADDRESS((ROW()-25);1; 1; ;"ImprovedPsiSkill"));"");"") ->  | G134: of:=IF( INDIRECT( ADDRESS((ROW()-25)*2-1;1; 1;;"TU"))=0; FALSE();TRUE()) -> true | H134: of:=IF([.$G134];[.H$26];"") -> 50 | I134: of:=IF([.$G134];[.I$26];"") -> 80
A135: of:=IF([.$T$2]="psiSkill";  IF([.E135]=[.F135];[.B135];[.E135]-[.F135]); [.D135]) -> 52 | B135: of:=IF([.$T$2]="psiSkill";  IF([.E135]=0;"";[.E135]); [.E135]) -> 52 | C135: of:=IF([.A135]=[.B135];"" ;[.B135]) ->  | D135: of:=IF([.G135];MIN(OFFSET(INDIRECT( ADDRESS(1;1; 1; ;[.$T$2])); (ROW() -26) * 2 ;0;2;1));"") -> 52 | E135: of:=IF([.G135];MAX(OFFSET(INDIRECT( ADDRESS(1;1; 1; ;[.$T$2])); (ROW() -26) * 2  ;0;2;1));"") -> 52 | F135: of:=IF([.G135];IF([.$T$2]="psiSkill";INDIRECT( ADDRESS((ROW()-25);1; 1; ;"ImprovedPsiSkill"));"");"") ->  | G135: of:=IF( INDIRECT( ADDRESS((ROW()-25)*2-1;1; 1;;"TU"))=0; FALSE();TRUE()) -> true | H135: of:=IF([.$G135];[.H$26];"") -> 50 | I135: of:=IF([.$G135];[.I$26];"") -> 80
A136: of:=IF([.$T$2]="psiSkill";  IF([.E136]=[.F136];[.B136];[.E136]-[.F136]); [.D136]) -> 50 | B136: of:=IF([.$T$2]="psiSkill";  IF([.E136]=0;"";[.E136]); [.E136]) -> 50 | C136: of:=IF([.A136]=[.B136];"" ;[.B136]) ->  | D136: of:=IF([.G136];MIN(OFFSET(INDIRECT( ADDRESS(1;1; 1; ;[.$T$2])); (ROW() -26) * 2 ;0;2;1));"") -> 50 | E136: of:=IF([.G136];MAX(OFFSET(INDIRECT( ADDRESS(1;1; 1; ;[.$T$2])); (ROW() -26) * 2  ;0;2;1));"") -> 50 | F136: of:=IF([.G136];IF([.$T$2]="psiSkill";INDIRECT( ADDRESS((ROW()-25);1; 1; ;"ImprovedPsiSkill"));"");"") ->  | G136: of:=IF( INDIRECT( ADDRESS((ROW()-25)*2-1;1; 1;;"TU"))=0; FALSE();TRUE()) -> true | H136: of:=IF([.$G136];[.H$26];"") -> 50 | I136: of:=IF([.$G136];[.I$26];"") -> 80
A137: of:=IF([.$T$2]="psiSkill";  IF([.E137]=[.F137];[.B137];[.E137]-[.F137]); [.D137]) -> 56 | B137: of:=IF([.$T$2]="psiSkill";  IF([.E137]=0;"";[.E137]); [.E137]) -> 56 | C137: of:=IF([.A137]=[.B137];"" ;[.B137]) ->  | D137: of:=IF([.G137];MIN(OFFSET(INDIRECT( ADDRESS(1;1; 1; ;[.$T$2])); (ROW() -26) * 2 ;0;2;1));"") -> 56 | E137: of:=IF([.G137];MAX(OFFSET(INDIRECT( ADDRESS(1;1; 1; ;[.$T$2])); (ROW() -26) * 2  ;0;2;1));"") -> 56 | F137: of:=IF([.G137];IF([.$T$2]="psiSkill";INDIRECT( ADDRESS((ROW()-25);1; 1; ;"ImprovedPsiSkill"));"");"") ->  | G137: of:=IF( INDIRECT( ADDRESS((ROW()-25)*2-1;1; 1;;"TU"))=0; FALSE();TRUE()) -> true | H137: of:=IF([.$G137];[.H$26];"") -> 50 | I137: of:=IF([.$G137];[.I$26];"") -> 80
A138: of:=IF([.$T$2]="psiSkill";  IF([.E138]=[.F138];[.B138];[.E138]-[.F138]); [.D138]) -> 60 | B138: of:=IF([.$T$2]="psiSkill";  IF([.E138]=0;"";[.E138]); [.E138]) -> 60 | C138: of:=IF([.A138]=[.B138];"" ;[.B138]) ->  | D138: of:=IF([.G138];MIN(OFFSET(INDIRECT( ADDRESS(1;1; 1; ;[.$T$2])); (ROW() -26) * 2 ;0;2;1));"") -> 60 | E138: of:=IF([.G138];MAX(OFFSET(INDIRECT( ADDRESS(1;1; 1; ;[.$T$2])); (ROW() -26) * 2  ;0;2;1));"") -> 60 | F138: of:=IF([.G138];IF([.$T$2]="psiSkill";INDIRECT( ADDRESS((ROW()-25);1; 1; ;"ImprovedPsiSkill"));"");"") ->  | G138: of:=IF( INDIRECT( ADDRESS((ROW()-25)*2-1;1; 1;;"TU"))=0; FALSE();TRUE()) -> true | H138: of:=IF([.$G138];[.H$26];"") -> 50 | I138: of:=IF([.$G138];[.I$26];"") -> 80
A139: of:=IF([.$T$2]="psiSkill";  IF([.E139]=[.F139];[.B139];[.E139]-[.F139]); [.D139]) -> 52 | B139: of:=IF([.$T$2]="psiSkill";  IF([.E139]=0;"";[.E139]); [.E139]) -> 52 | C139: of:=IF([.A139]=[.B139];"" ;[.B139]) ->  | D139: of:=IF([.G139];MIN(OFFSET(INDIRECT( ADDRESS(1;1; 1; ;[.$T$2])); (ROW() -26) * 2 ;0;2;1));"") -> 52 | E139: of:=IF([.G139];MAX(OFFSET(INDIRECT( ADDRESS(1;1; 1; ;[.$T$2])); (ROW() -26) * 2  ;0;2;1));"") -> 52 | F139: of:=IF([.G139];IF([.$T$2]="psiSkill";INDIRECT( ADDRESS((ROW()-25);1; 1; ;"ImprovedPsiSkill"));"");"") ->  | G139: of:=IF( INDIRECT( ADDRESS((ROW()-25)*2-1;1; 1;;"TU"))=0; FALSE();TRUE()) -> true | H139: of:=IF([.$G139];[.H$26];"") -> 50 | I139: of:=IF([.$G139];[.I$26];"") -> 80
A140: of:=IF([.$T$2]="psiSkill";  IF([.E140]=[.F140];[.B140];[.E140]-[.F140]); [.D140]) -> 52 | B140: of:=IF([.$T$2]="psiSkill";  IF([.E140]=0;"";[.E140]); [.E140]) -> 52 | C140: of:=IF([.A140]=[.B140];"" ;[.B140]) ->  | D140: of:=IF([.G140];MIN(OFFSET(INDIRECT( ADDRESS(1;1; 1; ;[.$T$2])); (ROW() -26) * 2 ;0;2;1));"") -> 52 | E140: of:=IF([.G140];MAX(OFFSET(INDIRECT( ADDRESS(1;1; 1; ;[.$T$2])); (ROW() -26) * 2  ;0;2;1));"") -> 52 | F140: of:=IF([.G140];IF([.$T$2]="psiSkill";INDIRECT( ADDRESS((ROW()-25);1; 1; ;"ImprovedPsiSkill"));"");"") ->  | G140: of:=IF( INDIRECT( ADDRESS((ROW()-25)*2-1;1; 1;;"TU"))=0; FALSE();TRUE()) -> true | H140: of:=IF([.$G140];[.H$26];"") -> 50 | I140: of:=IF([.$G140];[.I$26];"") -> 80
A141: of:=IF([.$T$2]="psiSkill";  IF([.E141]=[.F141];[.B141];[.E141]-[.F141]); [.D141]) -> 53 | B141: of:=IF([.$T$2]="psiSkill";  IF([.E141]=0;"";[.E141]); [.E141]) -> 53 | C141: of:=IF([.A141]=[.B141];"" ;[.B141]) ->  | D141: of:=IF([.G141];MIN(OFFSET(INDIRECT( ADDRESS(1;1; 1; ;[.$T$2])); (ROW() -26) * 2 ;0;2;1));"") -> 53 | E141: of:=IF([.G141];MAX(OFFSET(INDIRECT( ADDRESS(1;1; 1; ;[.$T$2])); (ROW() -26) * 2  ;0;2;1));"") -> 53 | F141: of:=IF([.G141];IF([.$T$2]="psiSkill";INDIRECT( ADDRESS((ROW()-25);1; 1; ;"ImprovedPsiSkill"));"");"") ->  | G141: of:=IF( INDIRECT( ADDRESS((ROW()-25)*2-1;1; 1;;"TU"))=0; FALSE();TRUE()) -> true | H141: of:=IF([.$G141];[.H$26];"") -> 50 | I141: of:=IF([.$G141];[.I$26];"") -> 80
A142: of:=IF([.$T$2]="psiSkill";  IF([.E142]=[.F142];[.B142];[.E142]-[.F142]); [.D142]) -> 60 | B142: of:=IF([.$T$2]="psiSkill";  IF([.E142]=0;"";[.E142]); [.E142]) -> 62 | C142: of:=IF([.A142]=[.B142];"" ;[.B142]) -> 62 | D142: of:=IF([.G142];MIN(OFFSET(INDIRECT( ADDRESS(1;1; 1; ;[.$T$2])); (ROW() -26) * 2 ;0;2;1));"") -> 60 | E142: of:=IF([.G142];MAX(OFFSET(INDIRECT( ADDRESS(1;1; 1; ;[.$T$2])); (ROW() -26) * 2  ;0;2;1));"") -> 62 | F142: of:=IF([.G142];IF([.$T$2]="psiSkill";INDIRECT( ADDRESS((ROW()-25);1; 1; ;"ImprovedPsiSkill"));"");"") ->  | G142: of:=IF( INDIRECT( ADDRESS((ROW()-25)*2-1;1; 1;;"TU"))=0; FALSE();TRUE()) -> true | H142: of:=IF([.$G142];[.H$26];"") -> 50 | I142: of:=IF([.$G142];[.I$26];"") -> 80
A143: of:=IF([.$T$2]="psiSkill";  IF([.E143]=[.F143];[.B143];[.E143]-[.F143]); [.D143]) -> 53 | B143: of:=IF([.$T$2]="psiSkill";  IF([.E143]=0;"";[.E143]); [.E143]) -> 70 | C143: of:=IF([.A143]=[.B143];"" ;[.B143]) -> 70 | D143: of:=IF([.G143];MIN(OFFSET(INDIRECT( ADDRESS(1;1; 1; ;[.$T$2])); (ROW() -26) * 2 ;0;2;1));"") -> 53 | E143: of:=IF([.G143];MAX(OFFSET(INDIRECT( ADDRESS(1;1; 1; ;[.$T$2])); (ROW() -26) * 2  ;0;2;1));"") -> 70 | F143: of:=IF([.G143];IF([.$T$2]="psiSkill";INDIRECT( ADDRESS((ROW()-25);1; 1; ;"ImprovedPsiSkill"));"");"") ->  | G143: of:=IF( INDIRECT( ADDRESS((ROW()-25)*2-1;1; 1;;"TU"))=0; FALSE();TRUE()) -> true | H143: of:=IF([.$G143];[.H$26];"") -> 50 | I143: of:=IF([.$G143];[.I$26];"") -> 80
A144: of:=IF([.$T$2]="psiSkill";  IF([.E144]=[.F144];[.B144];[.E144]-[.F144]); [.D144]) -> 57 | B144: of:=IF([.$T$2]="psiSkill";  IF([.E144]=0;"";[.E144]); [.E144]) -> 58 | C144: of:=IF([.A144]=[.B144];"" ;[.B144]) -> 58 | D144: of:=IF([.G144];MIN(OFFSET(INDIRECT( ADDRESS(1;1; 1; ;[.$T$2])); (ROW() -26) * 2 ;0;2;1));"") -> 57 | E144: of:=IF([.G144];MAX(OFFSET(INDIRECT( ADDRESS(1;1; 1; ;[.$T$2])); (ROW() -26) * 2  ;0;2;1));"") -> 58 | F144: of:=IF([.G144];IF([.$T$2]="psiSkill";INDIRECT( ADDRESS((ROW()-25);1; 1; ;"ImprovedPsiSkill"));"");"") ->  | G144: of:=IF( INDIRECT( ADDRESS((ROW()-25)*2-1;1; 1;;"TU"))=0; FALSE();TRUE()) -> true | H144: of:=IF([.$G144];[.H$26];"") -> 50 | I144: of:=IF([.$G144];[.I$26];"") -> 80
A145: of:=IF([.$T$2]="psiSkill";  IF([.E145]=[.F145];[.B145];[.E145]-[.F145]); [.D145]) -> 52 | B145: of:=IF([.$T$2]="psiSkill";  IF([.E145]=0;"";[.E145]); [.E145]) -> 52 | C145: of:=IF([.A145]=[.B145];"" ;[.B145]) ->  | D145: of:=IF([.G145];MIN(OFFSET(INDIRECT( ADDRESS(1;1; 1; ;[.$T$2])); (ROW() -26) * 2 ;0;2;1));"") -> 52 | E145: of:=IF([.G145];MAX(OFFSET(INDIRECT( ADDRESS(1;1; 1; ;[.$T$2])); (ROW() -26) * 2  ;0;2;1));"") -> 52 | F145: of:=IF([.G145];IF([.$T$2]="psiSkill";INDIRECT( ADDRESS((ROW()-25);1; 1; ;"ImprovedPsiSkill"));"");"") ->  | G145: of:=IF( INDIRECT( ADDRESS((ROW()-25)*2-1;1; 1;;"TU"))=0; FALSE();TRUE()) -> true | H145: of:=IF([.$G145];[.H$26];"") -> 50 | I145: of:=IF([.$G145];[.I$26];"") -> 80
A146: of:=IF([.$T$2]="psiSkill";  IF([.E146]=[.F146];[.B146];[.E146]-[.F146]); [.D146]) -> 58 | B146: of:=IF([.$T$2]="psiSkill";  IF([.E146]=0;"";[.E146]); [.E146]) -> 58 | C146: of:=IF([.A146]=[.B146];"" ;[.B146]) ->  | D146: of:=IF([.G146];MIN(OFFSET(INDIRECT( ADDRESS(1;1; 1; ;[.$T$2])); (ROW() -26) * 2 ;0;2;1));"") -> 58 | E146: of:=IF([.G146];MAX(OFFSET(INDIRECT( ADDRESS(1;1; 1; ;[.$T$2])); (ROW() -26) * 2  ;0;2;1));"") -> 58 | F146: of:=IF([.G146];IF([.$T$2]="psiSkill";INDIRECT( ADDRESS((ROW()-25);1; 1; ;"ImprovedPsiSkill"));"");"") ->  | G146: of:=IF( INDIRECT( ADDRESS((ROW()-25)*2-1;1; 1;;"TU"))=0; FALSE();TRUE()) -> true | H146: of:=IF([.$G146];[.H$26];"") -> 50 | I146: of:=IF([.$G146];[.I$26];"") -> 80
A147: of:=IF([.$T$2]="psiSkill";  IF([.E147]=[.F147];[.B147];[.E147]-[.F147]); [.D147]) -> 59 | B147: of:=IF([.$T$2]="psiSkill";  IF([.E147]=0;"";[.E147]); [.E147]) -> 59 | C147: of:=IF([.A147]=[.B147];"" ;[.B147]) ->  | D147: of:=IF([.G147];MIN(OFFSET(INDIRECT( ADDRESS(1;1; 1; ;[.$T$2])); (ROW() -26) * 2 ;0;2;1));"") -> 59 | E147: of:=IF([.G147];MAX(OFFSET(INDIRECT( ADDRESS(1;1; 1; ;[.$T$2])); (ROW() -26) * 2  ;0;2;1));"") -> 59 | F147: of:=IF([.G147];IF([.$T$2]="psiSkill";INDIRECT( ADDRESS((ROW()-25);1; 1; ;"ImprovedPsiSkill"));"");"") ->  | G147: of:=IF( INDIRECT( ADDRESS((ROW()-25)*2-1;1; 1;;"TU"))=0; FALSE();TRUE()) -> true | H147: of:=IF([.$G147];[.H$26];"") -> 50 | I147: of:=IF([.$G147];[.I$26];"") -> 80
A148: of:=IF([.$T$2]="psiSkill";  IF([.E148]=[.F148];[.B148];[.E148]-[.F148]); [.D148]) -> 52 | B148: of:=IF([.$T$2]="psiSkill";  IF([.E148]=0;"";[.E148]); [.E148]) -> 54 | C148: of:=IF([.A148]=[.B148];"" ;[.B148]) -> 54 | D148: of:=IF([.G148];MIN(OFFSET(INDIRECT( ADDRESS(1;1; 1; ;[.$T$2])); (ROW() -26) * 2 ;0;2;1));"") -> 52 | E148: of:=IF([.G148];MAX(OFFSET(INDIRECT( ADDRESS(1;1; 1; ;[.$T$2])); (ROW() -26) * 2  ;0;2;1));"") -> 54 | F148: of:=IF([.G148];IF([.$T$2]="psiSkill";INDIRECT( ADDRESS((ROW()-25);1; 1; ;"ImprovedPsiSkill"));"");"") ->  | G148: of:=IF( INDIRECT( ADDRESS((ROW()-25)*2-1;1; 1;;"TU"))=0; FALSE();TRUE()) -> true | H148: of:=IF([.$G148];[.H$26];"") -> 50 | I148: of:=IF([.$G148];[.I$26];"") -> 80
A149: of:=IF([.$T$2]="psiSkill";  IF([.E149]=[.F149];[.B149];[.E149]-[.F149]); [.D149]) -> 59 | B149: of:=IF([.$T$2]="psiSkill";  IF([.E149]=0;"";[.E149]); [.E149]) -> 59 | C149: of:=IF([.A149]=[.B149];"" ;[.B149]) ->  | D149: of:=IF([.G149];MIN(OFFSET(INDIRECT( ADDRESS(1;1; 1; ;[.$T$2])); (ROW() -26) * 2 ;0;2;1));"") -> 59 | E149: of:=IF([.G149];MAX(OFFSET(INDIRECT( ADDRESS(1;1; 1; ;[.$T$2])); (ROW() -26) * 2  ;0;2;1));"") -> 59 | F149: of:=IF([.G149];IF([.$T$2]="psiSkill";INDIRECT( ADDRESS((ROW()-25);1; 1; ;"ImprovedPsiSkill"));"");"") ->  | G149: of:=IF( INDIRECT( ADDRESS((ROW()-25)*2-1;1; 1;;"TU"))=0; FALSE();TRUE()) -> true | H149: of:=IF([.$G149];[.H$26];"") -> 50 | I149: of:=IF([.$G149];[.I$26];"") -> 80
A150: of:=IF([.$T$2]="psiSkill";  IF([.E150]=[.F150];[.B150];[.E150]-[.F150]); [.D150]) -> 58 | B150: of:=IF([.$T$2]="psiSkill";  IF([.E150]=0;"";[.E150]); [.E150]) -> 62 | C150: of:=IF([.A150]=[.B150];"" ;[.B150]) -> 62 | D150: of:=IF([.G150];MIN(OFFSET(INDIRECT( ADDRESS(1;1; 1; ;[.$T$2])); (ROW() -26) * 2 ;0;2;1));"") -> 58 | E150: of:=IF([.G150];MAX(OFFSET(INDIRECT( ADDRESS(1;1; 1; ;[.$T$2])); (ROW() -26) * 2  ;0;2;1));"") -> 62 | F150: of:=IF([.G150];IF([.$T$2]="psiSkill";INDIRECT( ADDRESS((ROW()-25);1; 1; ;"ImprovedPsiSkill"));"");"") ->  | G150: of:=IF( INDIRECT( ADDRESS((ROW()-25)*2-1;1; 1;;"TU"))=0; FALSE();TRUE()) -> true | H150: of:=IF([.$G150];[.H$26];"") -> 50 | I150: of:=IF([.$G150];[.I$26];"") -> 80
A151: of:=IF([.$T$2]="psiSkill";  IF([.E151]=[.F151];[.B151];[.E151]-[.F151]); [.D151]) -> 59 | B151: of:=IF([.$T$2]="psiSkill";  IF([.E151]=0;"";[.E151]); [.E151]) -> 63 | C151: of:=IF([.A151]=[.B151];"" ;[.B151]) -> 63 | D151: of:=IF([.G151];MIN(OFFSET(INDIRECT( ADDRESS(1;1; 1; ;[.$T$2])); (ROW() -26) * 2 ;0;2;1));"") -> 59 | E151: of:=IF([.G151];MAX(OFFSET(INDIRECT( ADDRESS(1;1; 1; ;[.$T$2])); (ROW() -26) * 2  ;0;2;1));"") -> 63 | F151: of:=IF([.G151];IF([.$T$2]="psiSkill";INDIRECT( ADDRESS((ROW()-25);1; 1; ;"ImprovedPsiSkill"));"");"") ->  | G151: of:=IF( INDIRECT( ADDRESS((ROW()-25)*2-1;1; 1;;"TU"))=0; FALSE();TRUE()) -> true | H151: of:=IF([.$G151];[.H$26];"") -> 50 | I151: of:=IF([.$G151];[.I$26];"") -> 80
A152: of:=IF([.$T$2]="psiSkill";  IF([.E152]=[.F152];[.B152];[.E152]-[.F152]); [.D152]) -> 56 | B152: of:=IF([.$T$2]="psiSkill";  IF([.E152]=0;"";[.E152]); [.E152]) -> 58 | C152: of:=IF([.A152]=[.B152];"" ;[.B152]) -> 58 | D152: of:=IF([.G152];MIN(OFFSET(INDIRECT( ADDRESS(1;1; 1; ;[.$T$2])); (ROW() -26) * 2 ;0;2;1));"") -> 56 | E152: of:=IF([.G152];MAX(OFFSET(INDIRECT( ADDRESS(1;1; 1; ;[.$T$2])); (ROW() -26) * 2  ;0;2;1));"") -> 58 | F152: of:=IF([.G152];IF([.$T$2]="psiSkill";INDIRECT( ADDRESS((ROW()-25);1; 1; ;"ImprovedPsiSkill"));"");"") ->  | G152: of:=IF( INDIRECT( ADDRESS((ROW()-25)*2-1;1; 1;;"TU"))=0; FALSE();TRUE()) -> true | H152: of:=IF([.$G152];[.H$26];"") -> 50 | I152: of:=IF([.$G152];[.I$26];"") -> 80
A153: of:=IF([.$T$2]="psiSkill";  IF([.E153]=[.F153];[.B153];[.E153]-[.F153]); [.D153]) -> 52 | B153: of:=IF([.$T$2]="psiSkill";  IF([.E153]=0;"";[.E153]); [.E153]) -> 52 | C153: of:=IF([.A153]=[.B153];"" ;[.B153]) ->  | D153: of:=IF([.G153];MIN(OFFSET(INDIRECT( ADDRESS(1;1; 1; ;[.$T$2])); (ROW() -26) * 2 ;0;2;1));"") -> 52 | E153: of:=IF([.G153];MAX(OFFSET(INDIRECT( ADDRESS(1;1; 1; ;[.$T$2])); (ROW() -26) * 2  ;0;2;1));"") -> 52 | F153: of:=IF([.G153];IF([.$T$2]="psiSkill";INDIRECT( ADDRESS((ROW()-25);1; 1; ;"ImprovedPsiSkill"));"");"") ->  | G153: of:=IF( INDIRECT( ADDRESS((ROW()-25)*2-1;1; 1;;"TU"))=0; FALSE();TRUE()) -> true | H153: of:=IF([.$G153];[.H$26];"") -> 50 | I153: of:=IF([.$G153];[.I$26];"") -> 80
A154: of:=IF([.$T$2]="psiSkill";  IF([.E154]=[.F154];[.B154];[.E154]-[.F154]); [.D154]) -> 55 | B154: of:=IF([.$T$2]="psiSkill";  IF([.E154]=0;"";[.E154]); [.E154]) -> 55 | C154: of:=IF([.A154]=[.B154];"" ;[.B154]) ->  | D154: of:=IF([.G154];MIN(OFFSET(INDIRECT( ADDRESS(1;1; 1; ;[.$T$2])); (ROW() -26) * 2 ;0;2;1));"") -> 55 | E154: of:=IF([.G154];MAX(OFFSET(INDIRECT( ADDRESS(1;1; 1; ;[.$T$2])); (ROW() -26) * 2  ;0;2;1));"") -> 55 | F154: of:=IF([.G154];IF([.$T$2]="psiSkill";INDIRECT( ADDRESS((ROW()-25);1; 1; ;"ImprovedPsiSkill"));"");"") ->  | G154: of:=IF( INDIRECT( ADDRESS((ROW()-25)*2-1;1; 1;;"TU"))=0; FALSE();TRUE()) -> true | H154: of:=IF([.$G154];[.H$26];"") -> 50 | I154: of:=IF([.$G154];[.I$26];"") -> 80
A155: of:=IF([.$T$2]="psiSkill";  IF([.E155]=[.F155];[.B155];[.E155]-[.F155]); [.D155]) -> 55 | B155: of:=IF([.$T$2]="psiSkill";  IF([.E155]=0;"";[.E155]); [.E155]) -> 55 | C155: of:=IF([.A155]=[.B155];"" ;[.B155]) ->  | D155: of:=IF([.G155];MIN(OFFSET(INDIRECT( ADDRESS(1;1; 1; ;[.$T$2])); (ROW() -26) * 2 ;0;2;1));"") -> 55 | E155: of:=IF([.G155];MAX(OFFSET(INDIRECT( ADDRESS(1;1; 1; ;[.$T$2])); (ROW() -26) * 2  ;0;2;1));"") -> 55 | F155: of:=IF([.G155];IF([.$T$2]="psiSkill";INDIRECT( ADDRESS((ROW()-25);1; 1; ;"ImprovedPsiSkill"));"");"") ->  | G155: of:=IF( INDIRECT( ADDRESS((ROW()-25)*2-1;1; 1;;"TU"))=0; FALSE();TRUE()) -> true | H155: of:=IF([.$G155];[.H$26];"") -> 50 | I155: of:=IF([.$G155];[.I$26];"") -> 80
A156: of:=IF([.$T$2]="psiSkill";  IF([.E156]=[.F156];[.B156];[.E156]-[.F156]); [.D156]) -> 51 | B156: of:=IF([.$T$2]="psiSkill";  IF([.E156]=0;"";[.E156]); [.E156]) -> 51 | C156: of:=IF([.A156]=[.B156];"" ;[.B156]) ->  | D156: of:=IF([.G156];MIN(OFFSET(INDIRECT( ADDRESS(1;1; 1; ;[.$T$2])); (ROW() -26) * 2 ;0;2;1));"") -> 51 | E156: of:=IF([.G156];MAX(OFFSET(INDIRECT( ADDRESS(1;1; 1; ;[.$T$2])); (ROW() -26) * 2  ;0;2;1));"") -> 51 | F156: of:=IF([.G156];IF([.$T$2]="psiSkill";INDIRECT( ADDRESS((ROW()-25);1; 1; ;"ImprovedPsiSkill"));"");"") ->  | G156: of:=IF( INDIRECT( ADDRESS((ROW()-25)*2-1;1; 1;;"TU"))=0; FALSE();TRUE()) -> true | H156: of:=IF([.$G156];[.H$26];"") -> 50 | I156: of:=IF([.$G156];[.I$26];"") -> 80
A157: of:=IF([.$T$2]="psiSkill";  IF([.E157]=[.F157];[.B157];[.E157]-[.F157]); [.D157]) -> 57 | B157: of:=IF([.$T$2]="psiSkill";  IF([.E157]=0;"";[.E157]); [.E157]) -> 59 | C157: of:=IF([.A157]=[.B157];"" ;[.B157]) -> 59 | D157: of:=IF([.G157];MIN(OFFSET(INDIRECT( ADDRESS(1;1; 1; ;[.$T$2])); (ROW() -26) * 2 ;0;2;1));"") -> 57 | E157: of:=IF([.G157];MAX(OFFSET(INDIRECT( ADDRESS(1;1; 1; ;[.$T$2])); (ROW() -26) * 2  ;0;2;1));"") -> 59 | F157: of:=IF([.G157];IF([.$T$2]="psiSkill";INDIRECT( ADDRESS((ROW()-25);1; 1; ;"ImprovedPsiSkill"));"");"") ->  | G157: of:=IF( INDIRECT( ADDRESS((ROW()-25)*2-1;1; 1;;"TU"))=0; FALSE();TRUE()) -> true | H157: of:=IF([.$G157];[.H$26];"") -> 50 | I157: of:=IF([.$G157];[.I$26];"") -> 80
A158: of:=IF([.$T$2]="psiSkill";  IF([.E158]=[.F158];[.B158];[.E158]-[.F158]); [.D158]) -> 55 | B158: of:=IF([.$T$2]="psiSkill";  IF([.E158]=0;"";[.E158]); [.E158]) -> 55 | C158: of:=IF([.A158]=[.B158];"" ;[.B158]) ->  | D158: of:=IF([.G158];MIN(OFFSET(INDIRECT( ADDRESS(1;1; 1; ;[.$T$2])); (ROW() -26) * 2 ;0;2;1));"") -> 55 | E158: of:=IF([.G158];MAX(OFFSET(INDIRECT( ADDRESS(1;1; 1; ;[.$T$2])); (ROW() -26) * 2  ;0;2;1));"") -> 55 | F158: of:=IF([.G158];IF([.$T$2]="psiSkill";INDIRECT( ADDRESS((ROW()-25);1; 1; ;"ImprovedPsiSkill"));"");"") ->  | G158: of:=IF( INDIRECT( ADDRESS((ROW()-25)*2-1;1; 1;;"TU"))=0; FALSE();TRUE()) -> true | H158: of:=IF([.$G158];[.H$26];"") -> 50 | I158: of:=IF([.$G158];[.I$26];"") -> 80
A159: of:=IF([.$T$2]="psiSkill";  IF([.E159]=[.F159];[.B159];[.E159]-[.F159]); [.D159]) ->  | B159: of:=IF([.$T$2]="psiSkill";  IF([.E159]=0;"";[.E159]); [.E159]) ->  | C159: of:=IF([.A159]=[.B159];"" ;[.B159]) ->  | D159: of:=IF([.G159];MIN(OFFSET(INDIRECT( ADDRESS(1;1; 1; ;[.$T$2])); (ROW() -26) * 2 ;0;2;1));"") ->  | E159: of:=IF([.G159];MAX(OFFSET(INDIRECT( ADDRESS(1;1; 1; ;[.$T$2])); (ROW() -26) * 2  ;0;2;1));"") ->  | F159: of:=IF([.G159];IF([.$T$2]="psiSkill";INDIRECT( ADDRESS((ROW()-25);1; 1; ;"ImprovedPsiSkill"));"");"") ->  | G159: of:=IF( INDIRECT( ADDRESS((ROW()-25)*2-1;1; 1;;"TU"))=0; FALSE();TRUE()) -> false | H159: of:=IF([.$G159];[.H$26];"") ->  | I159: of:=IF([.$G159];[.I$26];"") -> 
A160: of:=IF([.$T$2]="psiSkill";  IF([.E160]=[.F160];[.B160];[.E160]-[.F160]); [.D160]) ->  | B160: of:=IF([.$T$2]="psiSkill";  IF([.E160]=0;"";[.E160]); [.E160]) ->  | C160: of:=IF([.A160]=[.B160];"" ;[.B160]) ->  | D160: of:=IF([.G160];MIN(OFFSET(INDIRECT( ADDRESS(1;1; 1; ;[.$T$2])); (ROW() -26) * 2 ;0;2;1));"") ->  | E160: of:=IF([.G160];MAX(OFFSET(INDIRECT( ADDRESS(1;1; 1; ;[.$T$2])); (ROW() -26) * 2  ;0;2;1));"") ->  | F160: of:=IF([.G160];IF([.$T$2]="psiSkill";INDIRECT( ADDRESS((ROW()-25);1; 1; ;"ImprovedPsiSkill"));"");"") ->  | G160: of:=IF( INDIRECT( ADDRESS((ROW()-25)*2-1;1; 1;;"TU"))=0; FALSE();TRUE()) -> false | H160: of:=IF([.$G160];[.H$26];"") ->  | I160: of:=IF([.$G160];[.I$26];"") -> 
A161: of:=IF([.$T$2]="psiSkill";  IF([.E161]=[.F161];[.B161];[.E161]-[.F161]); [.D161]) ->  | B161: of:=IF([.$T$2]="psiSkill";  IF([.E161]=0;"";[.E161]); [.E161]) ->  | C161: of:=IF([.A161]=[.B161];"" ;[.B161]) ->  | D161: of:=IF([.G161];MIN(OFFSET(INDIRECT( ADDRESS(1;1; 1; ;[.$T$2])); (ROW() -26) * 2 ;0;2;1));"") ->  | E161: of:=IF([.G161];MAX(OFFSET(INDIRECT( ADDRESS(1;1; 1; ;[.$T$2])); (ROW() -26) * 2  ;0;2;1));"") ->  | F161: of:=IF([.G161];IF([.$T$2]="psiSkill";INDIRECT( ADDRESS((ROW()-25);1; 1; ;"ImprovedPsiSkill"));"");"") ->  | G161: of:=IF( INDIRECT( ADDRESS((ROW()-25)*2-1;1; 1;;"TU"))=0; FALSE();TRUE()) -> false | H161: of:=IF([.$G161];[.H$26];"") ->  | I161: of:=IF([.$G161];[.I$26];"") -> 
A162: of:=IF([.$T$2]="psiSkill";  IF([.E162]=[.F162];[.B162];[.E162]-[.F162]); [.D162]) ->  | B162: of:=IF([.$T$2]="psiSkill";  IF([.E162]=0;"";[.E162]); [.E162]) ->  | C162: of:=IF([.A162]=[.B162];"" ;[.B162]) ->  | D162: of:=IF([.G162];MIN(OFFSET(INDIRECT( ADDRESS(1;1; 1; ;[.$T$2])); (ROW() -26) * 2 ;0;2;1));"") ->  | E162: of:=IF([.G162];MAX(OFFSET(INDIRECT( ADDRESS(1;1; 1; ;[.$T$2])); (ROW() -26) * 2  ;0;2;1));"") ->  | F162: of:=IF([.G162];IF([.$T$2]="psiSkill";INDIRECT( ADDRESS((ROW()-25);1; 1; ;"ImprovedPsiSkill"));"");"") ->  | G162: of:=IF( INDIRECT( ADDRESS((ROW()-25)*2-1;1; 1;;"TU"))=0; FALSE();TRUE()) -> false | H162: of:=IF([.$G162];[.H$26];"") ->  | I162: of:=IF([.$G162];[.I$26];"") -> 
A163: of:=IF([.$T$2]="psiSkill";  IF([.E163]=[.F163];[.B163];[.E163]-[.F163]); [.D163]) ->  | B163: of:=IF([.$T$2]="psiSkill";  IF([.E163]=0;"";[.E163]); [.E163]) ->  | C163: of:=IF([.A163]=[.B163];"" ;[.B163]) ->  | D163: of:=IF([.G163];MIN(OFFSET(INDIRECT( ADDRESS(1;1; 1; ;[.$T$2])); (ROW() -26) * 2 ;0;2;1));"") ->  | E163: of:=IF([.G163];MAX(OFFSET(INDIRECT( ADDRESS(1;1; 1; ;[.$T$2])); (ROW() -26) * 2  ;0;2;1));"") ->  | F163: of:=IF([.G163];IF([.$T$2]="psiSkill";INDIRECT( ADDRESS((ROW()-25);1; 1; ;"ImprovedPsiSkill"));"");"") ->  | G163: of:=IF( INDIRECT( ADDRESS((ROW()-25)*2-1;1; 1;;"TU"))=0; FALSE();TRUE()) -> false | H163: of:=IF([.$G163];[.H$26];"") ->  | I163: of:=IF([.$G163];[.I$26];"") -> 
A164: of:=IF([.$T$2]="psiSkill";  IF([.E164]=[.F164];[.B164];[.E164]-[.F164]); [.D164]) ->  | B164: of:=IF([.$T$2]="psiSkill";  IF([.E164]=0;"";[.E164]); [.E164]) ->  | C164: of:=IF([.A164]=[.B164];"" ;[.B164]) ->  | D164: of:=IF([.G164];MIN(OFFSET(INDIRECT( ADDRESS(1;1; 1; ;[.$T$2])); (ROW() -26) * 2 ;0;2;1));"") ->  | E164: of:=IF([.G164];MAX(OFFSET(INDIRECT( ADDRESS(1;1; 1; ;[.$T$2])); (ROW() -26) * 2  ;0;2;1));"") ->  | F164: of:=IF([.G164];IF([.$T$2]="psiSkill";INDIRECT( ADDRESS((ROW()-25);1; 1; ;"ImprovedPsiSkill"));"");"") ->  | G164: of:=IF( INDIRECT( ADDRESS((ROW()-25)*2-1;1; 1;;"TU"))=0; FALSE();TRUE()) -> false | H164: of:=IF([.$G164];[.H$26];"") ->  | I164: of:=IF([.$G164];[.I$26];"") -> 
A165: of:=IF([.$T$2]="psiSkill";  IF([.E165]=[.F165];[.B165];[.E165]-[.F165]); [.D165]) ->  | B165: of:=IF([.$T$2]="psiSkill";  IF([.E165]=0;"";[.E165]); [.E165]) ->  | C165: of:=IF([.A165]=[.B165];"" ;[.B165]) ->  | D165: of:=IF([.G165];MIN(OFFSET(INDIRECT( ADDRESS(1;1; 1; ;[.$T$2])); (ROW() -26) * 2 ;0;2;1));"") ->  | E165: of:=IF([.G165];MAX(OFFSET(INDIRECT( ADDRESS(1;1; 1; ;[.$T$2])); (ROW() -26) * 2  ;0;2;1));"") ->  | F165: of:=IF([.G165];IF([.$T$2]="psiSkill";INDIRECT( ADDRESS((ROW()-25);1; 1; ;"ImprovedPsiSkill"));"");"") ->  | G165: of:=IF( INDIRECT( ADDRESS((ROW()-25)*2-1;1; 1;;"TU"))=0; FALSE();TRUE()) -> false | H165: of:=IF([.$G165];[.H$26];"") ->  | I165: of:=IF([.$G165];[.I$26];"") -> 
A166: of:=IF([.$T$2]="psiSkill";  IF([.E166]=[.F166];[.B166];[.E166]-[.F166]); [.D166]) ->  | B166: of:=IF([.$T$2]="psiSkill";  IF([.E166]=0;"";[.E166]); [.E166]) ->  | C166: of:=IF([.A166]=[.B166];"" ;[.B166]) ->  | D166: of:=IF([.G166];MIN(OFFSET(INDIRECT( ADDRESS(1;1; 1; ;[.$T$2])); (ROW() -26) * 2 ;0;2;1));"") ->  | E166: of:=IF([.G166];MAX(OFFSET(INDIRECT( ADDRESS(1;1; 1; ;[.$T$2])); (ROW() -26) * 2  ;0;2;1));"") ->  | F166: of:=IF([.G166];IF([.$T$2]="psiSkill";INDIRECT( ADDRESS((ROW()-25);1; 1; ;"ImprovedPsiSkill"));"");"") ->  | G166: of:=IF( INDIRECT( ADDRESS((ROW()-25)*2-1;1; 1;;"TU"))=0; FALSE();TRUE()) -> false | H166: of:=IF([.$G166];[.H$26];"") ->  | I166: of:=IF([.$G166];[.I$26];"") -> 
A167: of:=IF([.$T$2]="psiSkill";  IF([.E167]=[.F167];[.B167];[.E167]-[.F167]); [.D167]) ->  | B167: of:=IF([.$T$2]="psiSkill";  IF([.E167]=0;"";[.E167]); [.E167]) ->  | C167: of:=IF([.A167]=[.B167];"" ;[.B167]) ->  | D167: of:=IF([.G167];MIN(OFFSET(INDIRECT( ADDRESS(1;1; 1; ;[.$T$2])); (ROW() -26) * 2 ;0;2;1));"") ->  | E167: of:=IF([.G167];MAX(OFFSET(INDIRECT( ADDRESS(1;1; 1; ;[.$T$2])); (ROW() -26) * 2  ;0;2;1));"") ->  | F167: of:=IF([.G167];IF([.$T$2]="psiSkill";INDIRECT( ADDRESS((ROW()-25);1; 1; ;"ImprovedPsiSkill"));"");"") ->  | G167: of:=IF( INDIRECT( ADDRESS((ROW()-25)*2-1;1; 1;;"TU"))=0; FALSE();TRUE()) -> false | H167: of:=IF([.$G167];[.H$26];"") ->  | I167: of:=IF([.$G167];[.I$26];"") -> 
A168: of:=IF([.$T$2]="psiSkill";  IF([.E168]=[.F168];[.B168];[.E168]-[.F168]); [.D168]) ->  | B168: of:=IF([.$T$2]="psiSkill";  IF([.E168]=0;"";[.E168]); [.E168]) ->  | C168: of:=IF([.A168]=[.B168];"" ;[.B168]) ->  | D168: of:=IF([.G168];MIN(OFFSET(INDIRECT( ADDRESS(1;1; 1; ;[.$T$2])); (ROW() -26) * 2 ;0;2;1));"") ->  | E168: of:=IF([.G168];MAX(OFFSET(INDIRECT( ADDRESS(1;1; 1; ;[.$T$2])); (ROW() -26) * 2  ;0;2;1));"") ->  | F168: of:=IF([.G168];IF([.$T$2]="psiSkill";INDIRECT( ADDRESS((ROW()-25);1; 1; ;"ImprovedPsiSkill"));"");"") ->  | G168: of:=IF( INDIRECT( ADDRESS((ROW()-25)*2-1;1; 1;;"TU"))=0; FALSE();TRUE()) -> false | H168: of:=IF([.$G168];[.H$26];"") ->  | I168: of:=IF([.$G168];[.I$26];"") -> 
A169: of:=IF([.$T$2]="psiSkill";  IF([.E169]=[.F169];[.B169];[.E169]-[.F169]); [.D169]) ->  | B169: of:=IF([.$T$2]="psiSkill";  IF([.E169]=0;"";[.E169]); [.E169]) ->  | C169: of:=IF([.A169]=[.B169];"" ;[.B169]) ->  | D169: of:=IF([.G169];MIN(OFFSET(INDIRECT( ADDRESS(1;1; 1; ;[.$T$2])); (ROW() -26) * 2 ;0;2;1));"") ->  | E169: of:=IF([.G169];MAX(OFFSET(INDIRECT( ADDRESS(1;1; 1; ;[.$T$2])); (ROW() -26) * 2  ;0;2;1));"") ->  | F169: of:=IF([.G169];IF([.$T$2]="psiSkill";INDIRECT( ADDRESS((ROW()-25);1; 1; ;"ImprovedPsiSkill"));"");"") ->  | G169: of:=IF( INDIRECT( ADDRESS((ROW()-25)*2-1;1; 1;;"TU"))=0; FALSE();TRUE()) -> false | H169: of:=IF([.$G169];[.H$26];"") ->  | I169: of:=IF([.$G169];[.I$26];"") -> 
A170: of:=IF([.$T$2]="psiSkill";  IF([.E170]=[.F170];[.B170];[.E170]-[.F170]); [.D170]) ->  | B170: of:=IF([.$T$2]="psiSkill";  IF([.E170]=0;"";[.E170]); [.E170]) ->  | C170: of:=IF([.A170]=[.B170];"" ;[.B170]) ->  | D170: of:=IF([.G170];MIN(OFFSET(INDIRECT( ADDRESS(1;1; 1; ;[.$T$2])); (ROW() -26) * 2 ;0;2;1));"") ->  | E170: of:=IF([.G170];MAX(OFFSET(INDIRECT( ADDRESS(1;1; 1; ;[.$T$2])); (ROW() -26) * 2  ;0;2;1));"") ->  | F170: of:=IF([.G170];IF([.$T$2]="psiSkill";INDIRECT( ADDRESS((ROW()-25);1; 1; ;"ImprovedPsiSkill"));"");"") ->  | G170: of:=IF( INDIRECT( ADDRESS((ROW()-25)*2-1;1; 1;;"TU"))=0; FALSE();TRUE()) -> false | H170: of:=IF([.$G170];[.H$26];"") ->  | I170: of:=IF([.$G170];[.I$26];"") -> 
A171: of:=IF([.$T$2]="psiSkill";  IF([.E171]=[.F171];[.B171];[.E171]-[.F171]); [.D171]) ->  | B171: of:=IF([.$T$2]="psiSkill";  IF([.E171]=0;"";[.E171]); [.E171]) ->  | C171: of:=IF([.A171]=[.B171];"" ;[.B171]) ->  | D171: of:=IF([.G171];MIN(OFFSET(INDIRECT( ADDRESS(1;1; 1; ;[.$T$2])); (ROW() -26) * 2 ;0;2;1));"") ->  | E171: of:=IF([.G171];MAX(OFFSET(INDIRECT( ADDRESS(1;1; 1; ;[.$T$2])); (ROW() -26) * 2  ;0;2;1));"") ->  | F171: of:=IF([.G171];IF([.$T$2]="psiSkill";INDIRECT( ADDRESS((ROW()-25);1; 1; ;"ImprovedPsiSkill"));"");"") ->  | G171: of:=IF( INDIRECT( ADDRESS((ROW()-25)*2-1;1; 1;;"TU"))=0; FALSE();TRUE()) -> false | H171: of:=IF([.$G171];[.H$26];"") ->  | I171: of:=IF([.$G171];[.I$26];"") -> 
A172: of:=IF([.$T$2]="psiSkill";  IF([.E172]=[.F172];[.B172];[.E172]-[.F172]); [.D172]) ->  | B172: of:=IF([.$T$2]="psiSkill";  IF([.E172]=0;"";[.E172]); [.E172]) ->  | C172: of:=IF([.A172]=[.B172];"" ;[.B172]) ->  | D172: of:=IF([.G172];MIN(OFFSET(INDIRECT( ADDRESS(1;1; 1; ;[.$T$2])); (ROW() -26) * 2 ;0;2;1));"") ->  | E172: of:=IF([.G172];MAX(OFFSET(INDIRECT( ADDRESS(1;1; 1; ;[.$T$2])); (ROW() -26) * 2  ;0;2;1));"") ->  | F172: of:=IF([.G172];IF([.$T$2]="psiSkill";INDIRECT( ADDRESS((ROW()-25);1; 1; ;"ImprovedPsiSkill"));"");"") ->  | G172: of:=IF( INDIRECT( ADDRESS((ROW()-25)*2-1;1; 1;;"TU"))=0; FALSE();TRUE()) -> false | H172: of:=IF([.$G172];[.H$26];"") ->  | I172: of:=IF([.$G172];[.I$26];"") -> 
A173: of:=IF([.$T$2]="psiSkill";  IF([.E173]=[.F173];[.B173];[.E173]-[.F173]); [.D173]) ->  | B173: of:=IF([.$T$2]="psiSkill";  IF([.E173]=0;"";[.E173]); [.E173]) ->  | C173: of:=IF([.A173]=[.B173];"" ;[.B173]) ->  | D173: of:=IF([.G173];MIN(OFFSET(INDIRECT( ADDRESS(1;1; 1; ;[.$T$2])); (ROW() -26) * 2 ;0;2;1));"") ->  | E173: of:=IF([.G173];MAX(OFFSET(INDIRECT( ADDRESS(1;1; 1; ;[.$T$2])); (ROW() -26) * 2  ;0;2;1));"") ->  | F173: of:=IF([.G173];IF([.$T$2]="psiSkill";INDIRECT( ADDRESS((ROW()-25);1; 1; ;"ImprovedPsiSkill"));"");"") ->  | G173: of:=IF( INDIRECT( ADDRESS((ROW()-25)*2-1;1; 1;;"TU"))=0; FALSE();TRUE()) -> false | H173: of:=IF([.$G173];[.H$26];"") ->  | I173: of:=IF([.$G173];[.I$26];"") -> 
A174: of:=IF([.$T$2]="psiSkill";  IF([.E174]=[.F174];[.B174];[.E174]-[.F174]); [.D174]) ->  | B174: of:=IF([.$T$2]="psiSkill";  IF([.E174]=0;"";[.E174]); [.E174]) ->  | C174: of:=IF([.A174]=[.B174];"" ;[.B174]) ->  | D174: of:=IF([.G174];MIN(OFFSET(INDIRECT( ADDRESS(1;1; 1; ;[.$T$2])); (ROW() -26) * 2 ;0;2;1));"") ->  | E174: of:=IF([.G174];MAX(OFFSET(INDIRECT( ADDRESS(1;1; 1; ;[.$T$2])); (ROW() -26) * 2  ;0;2;1));"") ->  | F174: of:=IF([.G174];IF([.$T$2]="psiSkill";INDIRECT( ADDRESS((ROW()-25);1; 1; ;"ImprovedPsiSkill"));"");"") ->  | G174: of:=IF( INDIRECT( ADDRESS((ROW()-25)*2-1;1; 1;;"TU"))=0; FALSE();TRUE()) -> false | H174: of:=IF([.$G174];[.H$26];"") ->  | I174: of:=IF([.$G174];[.I$26];"") -> 
A175: of:=IF([.$T$2]="psiSkill";  IF([.E175]=[.F175];[.B175];[.E175]-[.F175]); [.D175]) ->  | B175: of:=IF([.$T$2]="psiSkill";  IF([.E175]=0;"";[.E175]); [.E175]) ->  | C175: of:=IF([.A175]=[.B175];"" ;[.B175]) ->  | D175: of:=IF([.G175];MIN(OFFSET(INDIRECT( ADDRESS(1;1; 1; ;[.$T$2])); (ROW() -26) * 2 ;0;2;1));"") ->  | E175: of:=IF([.G175];MAX(OFFSET(INDIRECT( ADDRESS(1;1; 1; ;[.$T$2])); (ROW() -26) * 2  ;0;2;1));"") ->  | F175: of:=IF([.G175];IF([.$T$2]="psiSkill";INDIRECT( ADDRESS((ROW()-25);1; 1; ;"ImprovedPsiSkill"));"");"") ->  | G175: of:=IF( INDIRECT( ADDRESS((ROW()-25)*2-1;1; 1;;"TU"))=0; FALSE();TRUE()) -> false | H175: of:=IF([.$G175];[.H$26];"") ->  | I175: of:=IF([.$G175];[.I$26];"") -> 
A176: of:=IF([.$T$2]="psiSkill";  IF([.E176]=[.F176];[.B176];[.E176]-[.F176]); [.D176]) ->  | B176: of:=IF([.$T$2]="psiSkill";  IF([.E176]=0;"";[.E176]); [.E176]) ->  | C176: of:=IF([.A176]=[.B176];"" ;[.B176]) ->  | D176: of:=IF([.G176];MIN(OFFSET(INDIRECT( ADDRESS(1;1; 1; ;[.$T$2])); (ROW() -26) * 2 ;0;2;1));"") ->  | E176: of:=IF([.G176];MAX(OFFSET(INDIRECT( ADDRESS(1;1; 1; ;[.$T$2])); (ROW() -26) * 2  ;0;2;1));"") ->  | F176: of:=IF([.G176];IF([.$T$2]="psiSkill";INDIRECT( ADDRESS((ROW()-25);1; 1; ;"ImprovedPsiSkill"));"");"") ->  | G176: of:=IF( INDIRECT( ADDRESS((ROW()-25)*2-1;1; 1;;"TU"))=0; FALSE();TRUE()) -> false | H176: of:=IF([.$G176];[.H$26];"") ->  | I176: of:=IF([.$G176];[.I$26];"") -> 
A177: of:=IF([.$T$2]="psiSkill";  IF([.E177]=[.F177];[.B177];[.E177]-[.F177]); [.D177]) ->  | B177: of:=IF([.$T$2]="psiSkill";  IF([.E177]=0;"";[.E177]); [.E177]) ->  | C177: of:=IF([.A177]=[.B177];"" ;[.B177]) ->  | D177: of:=IF([.G177];MIN(OFFSET(INDIRECT( ADDRESS(1;1; 1; ;[.$T$2])); (ROW() -26) * 2 ;0;2;1));"") ->  | E177: of:=IF([.G177];MAX(OFFSET(INDIRECT( ADDRESS(1;1; 1; ;[.$T$2])); (ROW() -26) * 2  ;0;2;1));"") ->  | F177: of:=IF([.G177];IF([.$T$2]="psiSkill";INDIRECT( ADDRESS((ROW()-25);1; 1; ;"ImprovedPsiSkill"));"");"") ->  | G177: of:=IF( INDIRECT( ADDRESS((ROW()-25)*2-1;1; 1;;"TU"))=0; FALSE();TRUE()) -> false | H177: of:=IF([.$G177];[.H$26];"") ->  | I177: of:=IF([.$G177];[.I$26];"") -> 
A178: of:=IF([.$T$2]="psiSkill";  IF([.E178]=[.F178];[.B178];[.E178]-[.F178]); [.D178]) ->  | B178: of:=IF([.$T$2]="psiSkill";  IF([.E178]=0;"";[.E178]); [.E178]) ->  | C178: of:=IF([.A178]=[.B178];"" ;[.B178]) ->  | D178: of:=IF([.G178];MIN(OFFSET(INDIRECT( ADDRESS(1;1; 1; ;[.$T$2])); (ROW() -26) * 2 ;0;2;1));"") ->  | E178: of:=IF([.G178];MAX(OFFSET(INDIRECT( ADDRESS(1;1; 1; ;[.$T$2])); (ROW() -26) * 2  ;0;2;1));"") ->  | F178: of:=IF([.G178];IF([.$T$2]="psiSkill";INDIRECT( ADDRESS((ROW()-25);1; 1; ;"ImprovedPsiSkill"));"");"") ->  | G178: of:=IF( INDIRECT( ADDRESS((ROW()-25)*2-1;1; 1;;"TU"))=0; FALSE();TRUE()) -> false | H178: of:=IF([.$G178];[.H$26];"") ->  | I178: of:=IF([.$G178];[.I$26];"") -> 
A179: of:=IF([.$T$2]="psiSkill";  IF([.E179]=[.F179];[.B179];[.E179]-[.F179]); [.D179]) ->  | B179: of:=IF([.$T$2]="psiSkill";  IF([.E179]=0;"";[.E179]); [.E179]) ->  | C179: of:=IF([.A179]=[.B179];"" ;[.B179]) ->  | D179: of:=IF([.G179];MIN(OFFSET(INDIRECT( ADDRESS(1;1; 1; ;[.$T$2])); (ROW() -26) * 2 ;0;2;1));"") ->  | E179: of:=IF([.G179];MAX(OFFSET(INDIRECT( ADDRESS(1;1; 1; ;[.$T$2])); (ROW() -26) * 2  ;0;2;1));"") ->  | F179: of:=IF([.G179];IF([.$T$2]="psiSkill";INDIRECT( ADDRESS((ROW()-25);1; 1; ;"ImprovedPsiSkill"));"");"") ->  | G179: of:=IF( INDIRECT( ADDRESS((ROW()-25)*2-1;1; 1;;"TU"))=0; FALSE();TRUE()) -> false | H179: of:=IF([.$G179];[.H$26];"") ->  | I179: of:=IF([.$G179];[.I$26];"") -> 
A180: of:=IF([.$T$2]="psiSkill";  IF([.E180]=[.F180];[.B180];[.E180]-[.F180]); [.D180]) ->  | B180: of:=IF([.$T$2]="psiSkill";  IF([.E180]=0;"";[.E180]); [.E180]) ->  | C180: of:=IF([.A180]=[.B180];"" ;[.B180]) ->  | D180: of:=IF([.G180];MIN(OFFSET(INDIRECT( ADDRESS(1;1; 1; ;[.$T$2])); (ROW() -26) * 2 ;0;2;1));"") ->  | E180: of:=IF([.G180];MAX(OFFSET(INDIRECT( ADDRESS(1;1; 1; ;[.$T$2])); (ROW() -26) * 2  ;0;2;1));"") ->  | F180: of:=IF([.G180];IF([.$T$2]="psiSkill";INDIRECT( ADDRESS((ROW()-25);1; 1; ;"ImprovedPsiSkill"));"");"") ->  | G180: of:=IF( INDIRECT( ADDRESS((ROW()-25)*2-1;1; 1;;"TU"))=0; FALSE();TRUE()) -> false | H180: of:=IF([.$G180];[.H$26];"") ->  | I180: of:=IF([.$G180];[.I$26];"") -> 
A181: of:=IF([.$T$2]="psiSkill";  IF([.E181]=[.F181];[.B181];[.E181]-[.F181]); [.D181]) ->  | B181: of:=IF([.$T$2]="psiSkill";  IF([.E181]=0;"";[.E181]); [.E181]) ->  | C181: of:=IF([.A181]=[.B181];"" ;[.B181]) ->  | D181: of:=IF([.G181];MIN(OFFSET(INDIRECT( ADDRESS(1;1; 1; ;[.$T$2])); (ROW() -26) * 2 ;0;2;1));"") ->  | E181: of:=IF([.G181];MAX(OFFSET(INDIRECT( ADDRESS(1;1; 1; ;[.$T$2])); (ROW() -26) * 2  ;0;2;1));"") ->  | F181: of:=IF([.G181];IF([.$T$2]="psiSkill";INDIRECT( ADDRESS((ROW()-25);1; 1; ;"ImprovedPsiSkill"));"");"") ->  | G181: of:=IF( INDIRECT( ADDRESS((ROW()-25)*2-1;1; 1;;"TU"))=0; FALSE();TRUE()) -> false | H181: of:=IF([.$G181];[.H$26];"") ->  | I181: of:=IF([.$G181];[.I$26];"") -> 
A182: of:=IF([.$T$2]="psiSkill";  IF([.E182]=[.F182];[.B182];[.E182]-[.F182]); [.D182]) ->  | B182: of:=IF([.$T$2]="psiSkill";  IF([.E182]=0;"";[.E182]); [.E182]) ->  | C182: of:=IF([.A182]=[.B182];"" ;[.B182]) ->  | D182: of:=IF([.G182];MIN(OFFSET(INDIRECT( ADDRESS(1;1; 1; ;[.$T$2])); (ROW() -26) * 2 ;0;2;1));"") ->  | E182: of:=IF([.G182];MAX(OFFSET(INDIRECT( ADDRESS(1;1; 1; ;[.$T$2])); (ROW() -26) * 2  ;0;2;1));"") ->  | F182: of:=IF([.G182];IF([.$T$2]="psiSkill";INDIRECT( ADDRESS((ROW()-25);1; 1; ;"ImprovedPsiSkill"));"");"") ->  | G182: of:=IF( INDIRECT( ADDRESS((ROW()-25)*2-1;1; 1;;"TU"))=0; FALSE();TRUE()) -> false | H182: of:=IF([.$G182];[.H$26];"") ->  | I182: of:=IF([.$G182];[.I$26];"") -> 
A183: of:=IF([.$T$2]="psiSkill";  IF([.E183]=[.F183];[.B183];[.E183]-[.F183]); [.D183]) ->  | B183: of:=IF([.$T$2]="psiSkill";  IF([.E183]=0;"";[.E183]); [.E183]) ->  | C183: of:=IF([.A183]=[.B183];"" ;[.B183]) ->  | D183: of:=IF([.G183];MIN(OFFSET(INDIRECT( ADDRESS(1;1; 1; ;[.$T$2])); (ROW() -26) * 2 ;0;2;1));"") ->  | E183: of:=IF([.G183];MAX(OFFSET(INDIRECT( ADDRESS(1;1; 1; ;[.$T$2])); (ROW() -26) * 2  ;0;2;1));"") ->  | F183: of:=IF([.G183];IF([.$T$2]="psiSkill";INDIRECT( ADDRESS((ROW()-25);1; 1; ;"ImprovedPsiSkill"));"");"") ->  | G183: of:=IF( INDIRECT( ADDRESS((ROW()-25)*2-1;1; 1;;"TU"))=0; FALSE();TRUE()) -> false | H183: of:=IF([.$G183];[.H$26];"") ->  | I183: of:=IF([.$G183];[.I$26];"") -> 
A184: of:=IF([.$T$2]="psiSkill";  IF([.E184]=[.F184];[.B184];[.E184]-[.F184]); [.D184]) ->  | B184: of:=IF([.$T$2]="psiSkill";  IF([.E184]=0;"";[.E184]); [.E184]) ->  | C184: of:=IF([.A184]=[.B184];"" ;[.B184]) ->  | D184: of:=IF([.G184];MIN(OFFSET(INDIRECT( ADDRESS(1;1; 1; ;[.$T$2])); (ROW() -26) * 2 ;0;2;1));"") ->  | E184: of:=IF([.G184];MAX(OFFSET(INDIRECT( ADDRESS(1;1; 1; ;[.$T$2])); (ROW() -26) * 2  ;0;2;1));"") ->  | F184: of:=IF([.G184];IF([.$T$2]="psiSkill";INDIRECT( ADDRESS((ROW()-25);1; 1; ;"ImprovedPsiSkill"));"");"") ->  | G184: of:=IF( INDIRECT( ADDRESS((ROW()-25)*2-1;1; 1;;"TU"))=0; FALSE();TRUE()) -> false | H184: of:=IF([.$G184];[.H$26];"") ->  | I184: of:=IF([.$G184];[.I$26];"") -> 
A185: of:=IF([.$T$2]="psiSkill";  IF([.E185]=[.F185];[.B185];[.E185]-[.F185]); [.D185]) ->  | B185: of:=IF([.$T$2]="psiSkill";  IF([.E185]=0;"";[.E185]); [.E185]) ->  | C185: of:=IF([.A185]=[.B185];"" ;[.B185]) ->  | D185: of:=IF([.G185];MIN(OFFSET(INDIRECT( ADDRESS(1;1; 1; ;[.$T$2])); (ROW() -26) * 2 ;0;2;1));"") ->  | E185: of:=IF([.G185];MAX(OFFSET(INDIRECT( ADDRESS(1;1; 1; ;[.$T$2])); (ROW() -26) * 2  ;0;2;1));"") ->  | F185: of:=IF([.G185];IF([.$T$2]="psiSkill";INDIRECT( ADDRESS((ROW()-25);1; 1; ;"ImprovedPsiSkill"));"");"") ->  | G185: of:=IF( INDIRECT( ADDRESS((ROW()-25)*2-1;1; 1;;"TU"))=0; FALSE();TRUE()) -> false | H185: of:=IF([.$G185];[.H$26];"") ->  | I185: of:=IF([.$G185];[.I$26];"") -> 
A186: of:=IF([.$T$2]="psiSkill";  IF([.E186]=[.F186];[.B186];[.E186]-[.F186]); [.D186]) ->  | B186: of:=IF([.$T$2]="psiSkill";  IF([.E186]=0;"";[.E186]); [.E186]) ->  | C186: of:=IF([.A186]=[.B186];"" ;[.B186]) ->  | D186: of:=IF([.G186];MIN(OFFSET(INDIRECT( ADDRESS(1;1; 1; ;[.$T$2])); (ROW() -26) * 2 ;0;2;1));"") ->  | E186: of:=IF([.G186];MAX(OFFSET(INDIRECT( ADDRESS(1;1; 1; ;[.$T$2])); (ROW() -26) * 2  ;0;2;1));"") ->  | F186: of:=IF([.G186];IF([.$T$2]="psiSkill";INDIRECT( ADDRESS((ROW()-25);1; 1; ;"ImprovedPsiSkill"));"");"") ->  | G186: of:=IF( INDIRECT( ADDRESS((ROW()-25)*2-1;1; 1;;"TU"))=0; FALSE();TRUE()) -> false | H186: of:=IF([.$G186];[.H$26];"") ->  | I186: of:=IF([.$G186];[.I$26];"") -> 
A187: of:=IF([.$T$2]="psiSkill";  IF([.E187]=[.F187];[.B187];[.E187]-[.F187]); [.D187]) ->  | B187: of:=IF([.$T$2]="psiSkill";  IF([.E187]=0;"";[.E187]); [.E187]) ->  | C187: of:=IF([.A187]=[.B187];"" ;[.B187]) ->  | D187: of:=IF([.G187];MIN(OFFSET(INDIRECT( ADDRESS(1;1; 1; ;[.$T$2])); (ROW() -26) * 2 ;0;2;1));"") ->  | E187: of:=IF([.G187];MAX(OFFSET(INDIRECT( ADDRESS(1;1; 1; ;[.$T$2])); (ROW() -26) * 2  ;0;2;1));"") ->  | F187: of:=IF([.G187];IF([.$T$2]="psiSkill";INDIRECT( ADDRESS((ROW()-25);1; 1; ;"ImprovedPsiSkill"));"");"") ->  | G187: of:=IF( INDIRECT( ADDRESS((ROW()-25)*2-1;1; 1;;"TU"))=0; FALSE();TRUE()) -> false | H187: of:=IF([.$G187];[.H$26];"") ->  | I187: of:=IF([.$G187];[.I$26];"") -> 
A188: of:=IF([.$T$2]="psiSkill";  IF([.E188]=[.F188];[.B188];[.E188]-[.F188]); [.D188]) ->  | B188: of:=IF([.$T$2]="psiSkill";  IF([.E188]=0;"";[.E188]); [.E188]) ->  | C188: of:=IF([.A188]=[.B188];"" ;[.B188]) ->  | D188: of:=IF([.G188];MIN(OFFSET(INDIRECT( ADDRESS(1;1; 1; ;[.$T$2])); (ROW() -26) * 2 ;0;2;1));"") ->  | E188: of:=IF([.G188];MAX(OFFSET(INDIRECT( ADDRESS(1;1; 1; ;[.$T$2])); (ROW() -26) * 2  ;0;2;1));"") ->  | F188: of:=IF([.G188];IF([.$T$2]="psiSkill";INDIRECT( ADDRESS((ROW()-25);1; 1; ;"ImprovedPsiSkill"));"");"") ->  | G188: of:=IF( INDIRECT( ADDRESS((ROW()-25)*2-1;1; 1;;"TU"))=0; FALSE();TRUE()) -> false | H188: of:=IF([.$G188];[.H$26];"") ->  | I188: of:=IF([.$G188];[.I$26];"") -> 
A189: of:=IF([.$T$2]="psiSkill";  IF([.E189]=[.F189];[.B189];[.E189]-[.F189]); [.D189]) ->  | B189: of:=IF([.$T$2]="psiSkill";  IF([.E189]=0;"";[.E189]); [.E189]) ->  | C189: of:=IF([.A189]=[.B189];"" ;[.B189]) ->  | D189: of:=IF([.G189];MIN(OFFSET(INDIRECT( ADDRESS(1;1; 1; ;[.$T$2])); (ROW() -26) * 2 ;0;2;1));"") ->  | E189: of:=IF([.G189];MAX(OFFSET(INDIRECT( ADDRESS(1;1; 1; ;[.$T$2])); (ROW() -26) * 2  ;0;2;1));"") ->  | F189: of:=IF([.G189];IF([.$T$2]="psiSkill";INDIRECT( ADDRESS((ROW()-25);1; 1; ;"ImprovedPsiSkill"));"");"") ->  | G189: of:=IF( INDIRECT( ADDRESS((ROW()-25)*2-1;1; 1;;"TU"))=0; FALSE();TRUE()) -> false | H189: of:=IF([.$G189];[.H$26];"") ->  | I189: of:=IF([.$G189];[.I$26];"") -> 
A190: of:=IF([.$T$2]="psiSkill";  IF([.E190]=[.F190];[.B190];[.E190]-[.F190]); [.D190]) ->  | B190: of:=IF([.$T$2]="psiSkill";  IF([.E190]=0;"";[.E190]); [.E190]) ->  | C190: of:=IF([.A190]=[.B190];"" ;[.B190]) ->  | D190: of:=IF([.G190];MIN(OFFSET(INDIRECT( ADDRESS(1;1; 1; ;[.$T$2])); (ROW() -26) * 2 ;0;2;1));"") ->  | E190: of:=IF([.G190];MAX(OFFSET(INDIRECT( ADDRESS(1;1; 1; ;[.$T$2])); (ROW() -26) * 2  ;0;2;1));"") ->  | F190: of:=IF([.G190];IF([.$T$2]="psiSkill";INDIRECT( ADDRESS((ROW()-25);1; 1; ;"ImprovedPsiSkill"));"");"") ->  | G190: of:=IF( INDIRECT( ADDRESS((ROW()-25)*2-1;1; 1;;"TU"))=0; FALSE();TRUE()) -> false | H190: of:=IF([.$G190];[.H$26];"") ->  | I190: of:=IF([.$G190];[.I$26];"") -> 
A191: of:=IF([.$T$2]="psiSkill";  IF([.E191]=[.F191];[.B191];[.E191]-[.F191]); [.D191]) ->  | B191: of:=IF([.$T$2]="psiSkill";  IF([.E191]=0;"";[.E191]); [.E191]) ->  | C191: of:=IF([.A191]=[.B191];"" ;[.B191]) ->  | D191: of:=IF([.G191];MIN(OFFSET(INDIRECT( ADDRESS(1;1; 1; ;[.$T$2])); (ROW() -26) * 2 ;0;2;1));"") ->  | E191: of:=IF([.G191];MAX(OFFSET(INDIRECT( ADDRESS(1;1; 1; ;[.$T$2])); (ROW() -26) * 2  ;0;2;1));"") ->  | F191: of:=IF([.G191];IF([.$T$2]="psiSkill";INDIRECT( ADDRESS((ROW()-25);1; 1; ;"ImprovedPsiSkill"));"");"") ->  | G191: of:=IF( INDIRECT( ADDRESS((ROW()-25)*2-1;1; 1;;"TU"))=0; FALSE();TRUE()) -> false | H191: of:=IF([.$G191];[.H$26];"") ->  | I191: of:=IF([.$G191];[.I$26];"") -> 
A192: of:=IF([.$T$2]="psiSkill";  IF([.E192]=[.F192];[.B192];[.E192]-[.F192]); [.D192]) ->  | B192: of:=IF([.$T$2]="psiSkill";  IF([.E192]=0;"";[.E192]); [.E192]) ->  | C192: of:=IF([.A192]=[.B192];"" ;[.B192]) ->  | D192: of:=IF([.G192];MIN(OFFSET(INDIRECT( ADDRESS(1;1; 1; ;[.$T$2])); (ROW() -26) * 2 ;0;2;1));"") ->  | E192: of:=IF([.G192];MAX(OFFSET(INDIRECT( ADDRESS(1;1; 1; ;[.$T$2])); (ROW() -26) * 2  ;0;2;1));"") ->  | F192: of:=IF([.G192];IF([.$T$2]="psiSkill";INDIRECT( ADDRESS((ROW()-25);1; 1; ;"ImprovedPsiSkill"));"");"") ->  | G192: of:=IF( INDIRECT( ADDRESS((ROW()-25)*2-1;1; 1;;"TU"))=0; FALSE();TRUE()) -> false | H192: of:=IF([.$G192];[.H$26];"") ->  | I192: of:=IF([.$G192];[.I$26];"") -> 
A193: of:=IF([.$T$2]="psiSkill";  IF([.E193]=[.F193];[.B193];[.E193]-[.F193]); [.D193]) ->  | B193: of:=IF([.$T$2]="psiSkill";  IF([.E193]=0;"";[.E193]); [.E193]) ->  | C193: of:=IF([.A193]=[.B193];"" ;[.B193]) ->  | D193: of:=IF([.G193];MIN(OFFSET(INDIRECT( ADDRESS(1;1; 1; ;[.$T$2])); (ROW() -26) * 2 ;0;2;1));"") ->  | E193: of:=IF([.G193];MAX(OFFSET(INDIRECT( ADDRESS(1;1; 1; ;[.$T$2])); (ROW() -26) * 2  ;0;2;1));"") ->  | F193: of:=IF([.G193];IF([.$T$2]="psiSkill";INDIRECT( ADDRESS((ROW()-25);1; 1; ;"ImprovedPsiSkill"));"");"") ->  | G193: of:=IF( INDIRECT( ADDRESS((ROW()-25)*2-1;1; 1;;"TU"))=0; FALSE();TRUE()) -> false | H193: of:=IF([.$G193];[.H$26];"") ->  | I193: of:=IF([.$G193];[.I$26];"") -> 
A194: of:=IF([.$T$2]="psiSkill";  IF([.E194]=[.F194];[.B194];[.E194]-[.F194]); [.D194]) ->  | B194: of:=IF([.$T$2]="psiSkill";  IF([.E194]=0;"";[.E194]); [.E194]) ->  | C194: of:=IF([.A194]=[.B194];"" ;[.B194]) ->  | D194: of:=IF([.G194];MIN(OFFSET(INDIRECT( ADDRESS(1;1; 1; ;[.$T$2])); (ROW() -26) * 2 ;0;2;1));"") ->  | E194: of:=IF([.G194];MAX(OFFSET(INDIRECT( ADDRESS(1;1; 1; ;[.$T$2])); (ROW() -26) * 2  ;0;2;1));"") ->  | F194: of:=IF([.G194];IF([.$T$2]="psiSkill";INDIRECT( ADDRESS((ROW()-25);1; 1; ;"ImprovedPsiSkill"));"");"") ->  | G194: of:=IF( INDIRECT( ADDRESS((ROW()-25)*2-1;1; 1;;"TU"))=0; FALSE();TRUE()) -> false | H194: of:=IF([.$G194];[.H$26];"") ->  | I194: of:=IF([.$G194];[.I$26];"") -> 
A195: of:=IF([.$T$2]="psiSkill";  IF([.E195]=[.F195];[.B195];[.E195]-[.F195]); [.D195]) ->  | B195: of:=IF([.$T$2]="psiSkill";  IF([.E195]=0;"";[.E195]); [.E195]) ->  | C195: of:=IF([.A195]=[.B195];"" ;[.B195]) ->  | D195: of:=IF([.G195];MIN(OFFSET(INDIRECT( ADDRESS(1;1; 1; ;[.$T$2])); (ROW() -26) * 2 ;0;2;1));"") ->  | E195: of:=IF([.G195];MAX(OFFSET(INDIRECT( ADDRESS(1;1; 1; ;[.$T$2])); (ROW() -26) * 2  ;0;2;1));"") ->  | F195: of:=IF([.G195];IF([.$T$2]="psiSkill";INDIRECT( ADDRESS((ROW()-25);1; 1; ;"ImprovedPsiSkill"));"");"") ->  | G195: of:=IF( INDIRECT( ADDRESS((ROW()-25)*2-1;1; 1;;"TU"))=0; FALSE();TRUE()) -> false | H195: of:=IF([.$G195];[.H$26];"") ->  | I195: of:=IF([.$G195];[.I$26];"") -> 
A196: of:=IF([.$T$2]="psiSkill";  IF([.E196]=[.F196];[.B196];[.E196]-[.F196]); [.D196]) ->  | B196: of:=IF([.$T$2]="psiSkill";  IF([.E196]=0;"";[.E196]); [.E196]) ->  | C196: of:=IF([.A196]=[.B196];"" ;[.B196]) ->  | D196: of:=IF([.G196];MIN(OFFSET(INDIRECT( ADDRESS(1;1; 1; ;[.$T$2])); (ROW() -26) * 2 ;0;2;1));"") ->  | E196: of:=IF([.G196];MAX(OFFSET(INDIRECT( ADDRESS(1;1; 1; ;[.$T$2])); (ROW() -26) * 2  ;0;2;1));"") ->  | F196: of:=IF([.G196];IF([.$T$2]="psiSkill";INDIRECT( ADDRESS((ROW()-25);1; 1; ;"ImprovedPsiSkill"));"");"") ->  | G196: of:=IF( INDIRECT( ADDRESS((ROW()-25)*2-1;1; 1;;"TU"))=0; FALSE();TRUE()) -> false | H196: of:=IF([.$G196];[.H$26];"") ->  | I196: of:=IF([.$G196];[.I$26];"") -> 
A197: of:=IF([.$T$2]="psiSkill";  IF([.E197]=[.F197];[.B197];[.E197]-[.F197]); [.D197]) ->  | B197: of:=IF([.$T$2]="psiSkill";  IF([.E197]=0;"";[.E197]); [.E197]) ->  | C197: of:=IF([.A197]=[.B197];"" ;[.B197]) ->  | D197: of:=IF([.G197];MIN(OFFSET(INDIRECT( ADDRESS(1;1; 1; ;[.$T$2])); (ROW() -26) * 2 ;0;2;1));"") ->  | E197: of:=IF([.G197];MAX(OFFSET(INDIRECT( ADDRESS(1;1; 1; ;[.$T$2])); (ROW() -26) * 2  ;0;2;1));"") ->  | F197: of:=IF([.G197];IF([.$T$2]="psiSkill";INDIRECT( ADDRESS((ROW()-25);1; 1; ;"ImprovedPsiSkill"));"");"") ->  | G197: of:=IF( INDIRECT( ADDRESS((ROW()-25)*2-1;1; 1;;"TU"))=0; FALSE();TRUE()) -> false | H197: of:=IF([.$G197];[.H$26];"") ->  | I197: of:=IF([.$G197];[.I$26];"") -> 
A198: of:=IF([.$T$2]="psiSkill";  IF([.E198]=[.F198];[.B198];[.E198]-[.F198]); [.D198]) ->  | B198: of:=IF([.$T$2]="psiSkill";  IF([.E198]=0;"";[.E198]); [.E198]) ->  | C198: of:=IF([.A198]=[.B198];"" ;[.B198]) ->  | D198: of:=IF([.G198];MIN(OFFSET(INDIRECT( ADDRESS(1;1; 1; ;[.$T$2])); (ROW() -26) * 2 ;0;2;1));"") ->  | E198: of:=IF([.G198];MAX(OFFSET(INDIRECT( ADDRESS(1;1; 1; ;[.$T$2])); (ROW() -26) * 2  ;0;2;1));"") ->  | F198: of:=IF([.G198];IF([.$T$2]="psiSkill";INDIRECT( ADDRESS((ROW()-25);1; 1; ;"ImprovedPsiSkill"));"");"") ->  | G198: of:=IF( INDIRECT( ADDRESS((ROW()-25)*2-1;1; 1;;"TU"))=0; FALSE();TRUE()) -> false | H198: of:=IF([.$G198];[.H$26];"") ->  | I198: of:=IF([.$G198];[.I$26];"") -> 
A199: of:=IF([.$T$2]="psiSkill";  IF([.E199]=[.F199];[.B199];[.E199]-[.F199]); [.D199]) ->  | B199: of:=IF([.$T$2]="psiSkill";  IF([.E199]=0;"";[.E199]); [.E199]) ->  | C199: of:=IF([.A199]=[.B199];"" ;[.B199]) ->  | D199: of:=IF([.G199];MIN(OFFSET(INDIRECT( ADDRESS(1;1; 1; ;[.$T$2])); (ROW() -26) * 2 ;0;2;1));"") ->  | E199: of:=IF([.G199];MAX(OFFSET(INDIRECT( ADDRESS(1;1; 1; ;[.$T$2])); (ROW() -26) * 2  ;0;2;1));"") ->  | F199: of:=IF([.G199];IF([.$T$2]="psiSkill";INDIRECT( ADDRESS((ROW()-25);1; 1; ;"ImprovedPsiSkill"));"");"") ->  | G199: of:=IF( INDIRECT( ADDRESS((ROW()-25)*2-1;1; 1;;"TU"))=0; FALSE();TRUE()) -> false | H199: of:=IF([.$G199];[.H$26];"") ->  | I199: of:=IF([.$G199];[.I$26];"") -> 
A200: of:=IF([.$T$2]="psiSkill";  IF([.E200]=[.F200];[.B200];[.E200]-[.F200]); [.D200]) ->  | B200: of:=IF([.$T$2]="psiSkill";  IF([.E200]=0;"";[.E200]); [.E200]) ->  | C200: of:=IF([.A200]=[.B200];"" ;[.B200]) ->  | D200: of:=IF([.G200];MIN(OFFSET(INDIRECT( ADDRESS(1;1; 1; ;[.$T$2])); (ROW() -26) * 2 ;0;2;1));"") ->  | E200: of:=IF([.G200];MAX(OFFSET(INDIRECT( ADDRESS(1;1; 1; ;[.$T$2])); (ROW() -26) * 2  ;0;2;1));"") ->  | F200: of:=IF([.G200];IF([.$T$2]="psiSkill";INDIRECT( ADDRESS((ROW()-25);1; 1; ;"ImprovedPsiSkill"));"");"") ->  | G200: of:=IF( INDIRECT( ADDRESS((ROW()-25)*2-1;1; 1;;"TU"))=0; FALSE();TRUE()) -> false | H200: of:=IF([.$G200];[.H$26];"") ->  | I200: of:=IF([.$G200];[.I$26];"") -> 
A201: of:=IF([.$T$2]="psiSkill";  IF([.E201]=[.F201];[.B201];[.E201]-[.F201]); [.D201]) ->  | B201: of:=IF([.$T$2]="psiSkill";  IF([.E201]=0;"";[.E201]); [.E201]) ->  | C201: of:=IF([.A201]=[.B201];"" ;[.B201]) ->  | D201: of:=IF([.G201];MIN(OFFSET(INDIRECT( ADDRESS(1;1; 1; ;[.$T$2])); (ROW() -26) * 2 ;0;2;1));"") ->  | E201: of:=IF([.G201];MAX(OFFSET(INDIRECT( ADDRESS(1;1; 1; ;[.$T$2])); (ROW() -26) * 2  ;0;2;1));"") ->  | F201: of:=IF([.G201];IF([.$T$2]="psiSkill";INDIRECT( ADDRESS((ROW()-25);1; 1; ;"ImprovedPsiSkill"));"");"") ->  | G201: of:=IF( INDIRECT( ADDRESS((ROW()-25)*2-1;1; 1;;"TU"))=0; FALSE();TRUE()) -> false | H201: of:=IF([.$G201];[.H$26];"") ->  | I201: of:=IF([.$G201];[.I$26];"") -> 
A202: of:=IF([.$T$2]="psiSkill";  IF([.E202]=[.F202];[.B202];[.E202]-[.F202]); [.D202]) ->  | B202: of:=IF([.$T$2]="psiSkill";  IF([.E202]=0;"";[.E202]); [.E202]) ->  | C202: of:=IF([.A202]=[.B202];"" ;[.B202]) ->  | D202: of:=IF([.G202];MIN(OFFSET(INDIRECT( ADDRESS(1;1; 1; ;[.$T$2])); (ROW() -26) * 2 ;0;2;1));"") ->  | E202: of:=IF([.G202];MAX(OFFSET(INDIRECT( ADDRESS(1;1; 1; ;[.$T$2])); (ROW() -26) * 2  ;0;2;1));"") ->  | F202: of:=IF([.G202];IF([.$T$2]="psiSkill";INDIRECT( ADDRESS((ROW()-25);1; 1; ;"ImprovedPsiSkill"));"");"") ->  | G202: of:=IF( INDIRECT( ADDRESS((ROW()-25)*2-1;1; 1;;"TU"))=0; FALSE();TRUE()) -> false | H202: of:=IF([.$G202];[.H$26];"") ->  | I202: of:=IF([.$G202];[.I$26];"") -> 
A203: of:=IF([.$T$2]="psiSkill";  IF([.E203]=[.F203];[.B203];[.E203]-[.F203]); [.D203]) ->  | B203: of:=IF([.$T$2]="psiSkill";  IF([.E203]=0;"";[.E203]); [.E203]) ->  | C203: of:=IF([.A203]=[.B203];"" ;[.B203]) ->  | D203: of:=IF([.G203];MIN(OFFSET(INDIRECT( ADDRESS(1;1; 1; ;[.$T$2])); (ROW() -26) * 2 ;0;2;1));"") ->  | E203: of:=IF([.G203];MAX(OFFSET(INDIRECT( ADDRESS(1;1; 1; ;[.$T$2])); (ROW() -26) * 2  ;0;2;1));"") ->  | F203: of:=IF([.G203];IF([.$T$2]="psiSkill";INDIRECT( ADDRESS((ROW()-25);1; 1; ;"ImprovedPsiSkill"));"");"") ->  | G203: of:=IF( INDIRECT( ADDRESS((ROW()-25)*2-1;1; 1;;"TU"))=0; FALSE();TRUE()) -> false | H203: of:=IF([.$G203];[.H$26];"") ->  | I203: of:=IF([.$G203];[.I$26];"") -> 
A204: of:=IF([.$T$2]="psiSkill";  IF([.E204]=[.F204];[.B204];[.E204]-[.F204]); [.D204]) ->  | B204: of:=IF([.$T$2]="psiSkill";  IF([.E204]=0;"";[.E204]); [.E204]) ->  | C204: of:=IF([.A204]=[.B204];"" ;[.B204]) ->  | D204: of:=IF([.G204];MIN(OFFSET(INDIRECT( ADDRESS(1;1; 1; ;[.$T$2])); (ROW() -26) * 2 ;0;2;1));"") ->  | E204: of:=IF([.G204];MAX(OFFSET(INDIRECT( ADDRESS(1;1; 1; ;[.$T$2])); (ROW() -26) * 2  ;0;2;1));"") ->  | F204: of:=IF([.G204];IF([.$T$2]="psiSkill";INDIRECT( ADDRESS((ROW()-25);1; 1; ;"ImprovedPsiSkill"));"");"") ->  | G204: of:=IF( INDIRECT( ADDRESS((ROW()-25)*2-1;1; 1;;"TU"))=0; FALSE();TRUE()) -> false | H204: of:=IF([.$G204];[.H$26];"") ->  | I204: of:=IF([.$G204];[.I$26];"") -> 
A205: of:=IF([.$T$2]="psiSkill";  IF([.E205]=[.F205];[.B205];[.E205]-[.F205]); [.D205]) ->  | B205: of:=IF([.$T$2]="psiSkill";  IF([.E205]=0;"";[.E205]); [.E205]) ->  | C205: of:=IF([.A205]=[.B205];"" ;[.B205]) ->  | D205: of:=IF([.G205];MIN(OFFSET(INDIRECT( ADDRESS(1;1; 1; ;[.$T$2])); (ROW() -26) * 2 ;0;2;1));"") ->  | E205: of:=IF([.G205];MAX(OFFSET(INDIRECT( ADDRESS(1;1; 1; ;[.$T$2])); (ROW() -26) * 2  ;0;2;1));"") ->  | F205: of:=IF([.G205];IF([.$T$2]="psiSkill";INDIRECT( ADDRESS((ROW()-25);1; 1; ;"ImprovedPsiSkill"));"");"") ->  | G205: of:=IF( INDIRECT( ADDRESS((ROW()-25)*2-1;1; 1;;"TU"))=0; FALSE();TRUE()) -> false | H205: of:=IF([.$G205];[.H$26];"") ->  | I205: of:=IF([.$G205];[.I$26];"") -> 
A206: of:=IF([.$T$2]="psiSkill";  IF([.E206]=[.F206];[.B206];[.E206]-[.F206]); [.D206]) ->  | B206: of:=IF([.$T$2]="psiSkill";  IF([.E206]=0;"";[.E206]); [.E206]) ->  | C206: of:=IF([.A206]=[.B206];"" ;[.B206]) ->  | D206: of:=IF([.G206];MIN(OFFSET(INDIRECT( ADDRESS(1;1; 1; ;[.$T$2])); (ROW() -26) * 2 ;0;2;1));"") ->  | E206: of:=IF([.G206];MAX(OFFSET(INDIRECT( ADDRESS(1;1; 1; ;[.$T$2])); (ROW() -26) * 2  ;0;2;1));"") ->  | F206: of:=IF([.G206];IF([.$T$2]="psiSkill";INDIRECT( ADDRESS((ROW()-25);1; 1; ;"ImprovedPsiSkill"));"");"") ->  | G206: of:=IF( INDIRECT( ADDRESS((ROW()-25)*2-1;1; 1;;"TU"))=0; FALSE();TRUE()) -> false | H206: of:=IF([.$G206];[.H$26];"") ->  | I206: of:=IF([.$G206];[.I$26];"") -> 
A207: of:=IF([.$T$2]="psiSkill";  IF([.E207]=[.F207];[.B207];[.E207]-[.F207]); [.D207]) ->  | B207: of:=IF([.$T$2]="psiSkill";  IF([.E207]=0;"";[.E207]); [.E207]) ->  | C207: of:=IF([.A207]=[.B207];"" ;[.B207]) ->  | D207: of:=IF([.G207];MIN(OFFSET(INDIRECT( ADDRESS(1;1; 1; ;[.$T$2])); (ROW() -26) * 2 ;0;2;1));"") ->  | E207: of:=IF([.G207];MAX(OFFSET(INDIRECT( ADDRESS(1;1; 1; ;[.$T$2])); (ROW() -26) * 2  ;0;2;1));"") ->  | F207: of:=IF([.G207];IF([.$T$2]="psiSkill";INDIRECT( ADDRESS((ROW()-25);1; 1; ;"ImprovedPsiSkill"));"");"") ->  | G207: of:=IF( INDIRECT( ADDRESS((ROW()-25)*2-1;1; 1;;"TU"))=0; FALSE();TRUE()) -> false | H207: of:=IF([.$G207];[.H$26];"") ->  | I207: of:=IF([.$G207];[.I$26];"") -> 
A208: of:=IF([.$T$2]="psiSkill";  IF([.E208]=[.F208];[.B208];[.E208]-[.F208]); [.D208]) ->  | B208: of:=IF([.$T$2]="psiSkill";  IF([.E208]=0;"";[.E208]); [.E208]) ->  | C208: of:=IF([.A208]=[.B208];"" ;[.B208]) ->  | D208: of:=IF([.G208];MIN(OFFSET(INDIRECT( ADDRESS(1;1; 1; ;[.$T$2])); (ROW() -26) * 2 ;0;2;1));"") ->  | E208: of:=IF([.G208];MAX(OFFSET(INDIRECT( ADDRESS(1;1; 1; ;[.$T$2])); (ROW() -26) * 2  ;0;2;1));"") ->  | F208: of:=IF([.G208];IF([.$T$2]="psiSkill";INDIRECT( ADDRESS((ROW()-25);1; 1; ;"ImprovedPsiSkill"));"");"") ->  | G208: of:=IF( INDIRECT( ADDRESS((ROW()-25)*2-1;1; 1;;"TU"))=0; FALSE();TRUE()) -> false | H208: of:=IF([.$G208];[.H$26];"") ->  | I208: of:=IF([.$G208];[.I$26];"") -> 
A209: of:=IF([.$T$2]="psiSkill";  IF([.E209]=[.F209];[.B209];[.E209]-[.F209]); [.D209]) ->  | B209: of:=IF([.$T$2]="psiSkill";  IF([.E209]=0;"";[.E209]); [.E209]) ->  | C209: of:=IF([.A209]=[.B209];"" ;[.B209]) ->  | D209: of:=IF([.G209];MIN(OFFSET(INDIRECT( ADDRESS(1;1; 1; ;[.$T$2])); (ROW() -26) * 2 ;0;2;1));"") ->  | E209: of:=IF([.G209];MAX(OFFSET(INDIRECT( ADDRESS(1;1; 1; ;[.$T$2])); (ROW() -26) * 2  ;0;2;1));"") ->  | F209: of:=IF([.G209];IF([.$T$2]="psiSkill";INDIRECT( ADDRESS((ROW()-25);1; 1; ;"ImprovedPsiSkill"));"");"") ->  | G209: of:=IF( INDIRECT( ADDRESS((ROW()-25)*2-1;1; 1;;"TU"))=0; FALSE();TRUE()) -> false | H209: of:=IF([.$G209];[.H$26];"") ->  | I209: of:=IF([.$G209];[.I$26];"") -> 
A210: of:=IF([.$T$2]="psiSkill";  IF([.E210]=[.F210];[.B210];[.E210]-[.F210]); [.D210]) ->  | B210: of:=IF([.$T$2]="psiSkill";  IF([.E210]=0;"";[.E210]); [.E210]) ->  | C210: of:=IF([.A210]=[.B210];"" ;[.B210]) ->  | D210: of:=IF([.G210];MIN(OFFSET(INDIRECT( ADDRESS(1;1; 1; ;[.$T$2])); (ROW() -26) * 2 ;0;2;1));"") ->  | E210: of:=IF([.G210];MAX(OFFSET(INDIRECT( ADDRESS(1;1; 1; ;[.$T$2])); (ROW() -26) * 2  ;0;2;1));"") ->  | F210: of:=IF([.G210];IF([.$T$2]="psiSkill";INDIRECT( ADDRESS((ROW()-25);1; 1; ;"ImprovedPsiSkill"));"");"") ->  | G210: of:=IF( INDIRECT( ADDRESS((ROW()-25)*2-1;1; 1;;"TU"))=0; FALSE();TRUE()) -> false | H210: of:=IF([.$G210];[.H$26];"") ->  | I210: of:=IF([.$G210];[.I$26];"") -> 
A211: of:=IF([.$T$2]="psiSkill";  IF([.E211]=[.F211];[.B211];[.E211]-[.F211]); [.D211]) ->  | B211: of:=IF([.$T$2]="psiSkill";  IF([.E211]=0;"";[.E211]); [.E211]) ->  | C211: of:=IF([.A211]=[.B211];"" ;[.B211]) ->  | D211: of:=IF([.G211];MIN(OFFSET(INDIRECT( ADDRESS(1;1; 1; ;[.$T$2])); (ROW() -26) * 2 ;0;2;1));"") ->  | E211: of:=IF([.G211];MAX(OFFSET(INDIRECT( ADDRESS(1;1; 1; ;[.$T$2])); (ROW() -26) * 2  ;0;2;1));"") ->  | F211: of:=IF([.G211];IF([.$T$2]="psiSkill";INDIRECT( ADDRESS((ROW()-25);1; 1; ;"ImprovedPsiSkill"));"");"") ->  | G211: of:=IF( INDIRECT( ADDRESS((ROW()-25)*2-1;1; 1;;"TU"))=0; FALSE();TRUE()) -> false | H211: of:=IF([.$G211];[.H$26];"") ->  | I211: of:=IF([.$G211];[.I$26];"") -> 
A212: of:=IF([.$T$2]="psiSkill";  IF([.E212]=[.F212];[.B212];[.E212]-[.F212]); [.D212]) ->  | B212: of:=IF([.$T$2]="psiSkill";  IF([.E212]=0;"";[.E212]); [.E212]) ->  | C212: of:=IF([.A212]=[.B212];"" ;[.B212]) ->  | D212: of:=IF([.G212];MIN(OFFSET(INDIRECT( ADDRESS(1;1; 1; ;[.$T$2])); (ROW() -26) * 2 ;0;2;1));"") ->  | E212: of:=IF([.G212];MAX(OFFSET(INDIRECT( ADDRESS(1;1; 1; ;[.$T$2])); (ROW() -26) * 2  ;0;2;1));"") ->  | F212: of:=IF([.G212];IF([.$T$2]="psiSkill";INDIRECT( ADDRESS((ROW()-25);1; 1; ;"ImprovedPsiSkill"));"");"") ->  | G212: of:=IF( INDIRECT( ADDRESS((ROW()-25)*2-1;1; 1;;"TU"))=0; FALSE();TRUE()) -> false | H212: of:=IF([.$G212];[.H$26];"") ->  | I212: of:=IF([.$G212];[.I$26];"") -> 
A213: of:=IF([.$T$2]="psiSkill";  IF([.E213]=[.F213];[.B213];[.E213]-[.F213]); [.D213]) ->  | B213: of:=IF([.$T$2]="psiSkill";  IF([.E213]=0;"";[.E213]); [.E213]) ->  | C213: of:=IF([.A213]=[.B213];"" ;[.B213]) ->  | D213: of:=IF([.G213];MIN(OFFSET(INDIRECT( ADDRESS(1;1; 1; ;[.$T$2])); (ROW() -26) * 2 ;0;2;1));"") ->  | E213: of:=IF([.G213];MAX(OFFSET(INDIRECT( ADDRESS(1;1; 1; ;[.$T$2])); (ROW() -26) * 2  ;0;2;1));"") ->  | F213: of:=IF([.G213];IF([.$T$2]="psiSkill";INDIRECT( ADDRESS((ROW()-25);1; 1; ;"ImprovedPsiSkill"));"");"") ->  | G213: of:=IF( INDIRECT( ADDRESS((ROW()-25)*2-1;1; 1;;"TU"))=0; FALSE();TRUE()) -> false | H213: of:=IF([.$G213];[.H$26];"") ->  | I213: of:=IF([.$G213];[.I$26];"") -> 
A214: of:=IF([.$T$2]="psiSkill";  IF([.E214]=[.F214];[.B214];[.E214]-[.F214]); [.D214]) ->  | B214: of:=IF([.$T$2]="psiSkill";  IF([.E214]=0;"";[.E214]); [.E214]) ->  | C214: of:=IF([.A214]=[.B214];"" ;[.B214]) ->  | D214: of:=IF([.G214];MIN(OFFSET(INDIRECT( ADDRESS(1;1; 1; ;[.$T$2])); (ROW() -26) * 2 ;0;2;1));"") ->  | E214: of:=IF([.G214];MAX(OFFSET(INDIRECT( ADDRESS(1;1; 1; ;[.$T$2])); (ROW() -26) * 2  ;0;2;1));"") ->  | F214: of:=IF([.G214];IF([.$T$2]="psiSkill";INDIRECT( ADDRESS((ROW()-25);1; 1; ;"ImprovedPsiSkill"));"");"") ->  | G214: of:=IF( INDIRECT( ADDRESS((ROW()-25)*2-1;1; 1;;"TU"))=0; FALSE();TRUE()) -> false | H214: of:=IF([.$G214];[.H$26];"") ->  | I214: of:=IF([.$G214];[.I$26];"") -> 
A215: of:=IF([.$T$2]="psiSkill";  IF([.E215]=[.F215];[.B215];[.E215]-[.F215]); [.D215]) ->  | B215: of:=IF([.$T$2]="psiSkill";  IF([.E215]=0;"";[.E215]); [.E215]) ->  | C215: of:=IF([.A215]=[.B215];"" ;[.B215]) ->  | D215: of:=IF([.G215];MIN(OFFSET(INDIRECT( ADDRESS(1;1; 1; ;[.$T$2])); (ROW() -26) * 2 ;0;2;1));"") ->  | E215: of:=IF([.G215];MAX(OFFSET(INDIRECT( ADDRESS(1;1; 1; ;[.$T$2])); (ROW() -26) * 2  ;0;2;1));"") ->  | F215: of:=IF([.G215];IF([.$T$2]="psiSkill";INDIRECT( ADDRESS((ROW()-25);1; 1; ;"ImprovedPsiSkill"));"");"") ->  | G215: of:=IF( INDIRECT( ADDRESS((ROW()-25)*2-1;1; 1;;"TU"))=0; FALSE();TRUE()) -> false | H215: of:=IF([.$G215];[.H$26];"") ->  | I215: of:=IF([.$G215];[.I$26];"") -> 
A216: of:=IF([.$T$2]="psiSkill";  IF([.E216]=[.F216];[.B216];[.E216]-[.F216]); [.D216]) ->  | B216: of:=IF([.$T$2]="psiSkill";  IF([.E216]=0;"";[.E216]); [.E216]) ->  | C216: of:=IF([.A216]=[.B216];"" ;[.B216]) ->  | D216: of:=IF([.G216];MIN(OFFSET(INDIRECT( ADDRESS(1;1; 1; ;[.$T$2])); (ROW() -26) * 2 ;0;2;1));"") ->  | E216: of:=IF([.G216];MAX(OFFSET(INDIRECT( ADDRESS(1;1; 1; ;[.$T$2])); (ROW() -26) * 2  ;0;2;1));"") ->  | F216: of:=IF([.G216];IF([.$T$2]="psiSkill";INDIRECT( ADDRESS((ROW()-25);1; 1; ;"ImprovedPsiSkill"));"");"") ->  | G216: of:=IF( INDIRECT( ADDRESS((ROW()-25)*2-1;1; 1;;"TU"))=0; FALSE();TRUE()) -> false | H216: of:=IF([.$G216];[.H$26];"") ->  | I216: of:=IF([.$G216];[.I$26];"") -> 
A217: of:=IF([.$T$2]="psiSkill";  IF([.E217]=[.F217];[.B217];[.E217]-[.F217]); [.D217]) ->  | B217: of:=IF([.$T$2]="psiSkill";  IF([.E217]=0;"";[.E217]); [.E217]) ->  | C217: of:=IF([.A217]=[.B217];"" ;[.B217]) ->  | D217: of:=IF([.G217];MIN(OFFSET(INDIRECT( ADDRESS(1;1; 1; ;[.$T$2])); (ROW() -26) * 2 ;0;2;1));"") ->  | E217: of:=IF([.G217];MAX(OFFSET(INDIRECT( ADDRESS(1;1; 1; ;[.$T$2])); (ROW() -26) * 2  ;0;2;1));"") ->  | F217: of:=IF([.G217];IF([.$T$2]="psiSkill";INDIRECT( ADDRESS((ROW()-25);1; 1; ;"ImprovedPsiSkill"));"");"") ->  | G217: of:=IF( INDIRECT( ADDRESS((ROW()-25)*2-1;1; 1;;"TU"))=0; FALSE();TRUE()) -> false | H217: of:=IF([.$G217];[.H$26];"") ->  | I217: of:=IF([.$G217];[.I$26];"") -> 
A218: of:=IF([.$T$2]="psiSkill";  IF([.E218]=[.F218];[.B218];[.E218]-[.F218]); [.D218]) ->  | B218: of:=IF([.$T$2]="psiSkill";  IF([.E218]=0;"";[.E218]); [.E218]) ->  | C218: of:=IF([.A218]=[.B218];"" ;[.B218]) ->  | D218: of:=IF([.G218];MIN(OFFSET(INDIRECT( ADDRESS(1;1; 1; ;[.$T$2])); (ROW() -26) * 2 ;0;2;1));"") ->  | E218: of:=IF([.G218];MAX(OFFSET(INDIRECT( ADDRESS(1;1; 1; ;[.$T$2])); (ROW() -26) * 2  ;0;2;1));"") ->  | F218: of:=IF([.G218];IF([.$T$2]="psiSkill";INDIRECT( ADDRESS((ROW()-25);1; 1; ;"ImprovedPsiSkill"));"");"") ->  | G218: of:=IF( INDIRECT( ADDRESS((ROW()-25)*2-1;1; 1;;"TU"))=0; FALSE();TRUE()) -> false | H218: of:=IF([.$G218];[.H$26];"") ->  | I218: of:=IF([.$G218];[.I$26];"") -> 
A219: of:=IF([.$T$2]="psiSkill";  IF([.E219]=[.F219];[.B219];[.E219]-[.F219]); [.D219]) ->  | B219: of:=IF([.$T$2]="psiSkill";  IF([.E219]=0;"";[.E219]); [.E219]) ->  | C219: of:=IF([.A219]=[.B219];"" ;[.B219]) ->  | D219: of:=IF([.G219];MIN(OFFSET(INDIRECT( ADDRESS(1;1; 1; ;[.$T$2])); (ROW() -26) * 2 ;0;2;1));"") ->  | E219: of:=IF([.G219];MAX(OFFSET(INDIRECT( ADDRESS(1;1; 1; ;[.$T$2])); (ROW() -26) * 2  ;0;2;1));"") ->  | F219: of:=IF([.G219];IF([.$T$2]="psiSkill";INDIRECT( ADDRESS((ROW()-25);1; 1; ;"ImprovedPsiSkill"));"");"") ->  | G219: of:=IF( INDIRECT( ADDRESS((ROW()-25)*2-1;1; 1;;"TU"))=0; FALSE();TRUE()) -> false | H219: of:=IF([.$G219];[.H$26];"") ->  | I219: of:=IF([.$G219];[.I$26];"") -> 
A220: of:=IF([.$T$2]="psiSkill";  IF([.E220]=[.F220];[.B220];[.E220]-[.F220]); [.D220]) ->  | B220: of:=IF([.$T$2]="psiSkill";  IF([.E220]=0;"";[.E220]); [.E220]) ->  | C220: of:=IF([.A220]=[.B220];"" ;[.B220]) ->  | D220: of:=IF([.G220];MIN(OFFSET(INDIRECT( ADDRESS(1;1; 1; ;[.$T$2])); (ROW() -26) * 2 ;0;2;1));"") ->  | E220: of:=IF([.G220];MAX(OFFSET(INDIRECT( ADDRESS(1;1; 1; ;[.$T$2])); (ROW() -26) * 2  ;0;2;1));"") ->  | F220: of:=IF([.G220];IF([.$T$2]="psiSkill";INDIRECT( ADDRESS((ROW()-25);1; 1; ;"ImprovedPsiSkill"));"");"") ->  | G220: of:=IF( INDIRECT( ADDRESS((ROW()-25)*2-1;1; 1;;"TU"))=0; FALSE();TRUE()) -> false | H220: of:=IF([.$G220];[.H$26];"") ->  | I220: of:=IF([.$G220];[.I$26];"") -> 
A221: of:=IF([.$T$2]="psiSkill";  IF([.E221]=[.F221];[.B221];[.E221]-[.F221]); [.D221]) ->  | B221: of:=IF([.$T$2]="psiSkill";  IF([.E221]=0;"";[.E221]); [.E221]) ->  | C221: of:=IF([.A221]=[.B221];"" ;[.B221]) ->  | D221: of:=IF([.G221];MIN(OFFSET(INDIRECT( ADDRESS(1;1; 1; ;[.$T$2])); (ROW() -26) * 2 ;0;2;1));"") ->  | E221: of:=IF([.G221];MAX(OFFSET(INDIRECT( ADDRESS(1;1; 1; ;[.$T$2])); (ROW() -26) * 2  ;0;2;1));"") ->  | F221: of:=IF([.G221];IF([.$T$2]="psiSkill";INDIRECT( ADDRESS((ROW()-25);1; 1; ;"ImprovedPsiSkill"));"");"") ->  | G221: of:=IF( INDIRECT( ADDRESS((ROW()-25)*2-1;1; 1;;"TU"))=0; FALSE();TRUE()) -> false | H221: of:=IF([.$G221];[.H$26];"") ->  | I221: of:=IF([.$G221];[.I$26];"") -> 
A222: of:=IF([.$T$2]="psiSkill";  IF([.E222]=[.F222];[.B222];[.E222]-[.F222]); [.D222]) ->  | B222: of:=IF([.$T$2]="psiSkill";  IF([.E222]=0;"";[.E222]); [.E222]) ->  | C222: of:=IF([.A222]=[.B222];"" ;[.B222]) ->  | D222: of:=IF([.G222];MIN(OFFSET(INDIRECT( ADDRESS(1;1; 1; ;[.$T$2])); (ROW() -26) * 2 ;0;2;1));"") ->  | E222: of:=IF([.G222];MAX(OFFSET(INDIRECT( ADDRESS(1;1; 1; ;[.$T$2])); (ROW() -26) * 2  ;0;2;1));"") ->  | F222: of:=IF([.G222];IF([.$T$2]="psiSkill";INDIRECT( ADDRESS((ROW()-25);1; 1; ;"ImprovedPsiSkill"));"");"") ->  | G222: of:=IF( INDIRECT( ADDRESS((ROW()-25)*2-1;1; 1;;"TU"))=0; FALSE();TRUE()) -> false | H222: of:=IF([.$G222];[.H$26];"") ->  | I222: of:=IF([.$G222];[.I$26];"") -> 
A223: of:=IF([.$T$2]="psiSkill";  IF([.E223]=[.F223];[.B223];[.E223]-[.F223]); [.D223]) ->  | B223: of:=IF([.$T$2]="psiSkill";  IF([.E223]=0;"";[.E223]); [.E223]) ->  | C223: of:=IF([.A223]=[.B223];"" ;[.B223]) ->  | D223: of:=IF([.G223];MIN(OFFSET(INDIRECT( ADDRESS(1;1; 1; ;[.$T$2])); (ROW() -26) * 2 ;0;2;1));"") ->  | E223: of:=IF([.G223];MAX(OFFSET(INDIRECT( ADDRESS(1;1; 1; ;[.$T$2])); (ROW() -26) * 2  ;0;2;1));"") ->  | F223: of:=IF([.G223];IF([.$T$2]="psiSkill";INDIRECT( ADDRESS((ROW()-25);1; 1; ;"ImprovedPsiSkill"));"");"") ->  | G223: of:=IF( INDIRECT( ADDRESS((ROW()-25)*2-1;1; 1;;"TU"))=0; FALSE();TRUE()) -> false | H223: of:=IF([.$G223];[.H$26];"") ->  | I223: of:=IF([.$G223];[.I$26];"") -> 
A224: of:=IF([.$T$2]="psiSkill";  IF([.E224]=[.F224];[.B224];[.E224]-[.F224]); [.D224]) ->  | B224: of:=IF([.$T$2]="psiSkill";  IF([.E224]=0;"";[.E224]); [.E224]) ->  | C224: of:=IF([.A224]=[.B224];"" ;[.B224]) ->  | D224: of:=IF([.G224];MIN(OFFSET(INDIRECT( ADDRESS(1;1; 1; ;[.$T$2])); (ROW() -26) * 2 ;0;2;1));"") ->  | E224: of:=IF([.G224];MAX(OFFSET(INDIRECT( ADDRESS(1;1; 1; ;[.$T$2])); (ROW() -26) * 2  ;0;2;1));"") ->  | F224: of:=IF([.G224];IF([.$T$2]="psiSkill";INDIRECT( ADDRESS((ROW()-25);1; 1; ;"ImprovedPsiSkill"));"");"") ->  | G224: of:=IF( INDIRECT( ADDRESS((ROW()-25)*2-1;1; 1;;"TU"))=0; FALSE();TRUE()) -> false | H224: of:=IF([.$G224];[.H$26];"") ->  | I224: of:=IF([.$G224];[.I$26];"") -> 
A225: of:=IF([.$T$2]="psiSkill";  IF([.E225]=[.F225];[.B225];[.E225]-[.F225]); [.D225]) ->  | B225: of:=IF([.$T$2]="psiSkill";  IF([.E225]=0;"";[.E225]); [.E225]) ->  | C225: of:=IF([.A225]=[.B225];"" ;[.B225]) ->  | D225: of:=IF([.G225];MIN(OFFSET(INDIRECT( ADDRESS(1;1; 1; ;[.$T$2])); (ROW() -26) * 2 ;0;2;1));"") ->  | E225: of:=IF([.G225];MAX(OFFSET(INDIRECT( ADDRESS(1;1; 1; ;[.$T$2])); (ROW() -26) * 2  ;0;2;1));"") ->  | F225: of:=IF([.G225];IF([.$T$2]="psiSkill";INDIRECT( ADDRESS((ROW()-25);1; 1; ;"ImprovedPsiSkill"));"");"") ->  | G225: of:=IF( INDIRECT( ADDRESS((ROW()-25)*2-1;1; 1;;"TU"))=0; FALSE();TRUE()) -> false | H225: of:=IF([.$G225];[.H$26];"") ->  | I225: of:=IF([.$G225];[.I$26];"") -> 
A226: of:=IF([.$T$2]="psiSkill";  IF([.E226]=[.F226];[.B226];[.E226]-[.F226]); [.D226]) ->  | B226: of:=IF([.$T$2]="psiSkill";  IF([.E226]=0;"";[.E226]); [.E226]) ->  | C226: of:=IF([.A226]=[.B226];"" ;[.B226]) ->  | D226: of:=IF([.G226];MIN(OFFSET(INDIRECT( ADDRESS(1;1; 1; ;[.$T$2])); (ROW() -26) * 2 ;0;2;1));"") ->  | E226: of:=IF([.G226];MAX(OFFSET(INDIRECT( ADDRESS(1;1; 1; ;[.$T$2])); (ROW() -26) * 2  ;0;2;1));"") ->  | F226: of:=IF([.G226];IF([.$T$2]="psiSkill";INDIRECT( ADDRESS((ROW()-25);1; 1; ;"ImprovedPsiSkill"));"");"") ->  | G226: of:=IF( INDIRECT( ADDRESS((ROW()-25)*2-1;1; 1;;"TU"))=0; FALSE();TRUE()) -> false | H226: of:=IF([.$G226];[.H$26];"") ->  | I226: of:=IF([.$G226];[.I$26];"") -> 
A227: of:=IF([.$T$2]="psiSkill";  IF([.E227]=[.F227];[.B227];[.E227]-[.F227]); [.D227]) ->  | B227: of:=IF([.$T$2]="psiSkill";  IF([.E227]=0;"";[.E227]); [.E227]) ->  | C227: of:=IF([.A227]=[.B227];"" ;[.B227]) ->  | D227: of:=IF([.G227];MIN(OFFSET(INDIRECT( ADDRESS(1;1; 1; ;[.$T$2])); (ROW() -26) * 2 ;0;2;1));"") ->  | E227: of:=IF([.G227];MAX(OFFSET(INDIRECT( ADDRESS(1;1; 1; ;[.$T$2])); (ROW() -26) * 2  ;0;2;1));"") ->  | F227: of:=IF([.G227];IF([.$T$2]="psiSkill";INDIRECT( ADDRESS((ROW()-25);1; 1; ;"ImprovedPsiSkill"));"");"") ->  | G227: of:=IF( INDIRECT( ADDRESS((ROW()-25)*2-1;1; 1;;"TU"))=0; FALSE();TRUE()) -> false | H227: of:=IF([.$G227];[.H$26];"") ->  | I227: of:=IF([.$G227];[.I$26];"") -> 
A228: of:=IF([.$T$2]="psiSkill";  IF([.E228]=[.F228];[.B228];[.E228]-[.F228]); [.D228]) ->  | B228: of:=IF([.$T$2]="psiSkill";  IF([.E228]=0;"";[.E228]); [.E228]) ->  | C228: of:=IF([.A228]=[.B228];"" ;[.B228]) ->  | D228: of:=IF([.G228];MIN(OFFSET(INDIRECT( ADDRESS(1;1; 1; ;[.$T$2])); (ROW() -26) * 2 ;0;2;1));"") ->  | E228: of:=IF([.G228];MAX(OFFSET(INDIRECT( ADDRESS(1;1; 1; ;[.$T$2])); (ROW() -26) * 2  ;0;2;1));"") ->  | F228: of:=IF([.G228];IF([.$T$2]="psiSkill";INDIRECT( ADDRESS((ROW()-25);1; 1; ;"ImprovedPsiSkill"));"");"") ->  | G228: of:=IF( INDIRECT( ADDRESS((ROW()-25)*2-1;1; 1;;"TU"))=0; FALSE();TRUE()) -> false | H228: of:=IF([.$G228];[.H$26];"") ->  | I228: of:=IF([.$G228];[.I$26];"") -> 
A229: of:=IF([.$T$2]="psiSkill";  IF([.E229]=[.F229];[.B229];[.E229]-[.F229]); [.D229]) ->  | B229: of:=IF([.$T$2]="psiSkill";  IF([.E229]=0;"";[.E229]); [.E229]) ->  | C229: of:=IF([.A229]=[.B229];"" ;[.B229]) ->  | D229: of:=IF([.G229];MIN(OFFSET(INDIRECT( ADDRESS(1;1; 1; ;[.$T$2])); (ROW() -26) * 2 ;0;2;1));"") ->  | E229: of:=IF([.G229];MAX(OFFSET(INDIRECT( ADDRESS(1;1; 1; ;[.$T$2])); (ROW() -26) * 2  ;0;2;1));"") ->  | F229: of:=IF([.G229];IF([.$T$2]="psiSkill";INDIRECT( ADDRESS((ROW()-25);1; 1; ;"ImprovedPsiSkill"));"");"") ->  | G229: of:=IF( INDIRECT( ADDRESS((ROW()-25)*2-1;1; 1;;"TU"))=0; FALSE();TRUE()) -> false | H229: of:=IF([.$G229];[.H$26];"") ->  | I229: of:=IF([.$G229];[.I$26];"") -> 
A230: of:=IF([.$T$2]="psiSkill";  IF([.E230]=[.F230];[.B230];[.E230]-[.F230]); [.D230]) ->  | B230: of:=IF([.$T$2]="psiSkill";  IF([.E230]=0;"";[.E230]); [.E230]) ->  | C230: of:=IF([.A230]=[.B230];"" ;[.B230]) ->  | D230: of:=IF([.G230];MIN(OFFSET(INDIRECT( ADDRESS(1;1; 1; ;[.$T$2])); (ROW() -26) * 2 ;0;2;1));"") ->  | E230: of:=IF([.G230];MAX(OFFSET(INDIRECT( ADDRESS(1;1; 1; ;[.$T$2])); (ROW() -26) * 2  ;0;2;1));"") ->  | F230: of:=IF([.G230];IF([.$T$2]="psiSkill";INDIRECT( ADDRESS((ROW()-25);1; 1; ;"ImprovedPsiSkill"));"");"") ->  | G230: of:=IF( INDIRECT( ADDRESS((ROW()-25)*2-1;1; 1;;"TU"))=0; FALSE();TRUE()) -> false | H230: of:=IF([.$G230];[.H$26];"") ->  | I230: of:=IF([.$G230];[.I$26];"") -> 
A231: of:=IF([.$T$2]="psiSkill";  IF([.E231]=[.F231];[.B231];[.E231]-[.F231]); [.D231]) ->  | B231: of:=IF([.$T$2]="psiSkill";  IF([.E231]=0;"";[.E231]); [.E231]) ->  | C231: of:=IF([.A231]=[.B231];"" ;[.B231]) ->  | D231: of:=IF([.G231];MIN(OFFSET(INDIRECT( ADDRESS(1;1; 1; ;[.$T$2])); (ROW() -26) * 2 ;0;2;1));"") ->  | E231: of:=IF([.G231];MAX(OFFSET(INDIRECT( ADDRESS(1;1; 1; ;[.$T$2])); (ROW() -26) * 2  ;0;2;1));"") ->  | F231: of:=IF([.G231];IF([.$T$2]="psiSkill";INDIRECT( ADDRESS((ROW()-25);1; 1; ;"ImprovedPsiSkill"));"");"") ->  | G231: of:=IF( INDIRECT( ADDRESS((ROW()-25)*2-1;1; 1;;"TU"))=0; FALSE();TRUE()) -> false | H231: of:=IF([.$G231];[.H$26];"") ->  | I231: of:=IF([.$G231];[.I$26];"") -> 
A232: of:=IF([.$T$2]="psiSkill";  IF([.E232]=[.F232];[.B232];[.E232]-[.F232]); [.D232]) ->  | B232: of:=IF([.$T$2]="psiSkill";  IF([.E232]=0;"";[.E232]); [.E232]) ->  | C232: of:=IF([.A232]=[.B232];"" ;[.B232]) ->  | D232: of:=IF([.G232];MIN(OFFSET(INDIRECT( ADDRESS(1;1; 1; ;[.$T$2])); (ROW() -26) * 2 ;0;2;1));"") ->  | E232: of:=IF([.G232];MAX(OFFSET(INDIRECT( ADDRESS(1;1; 1; ;[.$T$2])); (ROW() -26) * 2  ;0;2;1));"") ->  | F232: of:=IF([.G232];IF([.$T$2]="psiSkill";INDIRECT( ADDRESS((ROW()-25);1; 1; ;"ImprovedPsiSkill"));"");"") ->  | G232: of:=IF( INDIRECT( ADDRESS((ROW()-25)*2-1;1; 1;;"TU"))=0; FALSE();TRUE()) -> false | H232: of:=IF([.$G232];[.H$26];"") ->  | I232: of:=IF([.$G232];[.I$26];"") -> 
A233: of:=IF([.$T$2]="psiSkill";  IF([.E233]=[.F233];[.B233];[.E233]-[.F233]); [.D233]) ->  | B233: of:=IF([.$T$2]="psiSkill";  IF([.E233]=0;"";[.E233]); [.E233]) ->  | C233: of:=IF([.A233]=[.B233];"" ;[.B233]) ->  | D233: of:=IF([.G233];MIN(OFFSET(INDIRECT( ADDRESS(1;1; 1; ;[.$T$2])); (ROW() -26) * 2 ;0;2;1));"") ->  | E233: of:=IF([.G233];MAX(OFFSET(INDIRECT( ADDRESS(1;1; 1; ;[.$T$2])); (ROW() -26) * 2  ;0;2;1));"") ->  | F233: of:=IF([.G233];IF([.$T$2]="psiSkill";INDIRECT( ADDRESS((ROW()-25);1; 1; ;"ImprovedPsiSkill"));"");"") ->  | G233: of:=IF( INDIRECT( ADDRESS((ROW()-25)*2-1;1; 1;;"TU"))=0; FALSE();TRUE()) -> false | H233: of:=IF([.$G233];[.H$26];"") ->  | I233: of:=IF([.$G233];[.I$26];"") -> 
A234: of:=IF([.$T$2]="psiSkill";  IF([.E234]=[.F234];[.B234];[.E234]-[.F234]); [.D234]) ->  | B234: of:=IF([.$T$2]="psiSkill";  IF([.E234]=0;"";[.E234]); [.E234]) ->  | C234: of:=IF([.A234]=[.B234];"" ;[.B234]) ->  | D234: of:=IF([.G234];MIN(OFFSET(INDIRECT( ADDRESS(1;1; 1; ;[.$T$2])); (ROW() -26) * 2 ;0;2;1));"") ->  | E234: of:=IF([.G234];MAX(OFFSET(INDIRECT( ADDRESS(1;1; 1; ;[.$T$2])); (ROW() -26) * 2  ;0;2;1));"") ->  | F234: of:=IF([.G234];IF([.$T$2]="psiSkill";INDIRECT( ADDRESS((ROW()-25);1; 1; ;"ImprovedPsiSkill"));"");"") ->  | G234: of:=IF( INDIRECT( ADDRESS((ROW()-25)*2-1;1; 1;;"TU"))=0; FALSE();TRUE()) -> false | H234: of:=IF([.$G234];[.H$26];"") ->  | I234: of:=IF([.$G234];[.I$26];"") -> 
A235: of:=IF([.$T$2]="psiSkill";  IF([.E235]=[.F235];[.B235];[.E235]-[.F235]); [.D235]) ->  | B235: of:=IF([.$T$2]="psiSkill";  IF([.E235]=0;"";[.E235]); [.E235]) ->  | C235: of:=IF([.A235]=[.B235];"" ;[.B235]) ->  | D235: of:=IF([.G235];MIN(OFFSET(INDIRECT( ADDRESS(1;1; 1; ;[.$T$2])); (ROW() -26) * 2 ;0;2;1));"") ->  | E235: of:=IF([.G235];MAX(OFFSET(INDIRECT( ADDRESS(1;1; 1; ;[.$T$2])); (ROW() -26) * 2  ;0;2;1));"") ->  | F235: of:=IF([.G235];IF([.$T$2]="psiSkill";INDIRECT( ADDRESS((ROW()-25);1; 1; ;"ImprovedPsiSkill"));"");"") ->  | G235: of:=IF( INDIRECT( ADDRESS((ROW()-25)*2-1;1; 1;;"TU"))=0; FALSE();TRUE()) -> false | H235: of:=IF([.$G235];[.H$26];"") ->  | I235: of:=IF([.$G235];[.I$26];"") -> 
A236: of:=IF([.$T$2]="psiSkill";  IF([.E236]=[.F236];[.B236];[.E236]-[.F236]); [.D236]) ->  | B236: of:=IF([.$T$2]="psiSkill";  IF([.E236]=0;"";[.E236]); [.E236]) ->  | C236: of:=IF([.A236]=[.B236];"" ;[.B236]) ->  | D236: of:=IF([.G236];MIN(OFFSET(INDIRECT( ADDRESS(1;1; 1; ;[.$T$2])); (ROW() -26) * 2 ;0;2;1));"") ->  | E236: of:=IF([.G236];MAX(OFFSET(INDIRECT( ADDRESS(1;1; 1; ;[.$T$2])); (ROW() -26) * 2  ;0;2;1));"") ->  | F236: of:=IF([.G236];IF([.$T$2]="psiSkill";INDIRECT( ADDRESS((ROW()-25);1; 1; ;"ImprovedPsiSkill"));"");"") ->  | G236: of:=IF( INDIRECT( ADDRESS((ROW()-25)*2-1;1; 1;;"TU"))=0; FALSE();TRUE()) -> false | H236: of:=IF([.$G236];[.H$26];"") ->  | I236: of:=IF([.$G236];[.I$26];"") -> 
A237: of:=IF([.$T$2]="psiSkill";  IF([.E237]=[.F237];[.B237];[.E237]-[.F237]); [.D237]) ->  | B237: of:=IF([.$T$2]="psiSkill";  IF([.E237]=0;"";[.E237]); [.E237]) ->  | C237: of:=IF([.A237]=[.B237];"" ;[.B237]) ->  | D237: of:=IF([.G237];MIN(OFFSET(INDIRECT( ADDRESS(1;1; 1; ;[.$T$2])); (ROW() -26) * 2 ;0;2;1));"") ->  | E237: of:=IF([.G237];MAX(OFFSET(INDIRECT( ADDRESS(1;1; 1; ;[.$T$2])); (ROW() -26) * 2  ;0;2;1));"") ->  | F237: of:=IF([.G237];IF([.$T$2]="psiSkill";INDIRECT( ADDRESS((ROW()-25);1; 1; ;"ImprovedPsiSkill"));"");"") ->  | G237: of:=IF( INDIRECT( ADDRESS((ROW()-25)*2-1;1; 1;;"TU"))=0; FALSE();TRUE()) -> false | H237: of:=IF([.$G237];[.H$26];"") ->  | I237: of:=IF([.$G237];[.I$26];"") -> 
A238: of:=IF([.$T$2]="psiSkill";  IF([.E238]=[.F238];[.B238];[.E238]-[.F238]); [.D238]) ->  | B238: of:=IF([.$T$2]="psiSkill";  IF([.E238]=0;"";[.E238]); [.E238]) ->  | C238: of:=IF([.A238]=[.B238];"" ;[.B238]) ->  | D238: of:=IF([.G238];MIN(OFFSET(INDIRECT( ADDRESS(1;1; 1; ;[.$T$2])); (ROW() -26) * 2 ;0;2;1));"") ->  | E238: of:=IF([.G238];MAX(OFFSET(INDIRECT( ADDRESS(1;1; 1; ;[.$T$2])); (ROW() -26) * 2  ;0;2;1));"") ->  | F238: of:=IF([.G238];IF([.$T$2]="psiSkill";INDIRECT( ADDRESS((ROW()-25);1; 1; ;"ImprovedPsiSkill"));"");"") ->  | G238: of:=IF( INDIRECT( ADDRESS((ROW()-25)*2-1;1; 1;;"TU"))=0; FALSE();TRUE()) -> false | H238: of:=IF([.$G238];[.H$26];"") ->  | I238: of:=IF([.$G238];[.I$26];"") -> 
A239: of:=IF([.$T$2]="psiSkill";  IF([.E239]=[.F239];[.B239];[.E239]-[.F239]); [.D239]) ->  | B239: of:=IF([.$T$2]="psiSkill";  IF([.E239]=0;"";[.E239]); [.E239]) ->  | C239: of:=IF([.A239]=[.B239];"" ;[.B239]) ->  | D239: of:=IF([.G239];MIN(OFFSET(INDIRECT( ADDRESS(1;1; 1; ;[.$T$2])); (ROW() -26) * 2 ;0;2;1));"") ->  | E239: of:=IF([.G239];MAX(OFFSET(INDIRECT( ADDRESS(1;1; 1; ;[.$T$2])); (ROW() -26) * 2  ;0;2;1));"") ->  | F239: of:=IF([.G239];IF([.$T$2]="psiSkill";INDIRECT( ADDRESS((ROW()-25);1; 1; ;"ImprovedPsiSkill"));"");"") ->  | G239: of:=IF( INDIRECT( ADDRESS((ROW()-25)*2-1;1; 1;;"TU"))=0; FALSE();TRUE()) -> false | H239: of:=IF([.$G239];[.H$26];"") ->  | I239: of:=IF([.$G239];[.I$26];"") -> 
A240: of:=IF([.$T$2]="psiSkill";  IF([.E240]=[.F240];[.B240];[.E240]-[.F240]); [.D240]) ->  | B240: of:=IF([.$T$2]="psiSkill";  IF([.E240]=0;"";[.E240]); [.E240]) ->  | C240: of:=IF([.A240]=[.B240];"" ;[.B240]) ->  | D240: of:=IF([.G240];MIN(OFFSET(INDIRECT( ADDRESS(1;1; 1; ;[.$T$2])); (ROW() -26) * 2 ;0;2;1));"") ->  | E240: of:=IF([.G240];MAX(OFFSET(INDIRECT( ADDRESS(1;1; 1; ;[.$T$2])); (ROW() -26) * 2  ;0;2;1));"") ->  | F240: of:=IF([.G240];IF([.$T$2]="psiSkill";INDIRECT( ADDRESS((ROW()-25);1; 1; ;"ImprovedPsiSkill"));"");"") ->  | G240: of:=IF( INDIRECT( ADDRESS((ROW()-25)*2-1;1; 1;;"TU"))=0; FALSE();TRUE()) -> false | H240: of:=IF([.$G240];[.H$26];"") ->  | I240: of:=IF([.$G240];[.I$26];"") -> 
A241: of:=IF([.$T$2]="psiSkill";  IF([.E241]=[.F241];[.B241];[.E241]-[.F241]); [.D241]) ->  | B241: of:=IF([.$T$2]="psiSkill";  IF([.E241]=0;"";[.E241]); [.E241]) ->  | C241: of:=IF([.A241]=[.B241];"" ;[.B241]) ->  | D241: of:=IF([.G241];MIN(OFFSET(INDIRECT( ADDRESS(1;1; 1; ;[.$T$2])); (ROW() -26) * 2 ;0;2;1));"") ->  | E241: of:=IF([.G241];MAX(OFFSET(INDIRECT( ADDRESS(1;1; 1; ;[.$T$2])); (ROW() -26) * 2  ;0;2;1));"") ->  | F241: of:=IF([.G241];IF([.$T$2]="psiSkill";INDIRECT( ADDRESS((ROW()-25);1; 1; ;"ImprovedPsiSkill"));"");"") ->  | G241: of:=IF( INDIRECT( ADDRESS((ROW()-25)*2-1;1; 1;;"TU"))=0; FALSE();TRUE()) -> false | H241: of:=IF([.$G241];[.H$26];"") ->  | I241: of:=IF([.$G241];[.I$26];"") -> 
A242: of:=IF([.$T$2]="psiSkill";  IF([.E242]=[.F242];[.B242];[.E242]-[.F242]); [.D242]) ->  | B242: of:=IF([.$T$2]="psiSkill";  IF([.E242]=0;"";[.E242]); [.E242]) ->  | C242: of:=IF([.A242]=[.B242];"" ;[.B242]) ->  | D242: of:=IF([.G242];MIN(OFFSET(INDIRECT( ADDRESS(1;1; 1; ;[.$T$2])); (ROW() -26) * 2 ;0;2;1));"") ->  | E242: of:=IF([.G242];MAX(OFFSET(INDIRECT( ADDRESS(1;1; 1; ;[.$T$2])); (ROW() -26) * 2  ;0;2;1));"") ->  | F242: of:=IF([.G242];IF([.$T$2]="psiSkill";INDIRECT( ADDRESS((ROW()-25);1; 1; ;"ImprovedPsiSkill"));"");"") ->  | G242: of:=IF( INDIRECT( ADDRESS((ROW()-25)*2-1;1; 1;;"TU"))=0; FALSE();TRUE()) -> false | H242: of:=IF([.$G242];[.H$26];"") ->  | I242: of:=IF([.$G242];[.I$26];"") -> 
A243: of:=IF([.$T$2]="psiSkill";  IF([.E243]=[.F243];[.B243];[.E243]-[.F243]); [.D243]) ->  | B243: of:=IF([.$T$2]="psiSkill";  IF([.E243]=0;"";[.E243]); [.E243]) ->  | C243: of:=IF([.A243]=[.B243];"" ;[.B243]) ->  | D243: of:=IF([.G243];MIN(OFFSET(INDIRECT( ADDRESS(1;1; 1; ;[.$T$2])); (ROW() -26) * 2 ;0;2;1));"") ->  | E243: of:=IF([.G243];MAX(OFFSET(INDIRECT( ADDRESS(1;1; 1; ;[.$T$2])); (ROW() -26) * 2  ;0;2;1));"") ->  | F243: of:=IF([.G243];IF([.$T$2]="psiSkill";INDIRECT( ADDRESS((ROW()-25);1; 1; ;"ImprovedPsiSkill"));"");"") ->  | G243: of:=IF( INDIRECT( ADDRESS((ROW()-25)*2-1;1; 1;;"TU"))=0; FALSE();TRUE()) -> false | H243: of:=IF([.$G243];[.H$26];"") ->  | I243: of:=IF([.$G243];[.I$26];"") -> 
A244: of:=IF([.$T$2]="psiSkill";  IF([.E244]=[.F244];[.B244];[.E244]-[.F244]); [.D244]) ->  | B244: of:=IF([.$T$2]="psiSkill";  IF([.E244]=0;"";[.E244]); [.E244]) ->  | C244: of:=IF([.A244]=[.B244];"" ;[.B244]) ->  | D244: of:=IF([.G244];MIN(OFFSET(INDIRECT( ADDRESS(1;1; 1; ;[.$T$2])); (ROW() -26) * 2 ;0;2;1));"") ->  | E244: of:=IF([.G244];MAX(OFFSET(INDIRECT( ADDRESS(1;1; 1; ;[.$T$2])); (ROW() -26) * 2  ;0;2;1));"") ->  | F244: of:=IF([.G244];IF([.$T$2]="psiSkill";INDIRECT( ADDRESS((ROW()-25);1; 1; ;"ImprovedPsiSkill"));"");"") ->  | G244: of:=IF( INDIRECT( ADDRESS((ROW()-25)*2-1;1; 1;;"TU"))=0; FALSE();TRUE()) -> false | H244: of:=IF([.$G244];[.H$26];"") ->  | I244: of:=IF([.$G244];[.I$26];"") -> 
A245: of:=IF([.$T$2]="psiSkill";  IF([.E245]=[.F245];[.B245];[.E245]-[.F245]); [.D245]) ->  | B245: of:=IF([.$T$2]="psiSkill";  IF([.E245]=0;"";[.E245]); [.E245]) ->  | C245: of:=IF([.A245]=[.B245];"" ;[.B245]) ->  | D245: of:=IF([.G245];MIN(OFFSET(INDIRECT( ADDRESS(1;1; 1; ;[.$T$2])); (ROW() -26) * 2 ;0;2;1));"") ->  | E245: of:=IF([.G245];MAX(OFFSET(INDIRECT( ADDRESS(1;1; 1; ;[.$T$2])); (ROW() -26) * 2  ;0;2;1));"") ->  | F245: of:=IF([.G245];IF([.$T$2]="psiSkill";INDIRECT( ADDRESS((ROW()-25);1; 1; ;"ImprovedPsiSkill"));"");"") ->  | G245: of:=IF( INDIRECT( ADDRESS((ROW()-25)*2-1;1; 1;;"TU"))=0; FALSE();TRUE()) -> false | H245: of:=IF([.$G245];[.H$26];"") ->  | I245: of:=IF([.$G245];[.I$26];"") -> 
A246: of:=IF([.$T$2]="psiSkill";  IF([.E246]=[.F246];[.B246];[.E246]-[.F246]); [.D246]) ->  | B246: of:=IF([.$T$2]="psiSkill";  IF([.E246]=0;"";[.E246]); [.E246]) ->  | C246: of:=IF([.A246]=[.B246];"" ;[.B246]) ->  | D246: of:=IF([.G246];MIN(OFFSET(INDIRECT( ADDRESS(1;1; 1; ;[.$T$2])); (ROW() -26) * 2 ;0;2;1));"") ->  | E246: of:=IF([.G246];MAX(OFFSET(INDIRECT( ADDRESS(1;1; 1; ;[.$T$2])); (ROW() -26) * 2  ;0;2;1));"") ->  | F246: of:=IF([.G246];IF([.$T$2]="psiSkill";INDIRECT( ADDRESS((ROW()-25);1; 1; ;"ImprovedPsiSkill"));"");"") ->  | G246: of:=IF( INDIRECT( ADDRESS((ROW()-25)*2-1;1; 1;;"TU"))=0; FALSE();TRUE()) -> false | H246: of:=IF([.$G246];[.H$26];"") ->  | I246: of:=IF([.$G246];[.I$26];"") -> 
A247: of:=IF([.$T$2]="psiSkill";  IF([.E247]=[.F247];[.B247];[.E247]-[.F247]); [.D247]) ->  | B247: of:=IF([.$T$2]="psiSkill";  IF([.E247]=0;"";[.E247]); [.E247]) ->  | C247: of:=IF([.A247]=[.B247];"" ;[.B247]) ->  | D247: of:=IF([.G247];MIN(OFFSET(INDIRECT( ADDRESS(1;1; 1; ;[.$T$2])); (ROW() -26) * 2 ;0;2;1));"") ->  | E247: of:=IF([.G247];MAX(OFFSET(INDIRECT( ADDRESS(1;1; 1; ;[.$T$2])); (ROW() -26) * 2  ;0;2;1));"") ->  | F247: of:=IF([.G247];IF([.$T$2]="psiSkill";INDIRECT( ADDRESS((ROW()-25);1; 1; ;"ImprovedPsiSkill"));"");"") ->  | G247: of:=IF( INDIRECT( ADDRESS((ROW()-25)*2-1;1; 1;;"TU"))=0; FALSE();TRUE()) -> false | H247: of:=IF([.$G247];[.H$26];"") ->  | I247: of:=IF([.$G247];[.I$26];"") -> 
A248: of:=IF([.$T$2]="psiSkill";  IF([.E248]=[.F248];[.B248];[.E248]-[.F248]); [.D248]) ->  | B248: of:=IF([.$T$2]="psiSkill";  IF([.E248]=0;"";[.E248]); [.E248]) ->  | C248: of:=IF([.A248]=[.B248];"" ;[.B248]) ->  | D248: of:=IF([.G248];MIN(OFFSET(INDIRECT( ADDRESS(1;1; 1; ;[.$T$2])); (ROW() -26) * 2 ;0;2;1));"") ->  | E248: of:=IF([.G248];MAX(OFFSET(INDIRECT( ADDRESS(1;1; 1; ;[.$T$2])); (ROW() -26) * 2  ;0;2;1));"") ->  | F248: of:=IF([.G248];IF([.$T$2]="psiSkill";INDIRECT( ADDRESS((ROW()-25);1; 1; ;"ImprovedPsiSkill"));"");"") ->  | G248: of:=IF( INDIRECT( ADDRESS((ROW()-25)*2-1;1; 1;;"TU"))=0; FALSE();TRUE()) -> false | H248: of:=IF([.$G248];[.H$26];"") ->  | I248: of:=IF([.$G248];[.I$26];"") -> 
A249: of:=IF([.$T$2]="psiSkill";  IF([.E249]=[.F249];[.B249];[.E249]-[.F249]); [.D249]) ->  | B249: of:=IF([.$T$2]="psiSkill";  IF([.E249]=0;"";[.E249]); [.E249]) ->  | C249: of:=IF([.A249]=[.B249];"" ;[.B249]) ->  | D249: of:=IF([.G249];MIN(OFFSET(INDIRECT( ADDRESS(1;1; 1; ;[.$T$2])); (ROW() -26) * 2 ;0;2;1));"") ->  | E249: of:=IF([.G249];MAX(OFFSET(INDIRECT( ADDRESS(1;1; 1; ;[.$T$2])); (ROW() -26) * 2  ;0;2;1));"") ->  | F249: of:=IF([.G249];IF([.$T$2]="psiSkill";INDIRECT( ADDRESS((ROW()-25);1; 1; ;"ImprovedPsiSkill"));"");"") ->  | G249: of:=IF( INDIRECT( ADDRESS((ROW()-25)*2-1;1; 1;;"TU"))=0; FALSE();TRUE()) -> false | H249: of:=IF([.$G249];[.H$26];"") ->  | I249: of:=IF([.$G249];[.I$26];"") -> 
A250: of:=IF([.$T$2]="psiSkill";  IF([.E250]=[.F250];[.B250];[.E250]-[.F250]); [.D250]) ->  | B250: of:=IF([.$T$2]="psiSkill";  IF([.E250]=0;"";[.E250]); [.E250]) ->  | C250: of:=IF([.A250]=[.B250];"" ;[.B250]) ->  | D250: of:=IF([.G250];MIN(OFFSET(INDIRECT( ADDRESS(1;1; 1; ;[.$T$2])); (ROW() -26) * 2 ;0;2;1));"") ->  | E250: of:=IF([.G250];MAX(OFFSET(INDIRECT( ADDRESS(1;1; 1; ;[.$T$2])); (ROW() -26) * 2  ;0;2;1));"") ->  | F250: of:=IF([.G250];IF([.$T$2]="psiSkill";INDIRECT( ADDRESS((ROW()-25);1; 1; ;"ImprovedPsiSkill"));"");"") ->  | G250: of:=IF( INDIRECT( ADDRESS((ROW()-25)*2-1;1; 1;;"TU"))=0; FALSE();TRUE()) -> false | H250: of:=IF([.$G250];[.H$26];"") ->  | I250: of:=IF([.$G250];[.I$26];"") -> 
A251: of:=IF([.$T$2]="psiSkill";  IF([.E251]=[.F251];[.B251];[.E251]-[.F251]); [.D251]) ->  | B251: of:=IF([.$T$2]="psiSkill";  IF([.E251]=0;"";[.E251]); [.E251]) ->  | C251: of:=IF([.A251]=[.B251];"" ;[.B251]) ->  | D251: of:=IF([.G251];MIN(OFFSET(INDIRECT( ADDRESS(1;1; 1; ;[.$T$2])); (ROW() -26) * 2 ;0;2;1));"") ->  | E251: of:=IF([.G251];MAX(OFFSET(INDIRECT( ADDRESS(1;1; 1; ;[.$T$2])); (ROW() -26) * 2  ;0;2;1));"") ->  | F251: of:=IF([.G251];IF([.$T$2]="psiSkill";INDIRECT( ADDRESS((ROW()-25);1; 1; ;"ImprovedPsiSkill"));"");"") ->  | G251: of:=IF( INDIRECT( ADDRESS((ROW()-25)*2-1;1; 1;;"TU"))=0; FALSE();TRUE()) -> false | H251: of:=IF([.$G251];[.H$26];"") ->  | I251: of:=IF([.$G251];[.I$26];"") -> 
A252: of:=IF([.$T$2]="psiSkill";  IF([.E252]=[.F252];[.B252];[.E252]-[.F252]); [.D252]) ->  | B252: of:=IF([.$T$2]="psiSkill";  IF([.E252]=0;"";[.E252]); [.E252]) ->  | C252: of:=IF([.A252]=[.B252];"" ;[.B252]) ->  | D252: of:=IF([.G252];MIN(OFFSET(INDIRECT( ADDRESS(1;1; 1; ;[.$T$2])); (ROW() -26) * 2 ;0;2;1));"") ->  | E252: of:=IF([.G252];MAX(OFFSET(INDIRECT( ADDRESS(1;1; 1; ;[.$T$2])); (ROW() -26) * 2  ;0;2;1));"") ->  | F252: of:=IF([.G252];IF([.$T$2]="psiSkill";INDIRECT( ADDRESS((ROW()-25);1; 1; ;"ImprovedPsiSkill"));"");"") ->  | G252: of:=IF( INDIRECT( ADDRESS((ROW()-25)*2-1;1; 1;;"TU"))=0; FALSE();TRUE()) -> false | H252: of:=IF([.$G252];[.H$26];"") ->  | I252: of:=IF([.$G252];[.I$26];"") -> 
A253: of:=IF([.$T$2]="psiSkill";  IF([.E253]=[.F253];[.B253];[.E253]-[.F253]); [.D253]) ->  | B253: of:=IF([.$T$2]="psiSkill";  IF([.E253]=0;"";[.E253]); [.E253]) ->  | C253: of:=IF([.A253]=[.B253];"" ;[.B253]) ->  | D253: of:=IF([.G253];MIN(OFFSET(INDIRECT( ADDRESS(1;1; 1; ;[.$T$2])); (ROW() -26) * 2 ;0;2;1));"") ->  | E253: of:=IF([.G253];MAX(OFFSET(INDIRECT( ADDRESS(1;1; 1; ;[.$T$2])); (ROW() -26) * 2  ;0;2;1));"") ->  | F253: of:=IF([.G253];IF([.$T$2]="psiSkill";INDIRECT( ADDRESS((ROW()-25);1; 1; ;"ImprovedPsiSkill"));"");"") ->  | G253: of:=IF( INDIRECT( ADDRESS((ROW()-25)*2-1;1; 1;;"TU"))=0; FALSE();TRUE()) -> false | H253: of:=IF([.$G253];[.H$26];"") ->  | I253: of:=IF([.$G253];[.I$26];"") -> 
A254: of:=IF([.$T$2]="psiSkill";  IF([.E254]=[.F254];[.B254];[.E254]-[.F254]); [.D254]) ->  | B254: of:=IF([.$T$2]="psiSkill";  IF([.E254]=0;"";[.E254]); [.E254]) ->  | C254: of:=IF([.A254]=[.B254];"" ;[.B254]) ->  | D254: of:=IF([.G254];MIN(OFFSET(INDIRECT( ADDRESS(1;1; 1; ;[.$T$2])); (ROW() -26) * 2 ;0;2;1));"") ->  | E254: of:=IF([.G254];MAX(OFFSET(INDIRECT( ADDRESS(1;1; 1; ;[.$T$2])); (ROW() -26) * 2  ;0;2;1));"") ->  | F254: of:=IF([.G254];IF([.$T$2]="psiSkill";INDIRECT( ADDRESS((ROW()-25);1; 1; ;"ImprovedPsiSkill"));"");"") ->  | G254: of:=IF( INDIRECT( ADDRESS((ROW()-25)*2-1;1; 1;;"TU"))=0; FALSE();TRUE()) -> false | H254: of:=IF([.$G254];[.H$26];"") ->  | I254: of:=IF([.$G254];[.I$26];"") -> 
A255: of:=IF([.$T$2]="psiSkill";  IF([.E255]=[.F255];[.B255];[.E255]-[.F255]); [.D255]) ->  | B255: of:=IF([.$T$2]="psiSkill";  IF([.E255]=0;"";[.E255]); [.E255]) ->  | C255: of:=IF([.A255]=[.B255];"" ;[.B255]) ->  | D255: of:=IF([.G255];MIN(OFFSET(INDIRECT( ADDRESS(1;1; 1; ;[.$T$2])); (ROW() -26) * 2 ;0;2;1));"") ->  | E255: of:=IF([.G255];MAX(OFFSET(INDIRECT( ADDRESS(1;1; 1; ;[.$T$2])); (ROW() -26) * 2  ;0;2;1));"") ->  | F255: of:=IF([.G255];IF([.$T$2]="psiSkill";INDIRECT( ADDRESS((ROW()-25);1; 1; ;"ImprovedPsiSkill"));"");"") ->  | G255: of:=IF( INDIRECT( ADDRESS((ROW()-25)*2-1;1; 1;;"TU"))=0; FALSE();TRUE()) -> false | H255: of:=IF([.$G255];[.H$26];"") ->  | I255: of:=IF([.$G255];[.I$26];"") -> 
A256: of:=IF([.$T$2]="psiSkill";  IF([.E256]=[.F256];[.B256];[.E256]-[.F256]); [.D256]) ->  | B256: of:=IF([.$T$2]="psiSkill";  IF([.E256]=0;"";[.E256]); [.E256]) ->  | C256: of:=IF([.A256]=[.B256];"" ;[.B256]) ->  | D256: of:=IF([.G256];MIN(OFFSET(INDIRECT( ADDRESS(1;1; 1; ;[.$T$2])); (ROW() -26) * 2 ;0;2;1));"") ->  | E256: of:=IF([.G256];MAX(OFFSET(INDIRECT( ADDRESS(1;1; 1; ;[.$T$2])); (ROW() -26) * 2  ;0;2;1));"") ->  | F256: of:=IF([.G256];IF([.$T$2]="psiSkill";INDIRECT( ADDRESS((ROW()-25);1; 1; ;"ImprovedPsiSkill"));"");"") ->  | G256: of:=IF( INDIRECT( ADDRESS((ROW()-25)*2-1;1; 1;;"TU"))=0; FALSE();TRUE()) -> false | H256: of:=IF([.$G256];[.H$26];"") ->  | I256: of:=IF([.$G256];[.I$26];"") -> 
A257: of:=IF([.$T$2]="psiSkill";  IF([.E257]=[.F257];[.B257];[.E257]-[.F257]); [.D257]) ->  | B257: of:=IF([.$T$2]="psiSkill";  IF([.E257]=0;"";[.E257]); [.E257]) ->  | C257: of:=IF([.A257]=[.B257];"" ;[.B257]) ->  | D257: of:=IF([.G257];MIN(OFFSET(INDIRECT( ADDRESS(1;1; 1; ;[.$T$2])); (ROW() -26) * 2 ;0;2;1));"") ->  | E257: of:=IF([.G257];MAX(OFFSET(INDIRECT( ADDRESS(1;1; 1; ;[.$T$2])); (ROW() -26) * 2  ;0;2;1));"") ->  | F257: of:=IF([.G257];IF([.$T$2]="psiSkill";INDIRECT( ADDRESS((ROW()-25);1; 1; ;"ImprovedPsiSkill"));"");"") ->  | G257: of:=IF( INDIRECT( ADDRESS((ROW()-25)*2-1;1; 1;;"TU"))=0; FALSE();TRUE()) -> false | H257: of:=IF([.$G257];[.H$26];"") ->  | I257: of:=IF([.$G257];[.I$26];"") -> 
A258: of:=IF([.$T$2]="psiSkill";  IF([.E258]=[.F258];[.B258];[.E258]-[.F258]); [.D258]) ->  | B258: of:=IF([.$T$2]="psiSkill";  IF([.E258]=0;"";[.E258]); [.E258]) ->  | C258: of:=IF([.A258]=[.B258];"" ;[.B258]) ->  | D258: of:=IF([.G258];MIN(OFFSET(INDIRECT( ADDRESS(1;1; 1; ;[.$T$2])); (ROW() -26) * 2 ;0;2;1));"") ->  | E258: of:=IF([.G258];MAX(OFFSET(INDIRECT( ADDRESS(1;1; 1; ;[.$T$2])); (ROW() -26) * 2  ;0;2;1));"") ->  | F258: of:=IF([.G258];IF([.$T$2]="psiSkill";INDIRECT( ADDRESS((ROW()-25);1; 1; ;"ImprovedPsiSkill"));"");"") ->  | G258: of:=IF( INDIRECT( ADDRESS((ROW()-25)*2-1;1; 1;;"TU"))=0; FALSE();TRUE()) -> false | H258: of:=IF([.$G258];[.H$26];"") ->  | I258: of:=IF([.$G258];[.I$26];"") -> 
A259: of:=IF([.$T$2]="psiSkill";  IF([.E259]=[.F259];[.B259];[.E259]-[.F259]); [.D259]) ->  | B259: of:=IF([.$T$2]="psiSkill";  IF([.E259]=0;"";[.E259]); [.E259]) ->  | C259: of:=IF([.A259]=[.B259];"" ;[.B259]) ->  | D259: of:=IF([.G259];MIN(OFFSET(INDIRECT( ADDRESS(1;1; 1; ;[.$T$2])); (ROW() -26) * 2 ;0;2;1));"") ->  | E259: of:=IF([.G259];MAX(OFFSET(INDIRECT( ADDRESS(1;1; 1; ;[.$T$2])); (ROW() -26) * 2  ;0;2;1));"") ->  | F259: of:=IF([.G259];IF([.$T$2]="psiSkill";INDIRECT( ADDRESS((ROW()-25);1; 1; ;"ImprovedPsiSkill"));"");"") ->  | G259: of:=IF( INDIRECT( ADDRESS((ROW()-25)*2-1;1; 1;;"TU"))=0; FALSE();TRUE()) -> false | H259: of:=IF([.$G259];[.H$26];"") ->  | I259: of:=IF([.$G259];[.I$26];"") -> 
A260: of:=IF([.$T$2]="psiSkill";  IF([.E260]=[.F260];[.B260];[.E260]-[.F260]); [.D260]) ->  | B260: of:=IF([.$T$2]="psiSkill";  IF([.E260]=0;"";[.E260]); [.E260]) ->  | C260: of:=IF([.A260]=[.B260];"" ;[.B260]) ->  | D260: of:=IF([.G260];MIN(OFFSET(INDIRECT( ADDRESS(1;1; 1; ;[.$T$2])); (ROW() -26) * 2 ;0;2;1));"") ->  | E260: of:=IF([.G260];MAX(OFFSET(INDIRECT( ADDRESS(1;1; 1; ;[.$T$2])); (ROW() -26) * 2  ;0;2;1));"") ->  | F260: of:=IF([.G260];IF([.$T$2]="psiSkill";INDIRECT( ADDRESS((ROW()-25);1; 1; ;"ImprovedPsiSkill"));"");"") ->  | G260: of:=IF( INDIRECT( ADDRESS((ROW()-25)*2-1;1; 1;;"TU"))=0; FALSE();TRUE()) -> false | H260: of:=IF([.$G260];[.H$26];"") ->  | I260: of:=IF([.$G260];[.I$26];"") -> 
A261: of:=IF([.$T$2]="psiSkill";  IF([.E261]=[.F261];[.B261];[.E261]-[.F261]); [.D261]) ->  | B261: of:=IF([.$T$2]="psiSkill";  IF([.E261]=0;"";[.E261]); [.E261]) ->  | C261: of:=IF([.A261]=[.B261];"" ;[.B261]) ->  | D261: of:=IF([.G261];MIN(OFFSET(INDIRECT( ADDRESS(1;1; 1; ;[.$T$2])); (ROW() -26) * 2 ;0;2;1));"") ->  | E261: of:=IF([.G261];MAX(OFFSET(INDIRECT( ADDRESS(1;1; 1; ;[.$T$2])); (ROW() -26) * 2  ;0;2;1));"") ->  | F261: of:=IF([.G261];IF([.$T$2]="psiSkill";INDIRECT( ADDRESS((ROW()-25);1; 1; ;"ImprovedPsiSkill"));"");"") ->  | G261: of:=IF( INDIRECT( ADDRESS((ROW()-25)*2-1;1; 1;;"TU"))=0; FALSE();TRUE()) -> false | H261: of:=IF([.$G261];[.H$26];"") ->  | I261: of:=IF([.$G261];[.I$26];"") -> 
A262: of:=IF([.$T$2]="psiSkill";  IF([.E262]=[.F262];[.B262];[.E262]-[.F262]); [.D262]) ->  | B262: of:=IF([.$T$2]="psiSkill";  IF([.E262]=0;"";[.E262]); [.E262]) ->  | C262: of:=IF([.A262]=[.B262];"" ;[.B262]) ->  | D262: of:=IF([.G262];MIN(OFFSET(INDIRECT( ADDRESS(1;1; 1; ;[.$T$2])); (ROW() -26) * 2 ;0;2;1));"") ->  | E262: of:=IF([.G262];MAX(OFFSET(INDIRECT( ADDRESS(1;1; 1; ;[.$T$2])); (ROW() -26) * 2  ;0;2;1));"") ->  | F262: of:=IF([.G262];IF([.$T$2]="psiSkill";INDIRECT( ADDRESS((ROW()-25);1; 1; ;"ImprovedPsiSkill"));"");"") ->  | G262: of:=IF( INDIRECT( ADDRESS((ROW()-25)*2-1;1; 1;;"TU"))=0; FALSE();TRUE()) -> false | H262: of:=IF([.$G262];[.H$26];"") ->  | I262: of:=IF([.$G262];[.I$26];"") -> 
A263: of:=IF([.$T$2]="psiSkill";  IF([.E263]=[.F263];[.B263];[.E263]-[.F263]); [.D263]) ->  | B263: of:=IF([.$T$2]="psiSkill";  IF([.E263]=0;"";[.E263]); [.E263]) ->  | C263: of:=IF([.A263]=[.B263];"" ;[.B263]) ->  | D263: of:=IF([.G263];MIN(OFFSET(INDIRECT( ADDRESS(1;1; 1; ;[.$T$2])); (ROW() -26) * 2 ;0;2;1));"") ->  | E263: of:=IF([.G263];MAX(OFFSET(INDIRECT( ADDRESS(1;1; 1; ;[.$T$2])); (ROW() -26) * 2  ;0;2;1));"") ->  | F263: of:=IF([.G263];IF([.$T$2]="psiSkill";INDIRECT( ADDRESS((ROW()-25);1; 1; ;"ImprovedPsiSkill"));"");"") ->  | G263: of:=IF( INDIRECT( ADDRESS((ROW()-25)*2-1;1; 1;;"TU"))=0; FALSE();TRUE()) -> false | H263: of:=IF([.$G263];[.H$26];"") ->  | I263: of:=IF([.$G263];[.I$26];"") -> 
A264: of:=IF([.$T$2]="psiSkill";  IF([.E264]=[.F264];[.B264];[.E264]-[.F264]); [.D264]) ->  | B264: of:=IF([.$T$2]="psiSkill";  IF([.E264]=0;"";[.E264]); [.E264]) ->  | C264: of:=IF([.A264]=[.B264];"" ;[.B264]) ->  | D264: of:=IF([.G264];MIN(OFFSET(INDIRECT( ADDRESS(1;1; 1; ;[.$T$2])); (ROW() -26) * 2 ;0;2;1));"") ->  | E264: of:=IF([.G264];MAX(OFFSET(INDIRECT( ADDRESS(1;1; 1; ;[.$T$2])); (ROW() -26) * 2  ;0;2;1));"") ->  | F264: of:=IF([.G264];IF([.$T$2]="psiSkill";INDIRECT( ADDRESS((ROW()-25);1; 1; ;"ImprovedPsiSkill"));"");"") ->  | G264: of:=IF( INDIRECT( ADDRESS((ROW()-25)*2-1;1; 1;;"TU"))=0; FALSE();TRUE()) -> false | H264: of:=IF([.$G264];[.H$26];"") ->  | I264: of:=IF([.$G264];[.I$26];"") -> 
A265: of:=IF([.$T$2]="psiSkill";  IF([.E265]=[.F265];[.B265];[.E265]-[.F265]); [.D265]) ->  | B265: of:=IF([.$T$2]="psiSkill";  IF([.E265]=0;"";[.E265]); [.E265]) ->  | C265: of:=IF([.A265]=[.B265];"" ;[.B265]) ->  | D265: of:=IF([.G265];MIN(OFFSET(INDIRECT( ADDRESS(1;1; 1; ;[.$T$2])); (ROW() -26) * 2 ;0;2;1));"") ->  | E265: of:=IF([.G265];MAX(OFFSET(INDIRECT( ADDRESS(1;1; 1; ;[.$T$2])); (ROW() -26) * 2  ;0;2;1));"") ->  | F265: of:=IF([.G265];IF([.$T$2]="psiSkill";INDIRECT( ADDRESS((ROW()-25);1; 1; ;"ImprovedPsiSkill"));"");"") ->  | G265: of:=IF( INDIRECT( ADDRESS((ROW()-25)*2-1;1; 1;;"TU"))=0; FALSE();TRUE()) -> false | H265: of:=IF([.$G265];[.H$26];"") ->  | I265: of:=IF([.$G265];[.I$26];"") -> 
A266: of:=IF([.$T$2]="psiSkill";  IF([.E266]=[.F266];[.B266];[.E266]-[.F266]); [.D266]) ->  | B266: of:=IF([.$T$2]="psiSkill";  IF([.E266]=0;"";[.E266]); [.E266]) ->  | C266: of:=IF([.A266]=[.B266];"" ;[.B266]) ->  | D266: of:=IF([.G266];MIN(OFFSET(INDIRECT( ADDRESS(1;1; 1; ;[.$T$2])); (ROW() -26) * 2 ;0;2;1));"") ->  | E266: of:=IF([.G266];MAX(OFFSET(INDIRECT( ADDRESS(1;1; 1; ;[.$T$2])); (ROW() -26) * 2  ;0;2;1));"") ->  | F266: of:=IF([.G266];IF([.$T$2]="psiSkill";INDIRECT( ADDRESS((ROW()-25);1; 1; ;"ImprovedPsiSkill"));"");"") ->  | G266: of:=IF( INDIRECT( ADDRESS((ROW()-25)*2-1;1; 1;;"TU"))=0; FALSE();TRUE()) -> false | H266: of:=IF([.$G266];[.H$26];"") ->  | I266: of:=IF([.$G266];[.I$26];"") -> 
A267: of:=IF([.$T$2]="psiSkill";  IF([.E267]=[.F267];[.B267];[.E267]-[.F267]); [.D267]) ->  | B267: of:=IF([.$T$2]="psiSkill";  IF([.E267]=0;"";[.E267]); [.E267]) ->  | C267: of:=IF([.A267]=[.B267];"" ;[.B267]) ->  | D267: of:=IF([.G267];MIN(OFFSET(INDIRECT( ADDRESS(1;1; 1; ;[.$T$2])); (ROW() -26) * 2 ;0;2;1));"") ->  | E267: of:=IF([.G267];MAX(OFFSET(INDIRECT( ADDRESS(1;1; 1; ;[.$T$2])); (ROW() -26) * 2  ;0;2;1));"") ->  | F267: of:=IF([.G267];IF([.$T$2]="psiSkill";INDIRECT( ADDRESS((ROW()-25);1; 1; ;"ImprovedPsiSkill"));"");"") ->  | G267: of:=IF( INDIRECT( ADDRESS((ROW()-25)*2-1;1; 1;;"TU"))=0; FALSE();TRUE()) -> false | H267: of:=IF([.$G267];[.H$26];"") ->  | I267: of:=IF([.$G267];[.I$26];"") -> 
A268: of:=IF([.$T$2]="psiSkill";  IF([.E268]=[.F268];[.B268];[.E268]-[.F268]); [.D268]) ->  | B268: of:=IF([.$T$2]="psiSkill";  IF([.E268]=0;"";[.E268]); [.E268]) ->  | C268: of:=IF([.A268]=[.B268];"" ;[.B268]) ->  | D268: of:=IF([.G268];MIN(OFFSET(INDIRECT( ADDRESS(1;1; 1; ;[.$T$2])); (ROW() -26) * 2 ;0;2;1));"") ->  | E268: of:=IF([.G268];MAX(OFFSET(INDIRECT( ADDRESS(1;1; 1; ;[.$T$2])); (ROW() -26) * 2  ;0;2;1));"") ->  | F268: of:=IF([.G268];IF([.$T$2]="psiSkill";INDIRECT( ADDRESS((ROW()-25);1; 1; ;"ImprovedPsiSkill"));"");"") ->  | G268: of:=IF( INDIRECT( ADDRESS((ROW()-25)*2-1;1; 1;;"TU"))=0; FALSE();TRUE()) -> false | H268: of:=IF([.$G268];[.H$26];"") ->  | I268: of:=IF([.$G268];[.I$26];"") -> 
A269: of:=IF([.$T$2]="psiSkill";  IF([.E269]=[.F269];[.B269];[.E269]-[.F269]); [.D269]) ->  | B269: of:=IF([.$T$2]="psiSkill";  IF([.E269]=0;"";[.E269]); [.E269]) ->  | C269: of:=IF([.A269]=[.B269];"" ;[.B269]) ->  | D269: of:=IF([.G269];MIN(OFFSET(INDIRECT( ADDRESS(1;1; 1; ;[.$T$2])); (ROW() -26) * 2 ;0;2;1));"") ->  | E269: of:=IF([.G269];MAX(OFFSET(INDIRECT( ADDRESS(1;1; 1; ;[.$T$2])); (ROW() -26) * 2  ;0;2;1));"") ->  | F269: of:=IF([.G269];IF([.$T$2]="psiSkill";INDIRECT( ADDRESS((ROW()-25);1; 1; ;"ImprovedPsiSkill"));"");"") ->  | G269: of:=IF( INDIRECT( ADDRESS((ROW()-25)*2-1;1; 1;;"TU"))=0; FALSE();TRUE()) -> false | H269: of:=IF([.$G269];[.H$26];"") ->  | I269: of:=IF([.$G269];[.I$26];"") -> 
A270: of:=IF([.$T$2]="psiSkill";  IF([.E270]=[.F270];[.B270];[.E270]-[.F270]); [.D270]) ->  | B270: of:=IF([.$T$2]="psiSkill";  IF([.E270]=0;"";[.E270]); [.E270]) ->  | C270: of:=IF([.A270]=[.B270];"" ;[.B270]) ->  | D270: of:=IF([.G270];MIN(OFFSET(INDIRECT( ADDRESS(1;1; 1; ;[.$T$2])); (ROW() -26) * 2 ;0;2;1));"") ->  | E270: of:=IF([.G270];MAX(OFFSET(INDIRECT( ADDRESS(1;1; 1; ;[.$T$2])); (ROW() -26) * 2  ;0;2;1));"") ->  | F270: of:=IF([.G270];IF([.$T$2]="psiSkill";INDIRECT( ADDRESS((ROW()-25);1; 1; ;"ImprovedPsiSkill"));"");"") ->  | G270: of:=IF( INDIRECT( ADDRESS((ROW()-25)*2-1;1; 1;;"TU"))=0; FALSE();TRUE()) -> false | H270: of:=IF([.$G270];[.H$26];"") ->  | I270: of:=IF([.$G270];[.I$26];"") -> 
A271: of:=IF([.$T$2]="psiSkill";  IF([.E271]=[.F271];[.B271];[.E271]-[.F271]); [.D271]) ->  | B271: of:=IF([.$T$2]="psiSkill";  IF([.E271]=0;"";[.E271]); [.E271]) ->  | C271: of:=IF([.A271]=[.B271];"" ;[.B271]) ->  | D271: of:=IF([.G271];MIN(OFFSET(INDIRECT( ADDRESS(1;1; 1; ;[.$T$2])); (ROW() -26) * 2 ;0;2;1));"") ->  | E271: of:=IF([.G271];MAX(OFFSET(INDIRECT( ADDRESS(1;1; 1; ;[.$T$2])); (ROW() -26) * 2  ;0;2;1));"") ->  | F271: of:=IF([.G271];IF([.$T$2]="psiSkill";INDIRECT( ADDRESS((ROW()-25);1; 1; ;"ImprovedPsiSkill"));"");"") ->  | G271: of:=IF( INDIRECT( ADDRESS((ROW()-25)*2-1;1; 1;;"TU"))=0; FALSE();TRUE()) -> false | H271: of:=IF([.$G271];[.H$26];"") ->  | I271: of:=IF([.$G271];[.I$26];"") -> 
A272: of:=IF([.$T$2]="psiSkill";  IF([.E272]=[.F272];[.B272];[.E272]-[.F272]); [.D272]) ->  | B272: of:=IF([.$T$2]="psiSkill";  IF([.E272]=0;"";[.E272]); [.E272]) ->  | C272: of:=IF([.A272]=[.B272];"" ;[.B272]) ->  | D272: of:=IF([.G272];MIN(OFFSET(INDIRECT( ADDRESS(1;1; 1; ;[.$T$2])); (ROW() -26) * 2 ;0;2;1));"") ->  | E272: of:=IF([.G272];MAX(OFFSET(INDIRECT( ADDRESS(1;1; 1; ;[.$T$2])); (ROW() -26) * 2  ;0;2;1));"") ->  | F272: of:=IF([.G272];IF([.$T$2]="psiSkill";INDIRECT( ADDRESS((ROW()-25);1; 1; ;"ImprovedPsiSkill"));"");"") ->  | G272: of:=IF( INDIRECT( ADDRESS((ROW()-25)*2-1;1; 1;;"TU"))=0; FALSE();TRUE()) -> false | H272: of:=IF([.$G272];[.H$26];"") ->  | I272: of:=IF([.$G272];[.I$26];"") -> 
A273: of:=IF([.$T$2]="psiSkill";  IF([.E273]=[.F273];[.B273];[.E273]-[.F273]); [.D273]) ->  | B273: of:=IF([.$T$2]="psiSkill";  IF([.E273]=0;"";[.E273]); [.E273]) ->  | C273: of:=IF([.A273]=[.B273];"" ;[.B273]) ->  | D273: of:=IF([.G273];MIN(OFFSET(INDIRECT( ADDRESS(1;1; 1; ;[.$T$2])); (ROW() -26) * 2 ;0;2;1));"") ->  | E273: of:=IF([.G273];MAX(OFFSET(INDIRECT( ADDRESS(1;1; 1; ;[.$T$2])); (ROW() -26) * 2  ;0;2;1));"") ->  | F273: of:=IF([.G273];IF([.$T$2]="psiSkill";INDIRECT( ADDRESS((ROW()-25);1; 1; ;"ImprovedPsiSkill"));"");"") ->  | G273: of:=IF( INDIRECT( ADDRESS((ROW()-25)*2-1;1; 1;;"TU"))=0; FALSE();TRUE()) -> false | H273: of:=IF([.$G273];[.H$26];"") ->  | I273: of:=IF([.$G273];[.I$26];"") -> 
A274: of:=IF([.$T$2]="psiSkill";  IF([.E274]=[.F274];[.B274];[.E274]-[.F274]); [.D274]) ->  | B274: of:=IF([.$T$2]="psiSkill";  IF([.E274]=0;"";[.E274]); [.E274]) ->  | C274: of:=IF([.A274]=[.B274];"" ;[.B274]) ->  | D274: of:=IF([.G274];MIN(OFFSET(INDIRECT( ADDRESS(1;1; 1; ;[.$T$2])); (ROW() -26) * 2 ;0;2;1));"") ->  | E274: of:=IF([.G274];MAX(OFFSET(INDIRECT( ADDRESS(1;1; 1; ;[.$T$2])); (ROW() -26) * 2  ;0;2;1));"") ->  | F274: of:=IF([.G274];IF([.$T$2]="psiSkill";INDIRECT( ADDRESS((ROW()-25);1; 1; ;"ImprovedPsiSkill"));"");"") ->  | G274: of:=IF( INDIRECT( ADDRESS((ROW()-25)*2-1;1; 1;;"TU"))=0; FALSE();TRUE()) -> false | H274: of:=IF([.$G274];[.H$26];"") ->  | I274: of:=IF([.$G274];[.I$26];"") -> 
A275: of:=IF([.$T$2]="psiSkill";  IF([.E275]=[.F275];[.B275];[.E275]-[.F275]); [.D275]) ->  | B275: of:=IF([.$T$2]="psiSkill";  IF([.E275]=0;"";[.E275]); [.E275]) ->  | C275: of:=IF([.A275]=[.B275];"" ;[.B275]) ->  | D275: of:=IF([.G275];MIN(OFFSET(INDIRECT( ADDRESS(1;1; 1; ;[.$T$2])); (ROW() -26) * 2 ;0;2;1));"") ->  | E275: of:=IF([.G275];MAX(OFFSET(INDIRECT( ADDRESS(1;1; 1; ;[.$T$2])); (ROW() -26) * 2  ;0;2;1));"") ->  | F275: of:=IF([.G275];IF([.$T$2]="psiSkill";INDIRECT( ADDRESS((ROW()-25);1; 1; ;"ImprovedPsiSkill"));"");"") ->  | G275: of:=IF( INDIRECT( ADDRESS((ROW()-25)*2-1;1; 1;;"TU"))=0; FALSE();TRUE()) -> false | H275: of:=IF([.$G275];[.H$26];"") ->  | I275: of:=IF([.$G275];[.I$26];"") -> 

Sheet: TU
A1: 55
A2: 55
A3: 62
A4: 60
A5: 58
A6: 58
A7: 60
A8: 60
A9: 59
A10: 59
A11: 58
A12: 58
A13: 50
A14: 50
A15: 52
A16: 52
A17: 50
A18: 50
A19: 57
A20: 57
A21: 60
A22: 60
A23: 52
A24: 52
A25: 54
A26: 54
A27: 59
A28: 59
A29: 53
A30: 53
A31: 60
A32: 62
A33: 55
A34: 59
A35: 52
A36: 53
A37: 59
A38: 58
A39: 50
A40: 56
A41: 58
A42: 60
A43: 53
A44: 54
A45: 59
A46: 57
A47: 62
A48: 59
A49: 58
A50: 58
A51: 59
A52: 58
A53: 52
A54: 63
A55: 64
A56: 57
A57: 51
A58: 57
A59: 53
A60: 63
A61: 51
A62: 51
A63: 58
A64: 58
A65: 59
A66: 59
A67: 52
A68: 52
A69: 56
A70: 56
A71: 56
A72: 56
A73: 58
A74: 58
A75: 54
A76: 54
A77: 54
A78: 54
A79: 59
A80: 59
A81: 57
A82: 59
A83: 51
A84: 51
A85: 57
A86: 59
A87: 52
A88: 54
A89: 52
A90: 57
A91: 50
A92: 55
A93: 53
A94: 53
A95: 51
A96: 58
A97: 59
A98: 59
A99: 58
A100: 59
A101: 57
A102: 55
A103: 64
A104: 54
A105: 53
A106: 62
A107: 50
A108: 64
A109: 52
A110: 52
A111: 51
A112: 51
A113: 60
A114: 60
A115: 52
A116: 52
A117: 56
A118: 56
A119: 52
A120: 52
A121: 54
A122: 54
A123: 60
A124: 60
A125: 58
A126: 58
A127: 55
A128: 55
A129: 59
A130: 59
A131: 55
A132: 55
A133: 55
A134: 55
A135: 58
A136: 58
A137: 59
A138: 63
A139: 60
A140: 65
A141: 60
A142: 63
A143: 56
A144: 56
A145: 59
A146: 59
A147: 50
A148: 61
A149: 56
A150: 65
A151: 52
A152: 52
A153: 53
A154: 53
A155: 50
A156: 50
A157: 50
A158: 50
A159: 55
A160: 55
A161: 52
A162: 54
A163: 53
A164: 53
A165: 56
A166: 59
A167: 50
A168: 55
A169: 59
A170: 59
A171: 52
A172: 52
A173: 55
A174: 55
A175: 58
A176: 58
A177: 55
A178: 56
A179: 56
A180: 56
A181: 56
A182: 56
A183: 59
A184: 59
A185: 58
A186: 62
A187: 55
A188: 59
A189: 52
A190: 57
A191: 56
A192: 56
A193: 60
A194: 60
A195: 58
A196: 58
A197: 57
A198: 57
A199: 59
A200: 59
A201: 59
A202: 59
A203: 60
A204: 60
A205: 55
A206: 55
A207: 59
A208: 59
A209: 59
A210: 59
A211: 55
A212: 57
A213: 59
A214: 59
A215: 58
A216: 58
A217: 54
A218: 56
A219: 52
A220: 52
A221: 50
A222: 50
A223: 56
A224: 56
A225: 60
A226: 60
A227: 52
A228: 52
A229: 52
A230: 52
A231: 53
A232: 53
A233: 60
A234: 62
A235: 53
A236: 70
A237: 57
A238: 58
A239: 52
A240: 52
A241: 58
A242: 58
A243: 59
A244: 59
A245: 52
A246: 54
A247: 59
A248: 59
A249: 58
A250: 62
A251: 59
A252: 63
A253: 56
A254: 58
A255: 52
A256: 52
A257: 55
A258: 55
A259: 55
A260: 55
A261: 51
A262: 51
A263: 57
A264: 59
A265: 55
A266: 55

Sheet: stamina
A1: 58
A2: 59
A3: 53
A4: 48
A5: 55
A6: 55
A7: 49
A8: 49
A9: 44
A10: 44
A11: 52
A12: 52
A13: 65
A14: 65
A15: 48
A16: 48
A17: 65
A18: 65
A19: 61
A20: 61
A21: 48
A22: 48
A23: 49
A24: 49
A25: 70
A26: 70
A27: 56
A28: 56
A29: 54
A30: 54
A31: 42
A32: 45
A33: 40
A34: 41
A35: 42
A36: 50
A37: 61
A38: 61
A39: 47
A40: 63
A41: 51
A42: 60
A43: 42
A44: 53
A45: 62
A46: 55
A47: 53
A48: 50
A49: 67
A50: 67
A51: 48
A52: 45
A53: 51
A54: 69
A55: 68
A56: 45
A57: 53
A58: 59
A59: 60
A60: 76
A61: 47
A62: 47
A63: 65
A64: 65
A65: 55
A66: 55
A67: 47
A68: 47
A69: 40
A70: 40
A71: 47
A72: 47
A73: 50
A74: 50
A75: 68
A76: 68
A77: 44
A78: 44
A79: 45
A80: 49
A81: 41
A82: 46
A83: 66
A84: 63
A85: 59
A86: 67
A87: 42
A88: 49
A89: 53
A90: 66
A91: 64
A92: 73
A93: 56
A94: 53
A95: 54
A96: 62
A97: 68
A98: 72
A99: 40
A100: 47
A101: 58
A102: 53
A103: 54
A104: 42
A105: 62
A106: 78
A107: 59
A108: 74
A109: 64
A110: 64
A111: 50
A112: 50
A113: 41
A114: 41
A115: 70
A116: 70
A117: 42
A118: 42
A119: 69
A120: 69
A121: 62
A122: 62
A123: 51
A124: 51
A125: 65
A126: 65
A127: 64
A128: 64
A129: 58
A130: 58
A131: 60
A132: 60
A133: 61
A134: 61
A135: 40
A136: 40
A137: 50
A138: 55
A139: 45
A140: 58
A141: 44
A142: 53
A143: 56
A144: 56
A145: 54
A146: 54
A147: 51
A148: 61
A149: 66
A150: 75
A151: 62
A152: 63
A153: 49
A154: 49
A155: 59
A156: 59
A157: 67
A158: 67
A159: 54
A160: 54
A161: 57
A162: 62
A163: 56
A164: 56
A165: 57
A166: 57
A167: 65
A168: 68
A169: 50
A170: 50
A171: 54
A172: 54
A173: 54
A174: 54
A175: 65
A176: 65
A177: 45
A178: 50
A179: 59
A180: 59
A181: 47
A182: 47
A183: 42
A184: 46
A185: 54
A186: 56
A187: 53
A188: 57
A189: 44
A190: 57
A191: 42
A192: 42
A193: 65
A194: 65
A195: 65
A196: 65
A197: 54
A198: 54
A199: 52
A200: 52
A201: 56
A202: 56
A203: 54
A204: 54
A205: 42
A206: 42
A207: 70
A208: 70
A209: 47
A210: 47
A211: 42
A212: 53
A213: 41
A214: 41
A215: 59
A216: 59
A217: 57
A218: 57
A219: 61
A220: 61
A221: 70
A222: 70
A223: 60
A224: 60
A225: 68
A226: 68
A227: 57
A228: 57
A229: 58
A230: 58
A231: 58
A232: 59
A233: 50
A234: 52
A235: 64
A236: 83
A237: 56
A238: 57
A239: 69
A240: 69
A241: 41
A242: 41
A243: 42
A244: 42
A245: 41
A246: 41
A247: 50
A248: 50
A249: 41
A250: 45
A251: 59
A252: 64
A253: 61
A254: 65
A255: 47
A256: 47
A257: 42
A258: 42
A259: 52
A260: 52
A261: 64
A262: 64
A263: 56
A264: 61
A265: 57
A266: 57

Sheet: health
A1: 26
A2: 28
A3: 37
A4: 34
A5: 30
A6: 30
A7: 32
A8: 32
A9: 25
A10: 25
A11: 40
A12: 40
A13: 39
A14: 39
A15: 25
A16: 25
A17: 38
A18: 38
A19: 36
A20: 36
A21: 34
A22: 34
A23: 25
A24: 25
A25: 30
A26: 30
A27: 40
A28: 40
A29: 38
A30: 38
A31: 31
A32: 32
A33: 29
A34: 35
A35: 35
A36: 41
A37: 31
A38: 29
A39: 38
A40: 40
A41: 32
A42: 37
A43: 39
A44: 39
A45: 42
A46: 39
A47: 31
A48: 30
A49: 29
A50: 34
A51: 39
A52: 37
A53: 38
A54: 53
A55: 41
A56: 29
A57: 39
A58: 43
A59: 30
A60: 47
A61: 32
A62: 32
A63: 25
A64: 25
A65: 34
A66: 34
A67: 35
A68: 35
A69: 26
A70: 26
A71: 35
A72: 35
A73: 40
A74: 40
A75: 30
A76: 30
A77: 37
A78: 37
A79: 29
A80: 32
A81: 33
A82: 37
A83: 35
A84: 30
A85: 35
A86: 40
A87: 30
A88: 35
A89: 34
A90: 37
A91: 25
A92: 34
A93: 40
A94: 40
A95: 39
A96: 45
A97: 33
A98: 39
A99: 32
A100: 35
A101: 42
A102: 38
A103: 34
A104: 25
A105: 36
A106: 47
A107: 32
A108: 37
A109: 33
A110: 33
A111: 35
A112: 35
A113: 37
A114: 37
A115: 35
A116: 35
A117: 39
A118: 39
A119: 27
A120: 27
A121: 30
A122: 30
A123: 31
A124: 31
A125: 34
A126: 34
A127: 38
A128: 38
A129: 35
A130: 35
A131: 27
A132: 27
A133: 33
A134: 33
A135: 26
A136: 26
A137: 25
A138: 28
A139: 37
A140: 42
A141: 28
A142: 31
A143: 29
A144: 34
A145: 38
A146: 38
A147: 29
A148: 38
A149: 26
A150: 36
A151: 34
A152: 37
A153: 27
A154: 27
A155: 25
A156: 25
A157: 26
A158: 26
A159: 35
A160: 35
A161: 35
A162: 42
A163: 31
A164: 31
A165: 26
A166: 31
A167: 32
A168: 32
A169: 39
A170: 39
A171: 33
A172: 33
A173: 39
A174: 39
A175: 30
A176: 30
A177: 40
A178: 41
A179: 36
A180: 36
A181: 28
A182: 28
A183: 31
A184: 32
A185: 38
A186: 45
A187: 25
A188: 30
A189: 39
A190: 45
A191: 37
A192: 37
A193: 35
A194: 35
A195: 33
A196: 33
A197: 32
A198: 32
A199: 30
A200: 30
A201: 37
A202: 37
A203: 40
A204: 40
A205: 26
A206: 26
A207: 39
A208: 39
A209: 39
A210: 39
A211: 36
A212: 40
A213: 32
A214: 32
A215: 31
A216: 31
A217: 39
A218: 39
A219: 29
A220: 29
A221: 35
A222: 35
A223: 29
A224: 29
A225: 31
A226: 31
A227: 29
A228: 29
A229: 33
A230: 33
A231: 28
A232: 32
A233: 30
A234: 33
A235: 34
A236: 48
A237: 32
A238: 35
A239: 37
A240: 37
A241: 37
A242: 37
A243: 40
A244: 40
A245: 32
A246: 32
A247: 27
A248: 27
A249: 39
A250: 41
A251: 37
A252: 39
A253: 26
A254: 29
A255: 35
A256: 35
A257: 40
A258: 40
A259: 40
A260: 40
A261: 28
A262: 28
A263: 38
A264: 40
A265: 35
A266: 35

Sheet: bravery
A1: 10
A2: 10
A3: 30
A4: 30
A5: 60
A6: 60
A7: 30
A8: 30
A9: 40
A10: 40
A11: 50
A12: 50
A13: 60
A14: 60
A15: 10
A16: 10
A17: 10
A18: 10
A19: 10
A20: 10
A21: 60
A22: 60
A23: 50
A24: 50
A25: 50
A26: 50
A27: 20
A28: 20
A29: 50
A30: 50
A31: 20
A32: 20
A33: 40
A34: 40
A35: 40
A36: 40
A37: 40
A38: 40
A39: 10
A40: 10
A41: 30
A42: 30
A43: 40
A44: 40
A45: 50
A46: 50
A47: 60
A48: 60
A49: 30
A50: 30
A51: 10
A52: 10
A53: 30
A54: 30
A55: 10
A56: 10
A57: 60
A58: 60
A59: 40
A60: 40
A61: 40
A62: 40
A63: 60
A64: 60
A65: 30
A66: 30
A67: 10
A68: 10
A69: 60
A70: 60
A71: 50
A72: 50
A73: 30
A74: 30
A75: 60
A76: 60
A77: 40
A78: 40
A79: 10
A80: 10
A81: 10
A82: 10
A83: 40
A84: 40
A85: 30
A86: 30
A87: 50
A88: 50
A89: 30
A90: 40
A91: 50
A92: 50
A93: 60
A94: 60
A95: 40
A96: 50
A97: 20
A98: 20
A99: 60
A100: 60
A101: 40
A102: 40
A103: 50
A104: 50
A105: 50
A106: 50
A107: 40
A108: 40
A109: 60
A110: 60
A111: 30
A112: 30
A113: 40
A114: 40
A115: 60
A116: 60
A117: 40
A118: 40
A119: 20
A120: 20
A121: 60
A122: 60
A123: 30
A124: 30
A125: 20
A126: 20
A127: 40
A128: 40
A129: 60
A130: 60
A131: 30
A132: 30
A133: 60
A134: 60
A135: 60
A136: 60
A137: 10
A138: 10
A139: 20
A140: 20
A141: 50
A142: 50
A143: 50
A144: 50
A145: 60
A146: 60
A147: 20
A148: 20
A149: 40
A150: 40
A151: 20
A152: 20
A153: 50
A154: 50
A155: 60
A156: 60
A157: 20
A158: 20
A159: 30
A160: 30
A161: 30
A162: 30
A163: 30
A164: 30
A165: 60
A166: 60
A167: 50
A168: 50
A169: 10
A170: 10
A171: 40
A172: 40
A173: 10
A174: 10
A175: 20
A176: 20
A177: 30
A178: 30
A179: 40
A180: 40
A181: 40
A182: 40
A183: 50
A184: 50
A185: 30
A186: 30
A187: 30
A188: 30
A189: 30
A190: 30
A191: 10
A192: 10
A193: 20
A194: 20
A195: 10
A196: 10
A197: 10
A198: 10
A199: 30
A200: 30
A201: 10
A202: 10
A203: 30
A204: 30
A205: 20
A206: 20
A207: 40
A208: 40
A209: 50
A210: 50
A211: 40
A212: 40
A213: 20
A214: 20
A215: 60
A216: 60
A217: 20
A218: 20
A219: 10
A220: 10
A221: 30
A222: 30
A223: 20
A224: 20
A225: 60
A226: 60
A227: 10
A228: 10
A229: 50
A230: 50
A231: 50
A232: 50
A233: 20
A234: 20
A235: 40
A236: 40
A237: 20
A238: 20
A239: 20
A240: 20
A241: 20
A242: 20
A243: 20
A244: 20
A245: 40
A246: 40
A247: 20
A248: 20
A249: 10
A250: 10
A251: 10
A252: 10
A253: 30
A254: 30
A255: 60
A256: 60
A257: 50
A258: 50
A259: 40
A260: 40
A261: 20
A262: 20
A263: 60
A264: 60
A265: 50
A266: 50

Sheet: reactions
A1: 36
A2: 36
A3: 39
A4: 39
A5: 50
A6: 50
A7: 60
A8: 60
A9: 51
A10: 51
A11: 48
A12: 48
A13: 47
A14: 47
A15: 56
A16: 56
A17: 33
A18: 33
A19: 54
A20: 54
A21: 38
A22: 38
A23: 49
A24: 49
A25: 41
A26: 41
A27: 52
A28: 52
A29: 49
A30: 49
A31: 51
A32: 51
A33: 45
A34: 45
A35: 42
A36: 42
A37: 55
A38: 55
A39: 54
A40: 54
A41: 30
A42: 30
A43: 35
A44: 35
A45: 58
A46: 58
A47: 44
A48: 44
A49: 45
A50: 45
A51: 47
A52: 47
A53: 32
A54: 32
A55: 52
A56: 51
A57: 59
A58: 59
A59: 40
A60: 40
A61: 46
A62: 46
A63: 36
A64: 36
A65: 59
A66: 59
A67: 49
A68: 49
A69: 45
A70: 45
A71: 52
A72: 52
A73: 39
A74: 39
A75: 40
A76: 40
A77: 56
A78: 56
A79: 48
A80: 48
A81: 32
A82: 32
A83: 45
A84: 45
A85: 60
A86: 60
A87: 30
A88: 30
A89: 36
A90: 36
A91: 46
A92: 46
A93: 55
A94: 55
A95: 36
A96: 36
A97: 32
A98: 32
A99: 31
A100: 31
A101: 31
A102: 31
A103: 60
A104: 60
A105: 54
A106: 54
A107: 43
A108: 43
A109: 40
A110: 40
A111: 43
A112: 43
A113: 35
A114: 35
A115: 32
A116: 32
A117: 51
A118: 51
A119: 45
A120: 45
A121: 32
A122: 32
A123: 54
A124: 54
A125: 58
A126: 58
A127: 42
A128: 42
A129: 50
A130: 50
A131: 46
A132: 46
A133: 39
A134: 39
A135: 30
A136: 30
A137: 48
A138: 48
A139: 59
A140: 59
A141: 40
A142: 40
A143: 38
A144: 38
A145: 48
A146: 48
A147: 31
A148: 31
A149: 37
A150: 37
A151: 32
A152: 32
A153: 34
A154: 34
A155: 34
A156: 34
A157: 50
A158: 50
A159: 37
A160: 37
A161: 44
A162: 44
A163: 40
A164: 40
A165: 54
A166: 54
A167: 58
A168: 58
A169: 45
A170: 45
A171: 35
A172: 35
A173: 31
A174: 31
A175: 56
A176: 56
A177: 37
A178: 37
A179: 34
A180: 34
A181: 47
A182: 47
A183: 49
A184: 49
A185: 48
A186: 48
A187: 57
A188: 57
A189: 33
A190: 33
A191: 55
A192: 55
A193: 54
A194: 54
A195: 30
A196: 30
A197: 53
A198: 53
A199: 47
A200: 47
A201: 41
A202: 41
A203: 45
A204: 45
A205: 45
A206: 45
A207: 55
A208: 55
A209: 57
A210: 57
A211: 39
A212: 39
A213: 44
A214: 44
A215: 30
A216: 30
A217: 38
A218: 38
A219: 52
A220: 52
A221: 55
A222: 55
A223: 58
A224: 58
A225: 60
A226: 60
A227: 47
A228: 47
A229: 46
A230: 46
A231: 53
A232: 53
A233: 34
A234: 34
A235: 44
A236: 44
A237: 34
A238: 34
A239: 34
A240: 34
A241: 58
A242: 58
A243: 40
A244: 40
A245: 52
A246: 52
A247: 50
A248: 50
A249: 42
A250: 42
A251: 43
A252: 43
A253: 49
A254: 49
A255: 30
A256: 30
A257: 59
A258: 59
A259: 36
A260: 36
A261: 36
A262: 36
A263: 48
A264: 48
A265: 38
A266: 38

Sheet: firing
A1: 51
A2: 52
A3: 40
A4: 40
A5: 65
A6: 65
A7: 70
A8: 70
A9: 54
A10: 54
A11: 49
A12: 49
A13: 60
A14: 60
A15: 69
A16: 69
A17: 67
A18: 67
A19: 58
A20: 58
A21: 61
A22: 61
A23: 43
A24: 43
A25: 60
A26: 60
A27: 58
A28: 58
A29: 53
A30: 53
A31: 40
A32: 42
A33: 57
A34: 63
A35: 49
A36: 57
A37: 51
A38: 47
A39: 52
A40: 54
A41: 48
A42: 51
A43: 61
A44: 66
A45: 70
A46: 68
A47: 63
A48: 61
A49: 56
A50: 56
A51: 67
A52: 65
A53: 41
A54: 52
A55: 79
A56: 66
A57: 70
A58: 72
A59: 55
A60: 59
A61: 55
A62: 55
A63: 61
A64: 61
A65: 68
A66: 68
A67: 54
A68: 54
A69: 50
A70: 50
A71: 42
A72: 42
A73: 58
A74: 58
A75: 53
A76: 53
A77: 53
A78: 53
A79: 69
A80: 70
A81: 45
A82: 45
A83: 64
A84: 60
A85: 50
A86: 56
A87: 40
A88: 44
A89: 45
A90: 48
A91: 57
A92: 63
A93: 66
A94: 65
A95: 68
A96: 69
A97: 58
A98: 68
A99: 63
A100: 64
A101: 52
A102: 51
A103: 77
A104: 68
A105: 50
A106: 56
A107: 50
A108: 56
A109: 69
A110: 69
A111: 55
A112: 55
A113: 61
A114: 61
A115: 56
A116: 56
A117: 44
A118: 44
A119: 42
A120: 42
A121: 43
A122: 43
A123: 50
A124: 50
A125: 56
A126: 56
A127: 67
A128: 67
A129: 41
A130: 41
A131: 61
A132: 61
A133: 69
A134: 69
A135: 43
A136: 43
A137: 69
A138: 70
A139: 63
A140: 68
A141: 49
A142: 50
A143: 53
A144: 54
A145: 62
A146: 62
A147: 63
A148: 66
A149: 49
A150: 50
A151: 70
A152: 70
A153: 42
A154: 42
A155: 64
A156: 64
A157: 62
A158: 62
A159: 62
A160: 62
A161: 46
A162: 47
A163: 49
A164: 49
A165: 53
A166: 53
A167: 63
A168: 65
A169: 41
A170: 41
A171: 41
A172: 41
A173: 70
A174: 70
A175: 62
A176: 62
A177: 60
A178: 61
A179: 48
A180: 48
A181: 64
A182: 64
A183: 53
A184: 56
A185: 47
A186: 52
A187: 60
A188: 60
A189: 54
A190: 57
A191: 45
A192: 45
A193: 48
A194: 48
A195: 67
A196: 67
A197: 64
A198: 64
A199: 65
A200: 65
A201: 66
A202: 66
A203: 57
A204: 57
A205: 47
A206: 47
A207: 62
A208: 62
A209: 51
A210: 51
A211: 64
A212: 67
A213: 50
A214: 50
A215: 45
A216: 45
A217: 55
A218: 58
A219: 63
A220: 63
A221: 58
A222: 58
A223: 68
A224: 68
A225: 53
A226: 53
A227: 46
A228: 46
A229: 47
A230: 47
A231: 51
A232: 53
A233: 60
A234: 60
A235: 49
A236: 61
A237: 53
A238: 56
A239: 60
A240: 60
A241: 61
A242: 61
A243: 50
A244: 50
A245: 51
A246: 53
A247: 51
A248: 51
A249: 52
A250: 56
A251: 49
A252: 50
A253: 51
A254: 54
A255: 54
A256: 54
A257: 45
A258: 45
A259: 67
A260: 67
A261: 54
A262: 54
A263: 55
A264: 58
A265: 60
A266: 60

Sheet: throwing
A1: 78
A2: 79
A3: 71
A4: 69
A5: 77
A6: 80
A7: 72
A8: 72
A9: 53
A10: 53
A11: 67
A12: 67
A13: 60
A14: 60
A15: 60
A16: 60
A17: 51
A18: 51
A19: 56
A20: 56
A21: 77
A22: 77
A23: 54
A24: 54
A25: 72
A26: 72
A27: 52
A28: 52
A29: 61
A30: 61
A31: 50
A32: 51
A33: 70
A34: 70
A35: 53
A36: 56
A37: 76
A38: 75
A39: 54
A40: 57
A41: 58
A42: 59
A43: 79
A44: 79
A45: 70
A46: 67
A47: 59
A48: 59
A49: 54
A50: 54
A51: 50
A52: 50
A53: 52
A54: 54
A55: 82
A56: 77
A57: 80
A58: 82
A59: 67
A60: 70
A61: 56
A62: 56
A63: 60
A64: 60
A65: 54
A66: 54
A67: 77
A68: 77
A69: 55
A70: 55
A71: 74
A72: 74
A73: 67
A74: 67
A75: 51
A76: 51
A77: 67
A78: 67
A79: 73
A80: 73
A81: 67
A82: 67
A83: 62
A84: 62
A85: 64
A86: 64
A87: 53
A88: 53
A89: 54
A90: 55
A91: 50
A92: 50
A93: 73
A94: 72
A95: 52
A96: 53
A97: 60
A98: 61
A99: 71
A100: 72
A101: 59
A102: 56
A103: 78
A104: 76
A105: 65
A106: 70
A107: 73
A108: 75
A109: 59
A110: 59
A111: 52
A112: 52
A113: 55
A114: 55
A115: 70
A116: 70
A117: 77
A118: 77
A119: 60
A120: 60
A121: 60
A122: 60
A123: 57
A124: 57
A125: 63
A126: 63
A127: 58
A128: 58
A129: 77
A130: 77
A131: 79
A132: 79
A133: 68
A134: 68
A135: 71
A136: 71
A137: 72
A138: 72
A139: 60
A140: 61
A141: 70
A142: 70
A143: 54
A144: 54
A145: 63
A146: 63
A147: 53
A148: 54
A149: 61
A150: 61
A151: 72
A152: 72
A153: 66
A154: 66
A155: 67
A156: 67
A157: 55
A158: 55
A159: 76
A160: 76
A161: 56
A162: 57
A163: 53
A164: 53
A165: 73
A166: 73
A167: 66
A168: 66
A169: 64
A170: 64
A171: 56
A172: 56
A173: 79
A174: 79
A175: 77
A176: 77
A177: 59
A178: 62
A179: 68
A180: 69
A181: 59
A182: 59
A183: 75
A184: 78
A185: 70
A186: 70
A187: 60
A188: 60
A189: 64
A190: 64
A191: 72
A192: 73
A193: 75
A194: 75
A195: 51
A196: 51
A197: 66
A198: 66
A199: 53
A200: 53
A201: 52
A202: 52
A203: 51
A204: 51
A205: 61
A206: 61
A207: 50
A208: 50
A209: 61
A210: 61
A211: 73
A212: 75
A213: 71
A214: 71
A215: 67
A216: 67
A217: 54
A218: 54
A219: 51
A220: 51
A221: 54
A222: 54
A223: 61
A224: 61
A225: 74
A226: 74
A227: 79
A228: 79
A229: 66
A230: 66
A231: 64
A232: 64
A233: 58
A234: 58
A235: 65
A236: 72
A237: 65
A238: 65
A239: 61
A240: 61
A241: 63
A242: 63
A243: 53
A244: 53
A245: 55
A246: 55
A247: 78
A248: 78
A249: 71
A250: 72
A251: 57
A252: 57
A253: 80
A254: 80
A255: 69
A256: 69
A257: 60
A258: 60
A259: 69
A260: 69
A261: 50
A262: 50
A263: 55
A264: 56
A265: 55
A266: 55

Sheet: melee
A1: 28
A2: 28
A3: 40
A4: 40
A5: 20
A6: 20
A7: 35
A8: 35
A9: 25
A10: 25
A11: 33
A12: 33
A13: 24
A14: 24
A15: 27
A16: 27
A17: 23
A18: 23
A19: 25
A20: 25
A21: 27
A22: 27
A23: 21
A24: 21
A25: 33
A26: 33
A27: 35
A28: 35
A29: 25
A30: 25
A31: 22
A32: 22
A33: 21
A34: 21
A35: 30
A36: 30
A37: 28
A38: 28
A39: 29
A40: 29
A41: 38
A42: 38
A43: 30
A44: 30
A45: 30
A46: 30
A47: 20
A48: 20
A49: 25
A50: 25
A51: 40
A52: 40
A53: 28
A54: 28
A55: 38
A56: 38
A57: 34
A58: 34
A59: 25
A60: 25
A61: 24
A62: 24
A63: 20
A64: 20
A65: 35
A66: 35
A67: 27
A68: 27
A69: 35
A70: 35
A71: 37
A72: 37
A73: 29
A74: 29
A75: 40
A76: 40
A77: 29
A78: 29
A79: 34
A80: 34
A81: 22
A82: 22
A83: 34
A84: 34
A85: 40
A86: 40
A87: 21
A88: 21
A89: 23
A90: 23
A91: 39
A92: 39
A93: 22
A94: 22
A95: 38
A96: 38
A97: 39
A98: 39
A99: 34
A100: 34
A101: 28
A102: 28
A103: 37
A104: 37
A105: 28
A106: 28
A107: 34
A108: 34
A109: 32
A110: 32
A111: 31
A112: 31
A113: 38
A114: 38
A115: 28
A116: 28
A117: 26
A118: 26
A119: 23
A120: 23
A121: 25
A122: 25
A123: 20
A124: 20
A125: 25
A126: 25
A127: 37
A128: 37
A129: 34
A130: 34
A131: 28
A132: 28
A133: 28
A134: 28
A135: 24
A136: 24
A137: 39
A138: 39
A139: 25
A140: 25
A141: 26
A142: 26
A143: 24
A144: 24
A145: 23
A146: 23
A147: 24
A148: 24
A149: 29
A150: 29
A151: 30
A152: 30
A153: 21
A154: 21
A155: 35
A156: 35
A157: 25
A158: 25
A159: 20
A160: 20
A161: 30
A162: 30
A163: 24
A164: 24
A165: 31
A166: 31
A167: 22
A168: 22
A169: 31
A170: 31
A171: 35
A172: 35
A173: 38
A174: 38
A175: 21
A176: 21
A177: 38
A178: 38
A179: 40
A180: 40
A181: 28
A182: 28
A183: 21
A184: 21
A185: 35
A186: 35
A187: 36
A188: 37
A189: 35
A190: 35
A191: 32
A192: 32
A193: 20
A194: 20
A195: 26
A196: 26
A197: 35
A198: 35
A199: 28
A200: 28
A201: 20
A202: 20
A203: 37
A204: 37
A205: 36
A206: 36
A207: 22
A208: 22
A209: 33
A210: 33
A211: 36
A212: 36
A213: 23
A214: 23
A215: 35
A216: 35
A217: 36
A218: 36
A219: 31
A220: 31
A221: 32
A222: 32
A223: 28
A224: 28
A225: 23
A226: 23
A227: 24
A228: 24
A229: 35
A230: 35
A231: 26
A232: 26
A233: 32
A234: 32
A235: 30
A236: 30
A237: 33
A238: 33
A239: 40
A240: 40
A241: 32
A242: 32
A243: 20
A244: 20
A245: 40
A246: 40
A247: 26
A248: 26
A249: 33
A250: 33
A251: 21
A252: 21
A253: 31
A254: 31
A255: 30
A256: 30
A257: 29
A258: 29
A259: 21
A260: 21
A261: 27
A262: 27
A263: 23
A264: 23
A265: 38
A266: 38

Sheet: strength
A1: 20
A2: 25
A3: 31
A4: 26
A5: 26
A6: 26
A7: 25
A8: 25
A9: 37
A10: 37
A11: 28
A12: 28
A13: 28
A14: 28
A15: 33
A16: 33
A17: 24
A18: 24
A19: 20
A20: 20
A21: 27
A22: 27
A23: 32
A24: 32
A25: 26
A26: 26
A27: 32
A28: 32
A29: 26
A30: 26
A31: 30
A32: 34
A33: 23
A34: 29
A35: 24
A36: 26
A37: 26
A38: 22
A39: 28
A40: 35
A41: 33
A42: 38
A43: 29
A44: 34
A45: 36
A46: 33
A47: 34
A48: 34
A49: 25
A50: 28
A51: 27
A52: 25
A53: 25
A54: 38
A55: 49
A56: 39
A57: 31
A58: 39
A59: 39
A60: 49
A61: 22
A62: 22
A63: 31
A64: 31
A65: 22
A66: 22
A67: 21
A68: 21
A69: 35
A70: 35
A71: 32
A72: 32
A73: 26
A74: 26
A75: 29
A76: 29
A77: 27
A78: 27
A79: 25
A80: 31
A81: 34
A82: 36
A83: 35
A84: 29
A85: 39
A86: 45
A87: 30
A88: 40
A89: 28
A90: 34
A91: 36
A92: 43
A93: 25
A94: 23
A95: 36
A96: 41
A97: 31
A98: 36
A99: 20
A100: 27
A101: 29
A102: 22
A103: 34
A104: 22
A105: 20
A106: 28
A107: 30
A108: 31
A109: 25
A110: 25
A111: 40
A112: 40
A113: 26
A114: 26
A115: 20
A116: 20
A117: 36
A118: 36
A119: 23
A120: 23
A121: 32
A122: 32
A123: 21
A124: 21
A125: 20
A126: 20
A127: 31
A128: 31
A129: 24
A130: 24
A131: 31
A132: 31
A133: 38
A134: 38
A135: 22
A136: 22
A137: 35
A138: 35
A139: 25
A140: 31
A141: 33
A142: 41
A143: 36
A144: 39
A145: 20
A146: 20
A147: 20
A148: 31
A149: 29
A150: 38
A151: 28
A152: 33
A153: 30
A154: 30
A155: 20
A156: 20
A157: 40
A158: 40
A159: 24
A160: 24
A161: 22
A162: 31
A163: 37
A164: 37
A165: 36
A166: 39
A167: 29
A168: 29
A169: 22
A170: 22
A171: 40
A172: 40
A173: 33
A174: 33
A175: 34
A176: 34
A177: 27
A178: 33
A179: 31
A180: 31
A181: 30
A182: 30
A183: 34
A184: 36
A185: 34
A186: 42
A187: 22
A188: 24
A189: 39
A190: 40
A191: 36
A192: 36
A193: 20
A194: 20
A195: 26
A196: 26
A197: 38
A198: 38
A199: 37
A200: 37
A201: 33
A202: 33
A203: 24
A204: 24
A205: 33
A206: 33
A207: 40
A208: 40
A209: 34
A210: 34
A211: 24
A212: 32
A213: 36
A214: 36
A215: 27
A216: 27
A217: 20
A218: 20
A219: 35
A220: 35
A221: 36
A222: 36
A223: 25
A224: 25
A225: 29
A226: 29
A227: 21
A228: 21
A229: 40
A230: 40
A231: 24
A232: 25
A233: 23
A234: 28
A235: 29
A236: 44
A237: 24
A238: 25
A239: 27
A240: 27
A241: 40
A242: 40
A243: 34
A244: 34
A245: 33
A246: 35
A247: 29
A248: 29
A249: 39
A250: 45
A251: 21
A252: 21
A253: 36
A254: 40
A255: 40
A256: 40
A257: 38
A258: 38
A259: 22
A260: 22
A261: 30
A262: 30
A263: 36
A264: 38
A265: 22
A266: 22

Sheet: psiStrength
A1: 73
A2: 73
A3: 56
A4: 56
A5: 30
A6: 30
A7: 27
A8: 27
A9: 36
A10: 36
A11: 84
A12: 84
A13: 55
A14: 55
A15: 10
A16: 10
A17: 65
A18: 65
A19: 95
A20: 95
A21: 37
A22: 37
A23: 0
A24: 0
A25: 76
A26: 76
A27: 1
A28: 1
A29: 52
A30: 52
A31: 73
A32: 73
A33: 94
A34: 94
A35: 39
A36: 39
A37: 63
A38: 63
A39: 5
A40: 6
A41: 32
A42: 32
A43: 57
A44: 57
A45: 67
A46: 67
A47: 36
A48: 36
A49: 98
A50: 98
A51: 35
A52: 35
A53: 18
A54: 19
A55: 46
A56: 46
A57: 99
A58: 99
A59: 75
A60: 75
A61: 14
A62: 14
A63: 81
A64: 81
A65: 84
A66: 84
A67: 83
A68: 83
A69: 81
A70: 81
A71: 64
A72: 64
A73: 39
A74: 39
A75: 93
A76: 93
A77: 12
A78: 12
A79: 23
A80: 23
A81: 6
A82: 7
A83: 4
A84: 3
A85: 80
A86: 80
A87: 60
A88: 60
A89: 94
A90: 94
A91: 75
A92: 75
A93: 86
A94: 86
A95: 62
A96: 62
A97: 93
A98: 93
A99: 41
A100: 41
A101: 51
A102: 51
A103: 9
A104: 8
A105: 51
A106: 51
A107: 18
A108: 18
A109: 94
A110: 94
A111: 86
A112: 86
A113: 78
A114: 78
A115: 97
A116: 97
A117: 66
A118: 66
A119: 29
A120: 29
A121: 1
A122: 1
A123: 31
A124: 31
A125: 77
A126: 77
A127: 46
A128: 46
A129: 90
A130: 90
A131: 65
A132: 65
A133: 87
A134: 87
A135: 21
A136: 21
A137: 16
A138: 16
A139: 13
A140: 14
A141: 73
A142: 73
A143: 2
A144: 2
A145: 37
A146: 37
A147: 95
A148: 95
A149: 96
A150: 96
A151: 75
A152: 75
A153: 52
A154: 52
A155: 92
A156: 92
A157: 46
A158: 46
A159: 63
A160: 63
A161: 26
A162: 26
A163: 10
A164: 10
A165: 5
A166: 5
A167: 9
A168: 9
A169: 14
A170: 14
A171: 2
A172: 2
A173: 8
A174: 8
A175: 65
A176: 65
A177: 13
A178: 13
A179: 100
A180: 100
A181: 57
A182: 57
A183: 79
A184: 79
A185: 25
A186: 26
A187: 52
A188: 52
A189: 98
A190: 98
A191: 63
A192: 63
A193: 84
A194: 84
A195: 8
A196: 8
A197: 23
A198: 23
A199: 5
A200: 5
A201: 61
A202: 61
A203: 10
A204: 10
A205: 3
A206: 3
A207: 30
A208: 30
A209: 85
A210: 85
A211: 61
A212: 61
A213: 48
A214: 48
A215: 83
A216: 83
A217: 6
A218: 6
A219: 16
A220: 16
A221: 58
A222: 58
A223: 64
A224: 64
A225: 61
A226: 61
A227: 87
A228: 87
A229: 34
A230: 34
A231: 69
A232: 69
A233: 29
A234: 29
A235: 72
A236: 72
A237: 12
A238: 12
A239: 1
A240: 1
A241: 16
A242: 16
A243: 59
A244: 59
A245: 29
A246: 29
A247: 79
A248: 79
A249: 16
A250: 16
A251: 79
A252: 79
A253: 30
A254: 30
A255: 67
A256: 67
A257: 70
A258: 70
A259: 8
A260: 8
A261: 68
A262: 68
A263: 57
A264: 57
A265: 16
A266: 16

Sheet: psiSkill
A1: 0
A2: 0
A3: 0
A4: 0
A5: 0
A6: 0
A7: 0
A8: 0
A9: 0
A10: 0
A11: 0
A12: 0
A13: 0
A14: 0
A15: 0
A16: 0
A17: 0
A18: 0
A19: 0
A20: 0
A21: 0
A22: 0
A23: 0
A24: 0
A25: 0
A26: 0
A27: 0
A28: 0
A29: 0
A30: 0
A31: 0
A32: 0
A33: 0
A34: 0
A35: 0
A36: 0
A37: 0
A38: 0
A39: 0
A40: 0
A41: 0
A42: 0
A43: 0
A44: 0
A45: 0
A46: 0
A47: 0
A48: 0
A49: 0
A50: 0
A51: 0
A52: 0
A53: 0
A54: 0
A55: 0
A56: 0
A57: 0
A58: 0
A59: 0
A60: 0
A61: 0
A62: 0
A63: 0
A64: 0
A65: 0
A66: 0
A67: 0
A68: 0
A69: 0
A70: 0
A71: 0
A72: 0
A73: 0
A74: 0
A75: 0
A76: 0
A77: 0
A78: 0
A79: 0
A80: 0
A81: 0
A82: 0
A83: 0
A84: 0
A85: 0
A86: 0
A87: 0
A88: 0
A89: 0
A90: 0
A91: 0
A92: 0
A93: 0
A94: 0
A95: 0
A96: 0
A97: 0
A98: 0
A99: 0
A100: 0
A101: 0
A102: 0
A103: 0
A104: 0
A105: 0
A106: 0
A107: 0
A108: 0
A109: 0
A110: 0
A111: 0
A112: 0
A113: 0
A114: 0
A115: 0
A116: 0
A117: 0
A118: 0
A119: 0
A120: 0
A121: 0
A122: 0
A123: 0
A124: 0
A125: 0
A126: 0
A127: 0
A128: 0
A129: 0
A130: 0
A131: 0
A132: 0
A133: 0
A134: 0
A135: 0
A136: 0
A137: 0
A138: 0
A139: 0
A140: 0
A141: 0
A142: 0
A143: 0
A144: 0
A145: 0
A146: 0
A147: 0
A148: 0
A149: 0
A150: 0
A151: 0
A152: 0
A153: 0
A154: 0
A155: 0
A156: 0
A157: 0
A158: 0
A159: 0
A160: 0
A161: 0
A162: 0
A163: 0
A164: 0
A165: 0
A166: 0
A167: 0
A168: 0
A169: 0
A170: 0
A171: 0
A172: 0
A173: 0
A174: 0
A175: 0
A176: 0
A177: 0
A178: 0
A179: 0
A180: 0
A181: 0
A182: 0
A183: 0
A184: 0
A185: 0
A186: 0
A187: 0
A188: 0
A189: 0
A190: 0
A191: 0
A192: 0
A193: 0
A194: 0
A195: 0
A196: 0
A197: 0
A198: 0
A199: 0
A200: 0
A201: 0
A202: 0
A203: 0
A204: 0
A205: 0
A206: 0
A207: 0
A208: 0
A209: 0
A210: 0
A211: 0
A212: 0
A213: 0
A214: 0
A215: 0
A216: 0
A217: 0
A218: 0
A219: 0
A220: 0
A221: 0
A222: 0
A223: 0
A224: 0
A225: 0
A226: 0
A227: 0
A228: 0
A229: 0
A230: 0
A231: 0
A232: 0
A233: 0
A234: 0
A235: 0
A236: 0
A237: 0
A238: 0
A239: 0
A240: 0
A241: 0
A242: 0
A243: 0
A244: 0
A245: 0
A246: 0
A247: 0
A248: 0
A249: 0
A250: 0
A251: 0
A252: 0
A253: 0
A254: 0
A255: 0
A256: 0
A257: 0
A258: 0
A259: 0
A260: 0
A261: 0
A262: 0
A263: 0
A264: 0
A265: 0
A266: 0

Sheet: ImprovedPsiSkill
A1: 0
A2: 0
A3: 0
A4: 0
A5: 0
A6: 0
A7: 0
A8: 0
A9: 0
A10: 0
A11: 0
A12: 0
A13: 0
A14: 0
A15: 0
A16: 0
A17: 0
A18: 0
A19: 0
A20: 0
A21: 0
A22: 0
A23: 0
A24: 0
A25: 0
A26: 0
A27: 0
A28: 0
A29: 0
A30: 0
A31: 0
A32: 0
A33: 0
A34: 0
A35: 0
A36: 0
A37: 0
A38: 0
A39: 0
A40: 0
A41: 0
A42: 0
A43: 0
A44: 0
A45: 0
A46: 0
A47: 0
A48: 0
A49: 0
A50: 0
A51: 0
A52: 0
A53: 0
A54: 0
A55: 0
A56: 0
A57: 0
A58: 0
A59: 0
A60: 0
A61: 0
A62: 0
A63: 0
A64: 0
A65: 0
A66: 0
A67: 0
A68: 0
A69: 0
A70: 0
A71: 0
A72: 0
A73: 0
A74: 0
A75: 0
A76: 0
A77: 0
A78: 0
A79: 0
A80: 0
A81: 0
A82: 0
A83: 0
A84: 0
A85: 0
A86: 0
A87: 0
A88: 0
A89: 0
A90: 0
A91: 0
A92: 0
A93: 0
A94: 0
A95: 0
A96: 0
A97: 0
A98: 0
A99: 0
A100: 0
A101: 0
A102: 0
A103: 0
A104: 0
A105: 0
A106: 0
A107: 0
A108: 0
A109: 0
A110: 0
A111: 0
A112: 0
A113: 0
A114: 0
A115: 0
A116: 0
A117: 0
A118: 0
A119: 0
A120: 0
A121: 0
A122: 0
A123: 0
A124: 0
A125: 0
A126: 0
A127: 0
A128: 0
A129: 0
A130: 0
A131: 0
A132: 0
A133: 0